No.     DeltaTime Time                    Source                Destination           Protocol Length Stream Index Info                                                            SrcPort DstPort Src Time
     10 0.000s    2025-07-04 06:44:32.233 192.168.15.139        GYANDE2L.ptcnet.ptc.com OpcUa    125    2            Hello message                                                   50851   49320   

Frame 10: 125 bytes on wire (1000 bits), 125 bytes captured (1000 bits) on interface \Device\NPF_{AF38AF37-B5CF-4E8F-867B-264BC8F540A8}, id 0
Ethernet II, Src: VMware_c0:b1:ab (00:0c:29:c0:b1:ab), Dst: VMware_f9:fd:da (00:50:56:f9:fd:da)
Internet Protocol Version 4, Src: 192.168.15.139 (192.168.15.139), Dst: GYANDE2L.ptcnet.ptc.com (100.64.1.34)
Transmission Control Protocol, Src Port: 50851, Dst Port: 49320, Seq: 1, Ack: 1, Len: 71
OpcUa Binary Protocol
    Message Type: HEL
    Chunk Type: F
    Message Size: 71
    Version: 0
    ReceiveBufferSize: 65536
    SendBufferSize: 65536
    MaxMessageSize: 16777216
    MaxChunkCount: 5000
    EndpointUrl: opc.tcp://GYANDE2L.ptcnet.ptc.com:49320

No.     DeltaTime Time                    Source                Destination           Protocol Length Stream Index Info                                                            SrcPort DstPort Src Time
     12 0.061s    2025-07-04 06:44:32.295 GYANDE2L.ptcnet.ptc.com 192.168.15.139        OpcUa    82     2            Acknowledge message                                             49320   50851   

Frame 12: 82 bytes on wire (656 bits), 82 bytes captured (656 bits) on interface \Device\NPF_{AF38AF37-B5CF-4E8F-867B-264BC8F540A8}, id 0
Ethernet II, Src: VMware_f9:fd:da (00:50:56:f9:fd:da), Dst: VMware_c0:b1:ab (00:0c:29:c0:b1:ab)
Internet Protocol Version 4, Src: GYANDE2L.ptcnet.ptc.com (100.64.1.34), Dst: 192.168.15.139 (192.168.15.139)
Transmission Control Protocol, Src Port: 49320, Dst Port: 50851, Seq: 1, Ack: 72, Len: 28
OpcUa Binary Protocol
    Message Type: ACK
    Chunk Type: F
    Message Size: 28
    Version: 0
    ReceiveBufferSize: 65536
    SendBufferSize: 65536
    MaxMessageSize: 16777216
    MaxChunkCount: 5000

No.     DeltaTime Time                    Source                Destination           Protocol Length Stream Index Info                                                            SrcPort DstPort Src Time
     13 0.000s    2025-07-04 06:44:32.295 192.168.15.139        GYANDE2L.ptcnet.ptc.com OpcUa    187    2            OpenSecureChannel message                                       50851   49320   

Frame 13: 187 bytes on wire (1496 bits), 187 bytes captured (1496 bits) on interface \Device\NPF_{AF38AF37-B5CF-4E8F-867B-264BC8F540A8}, id 0
Ethernet II, Src: VMware_c0:b1:ab (00:0c:29:c0:b1:ab), Dst: VMware_f9:fd:da (00:50:56:f9:fd:da)
Internet Protocol Version 4, Src: 192.168.15.139 (192.168.15.139), Dst: GYANDE2L.ptcnet.ptc.com (100.64.1.34)
Transmission Control Protocol, Src Port: 50851, Dst Port: 49320, Seq: 72, Ack: 29, Len: 133
OpcUa Binary Protocol
    Message Type: OPN
    Chunk Type: F
    Message Size: 133
    SecureChannelId: 0
    SecurityPolicyUri: http://opcfoundation.org/UA/SecurityPolicy#None
    SenderCertificate: <MISSING>[OpcUa Null ByteString]
    ReceiverCertificateThumbprint: <MISSING>[OpcUa Null ByteString]
    Sequence Number: 1
    RequestId: 1
    Message: Encodeable Object
        TypeId: ExpandedNodeId
        OpenSecureChannelRequest

No.     DeltaTime Time                    Source                Destination           Protocol Length Stream Index Info                                                            SrcPort DstPort Src Time
     16 0.286s    2025-07-04 06:44:32.581 GYANDE2L.ptcnet.ptc.com 192.168.15.139        OpcUa    189    2            OpenSecureChannel message                                       49320   50851   

Frame 16: 189 bytes on wire (1512 bits), 189 bytes captured (1512 bits) on interface \Device\NPF_{AF38AF37-B5CF-4E8F-867B-264BC8F540A8}, id 0
Ethernet II, Src: VMware_f9:fd:da (00:50:56:f9:fd:da), Dst: VMware_c0:b1:ab (00:0c:29:c0:b1:ab)
Internet Protocol Version 4, Src: GYANDE2L.ptcnet.ptc.com (100.64.1.34), Dst: 192.168.15.139 (192.168.15.139)
Transmission Control Protocol, Src Port: 49320, Dst Port: 50851, Seq: 29, Ack: 205, Len: 135
OpcUa Binary Protocol
    Message Type: OPN
    Chunk Type: F
    Message Size: 135
    SecureChannelId: 2055287097
    SecurityPolicyUri: http://opcfoundation.org/UA/SecurityPolicy#None
    SenderCertificate: <MISSING>[OpcUa Null ByteString]
    ReceiverCertificateThumbprint: <MISSING>[OpcUa Null ByteString]
    Sequence Number: 512
    RequestId: 1
    Message: Encodeable Object
        TypeId: ExpandedNodeId
        OpenSecureChannelResponse

No.     DeltaTime Time                    Source                Destination           Protocol Length Stream Index Info                                                            SrcPort DstPort Src Time
     17 0.000s    2025-07-04 06:44:32.582 192.168.15.139        GYANDE2L.ptcnet.ptc.com OpcUa    162    2            UA Secure Conversation Message: GetEndpointsRequest             50851   49320   

Frame 17: 162 bytes on wire (1296 bits), 162 bytes captured (1296 bits) on interface \Device\NPF_{AF38AF37-B5CF-4E8F-867B-264BC8F540A8}, id 0
Ethernet II, Src: VMware_c0:b1:ab (00:0c:29:c0:b1:ab), Dst: VMware_f9:fd:da (00:50:56:f9:fd:da)
Internet Protocol Version 4, Src: 192.168.15.139 (192.168.15.139), Dst: GYANDE2L.ptcnet.ptc.com (100.64.1.34)
Transmission Control Protocol, Src Port: 50851, Dst Port: 49320, Seq: 205, Ack: 164, Len: 108
OpcUa Binary Protocol
    Message Type: MSG
    Chunk Type: F
    Message Size: 108
    SecureChannelId: 2055287097
    Security Token Id: 1
    Sequence Number: 2
    RequestId: 2
    Message: Encodeable Object
        TypeId: ExpandedNodeId
        GetEndpointsRequest

No.     DeltaTime Time                    Source                Destination           Protocol Length Stream Index Info                                                            SrcPort DstPort Src Time
     21 0.020s    2025-07-04 06:44:32.602 GYANDE2L.ptcnet.ptc.com 192.168.15.139        OpcUa    574    2            UA Secure Conversation Message: GetEndpointsResponse            49320   50851   

Frame 21: 574 bytes on wire (4592 bits), 574 bytes captured (4592 bits) on interface \Device\NPF_{AF38AF37-B5CF-4E8F-867B-264BC8F540A8}, id 0
Ethernet II, Src: VMware_f9:fd:da (00:50:56:f9:fd:da), Dst: VMware_c0:b1:ab (00:0c:29:c0:b1:ab)
Internet Protocol Version 4, Src: GYANDE2L.ptcnet.ptc.com (100.64.1.34), Dst: 192.168.15.139 (192.168.15.139)
Transmission Control Protocol, Src Port: 49320, Dst Port: 50851, Seq: 1640, Ack: 313, Len: 520
[3 Reassembled TCP Segments (1996 bytes): #19(16), #20(1460), #21(520)]
OpcUa Binary Protocol
    Message Type: MSG
    Chunk Type: F
    Message Size: 1996
    SecureChannelId: 2055287097
    Security Token Id: 1
    Sequence Number: 513
    RequestId: 2
    Message: Encodeable Object
        TypeId: ExpandedNodeId
        GetEndpointsResponse

No.     DeltaTime Time                    Source                Destination           Protocol Length Stream Index Info                                                            SrcPort DstPort Src Time
     23 0.000s    2025-07-04 06:44:32.602 192.168.15.139        GYANDE2L.ptcnet.ptc.com OpcUa    111    2            CloseSecureChannel message: CloseSecureChannelRequest           50851   49320   

Frame 23: 111 bytes on wire (888 bits), 111 bytes captured (888 bits) on interface \Device\NPF_{AF38AF37-B5CF-4E8F-867B-264BC8F540A8}, id 0
Ethernet II, Src: VMware_c0:b1:ab (00:0c:29:c0:b1:ab), Dst: VMware_f9:fd:da (00:50:56:f9:fd:da)
Internet Protocol Version 4, Src: 192.168.15.139 (192.168.15.139), Dst: GYANDE2L.ptcnet.ptc.com (100.64.1.34)
Transmission Control Protocol, Src Port: 50851, Dst Port: 49320, Seq: 313, Ack: 2160, Len: 57
OpcUa Binary Protocol
    Message Type: CLO
    Chunk Type: F
    Message Size: 57
    SecureChannelId: 2055287097
    Security Token Id: 1
    Sequence Number: 3
    RequestId: 3
    Message: Encodeable Object
        TypeId: ExpandedNodeId
        CloseSecureChannelRequest

No.     DeltaTime Time                    Source                Destination           Protocol Length Stream Index Info                                                            SrcPort DstPort Src Time
     32 0.296s    2025-07-04 06:44:32.899 192.168.15.139        GYANDE2L.ptcnet.ptc.com OpcUa    125    3            Hello message                                                   50852   49320   

Frame 32: 125 bytes on wire (1000 bits), 125 bytes captured (1000 bits) on interface \Device\NPF_{AF38AF37-B5CF-4E8F-867B-264BC8F540A8}, id 0
Ethernet II, Src: VMware_c0:b1:ab (00:0c:29:c0:b1:ab), Dst: VMware_f9:fd:da (00:50:56:f9:fd:da)
Internet Protocol Version 4, Src: 192.168.15.139 (192.168.15.139), Dst: GYANDE2L.ptcnet.ptc.com (100.64.1.34)
Transmission Control Protocol, Src Port: 50852, Dst Port: 49320, Seq: 1, Ack: 1, Len: 71
OpcUa Binary Protocol
    Message Type: HEL
    Chunk Type: F
    Message Size: 71
    Version: 0
    ReceiveBufferSize: 65536
    SendBufferSize: 65536
    MaxMessageSize: 16777216
    MaxChunkCount: 5000
    EndpointUrl: opc.tcp://GYANDE2L.ptcnet.ptc.com:49320

No.     DeltaTime Time                    Source                Destination           Protocol Length Stream Index Info                                                            SrcPort DstPort Src Time
     34 0.278s    2025-07-04 06:44:33.177 GYANDE2L.ptcnet.ptc.com 192.168.15.139        OpcUa    82     3            Acknowledge message                                             49320   50852   

Frame 34: 82 bytes on wire (656 bits), 82 bytes captured (656 bits) on interface \Device\NPF_{AF38AF37-B5CF-4E8F-867B-264BC8F540A8}, id 0
Ethernet II, Src: VMware_f9:fd:da (00:50:56:f9:fd:da), Dst: VMware_c0:b1:ab (00:0c:29:c0:b1:ab)
Internet Protocol Version 4, Src: GYANDE2L.ptcnet.ptc.com (100.64.1.34), Dst: 192.168.15.139 (192.168.15.139)
Transmission Control Protocol, Src Port: 49320, Dst Port: 50852, Seq: 1, Ack: 72, Len: 28
OpcUa Binary Protocol
    Message Type: ACK
    Chunk Type: F
    Message Size: 28
    Version: 0
    ReceiveBufferSize: 65536
    SendBufferSize: 65536
    MaxMessageSize: 16777216
    MaxChunkCount: 5000

No.     DeltaTime Time                    Source                Destination           Protocol Length Stream Index Info                                                            SrcPort DstPort Src Time
     35 0.001s    2025-07-04 06:44:33.178 192.168.15.139        GYANDE2L.ptcnet.ptc.com OpcUa    187    3            OpenSecureChannel message                                       50852   49320   

Frame 35: 187 bytes on wire (1496 bits), 187 bytes captured (1496 bits) on interface \Device\NPF_{AF38AF37-B5CF-4E8F-867B-264BC8F540A8}, id 0
Ethernet II, Src: VMware_c0:b1:ab (00:0c:29:c0:b1:ab), Dst: VMware_f9:fd:da (00:50:56:f9:fd:da)
Internet Protocol Version 4, Src: 192.168.15.139 (192.168.15.139), Dst: GYANDE2L.ptcnet.ptc.com (100.64.1.34)
Transmission Control Protocol, Src Port: 50852, Dst Port: 49320, Seq: 72, Ack: 29, Len: 133
OpcUa Binary Protocol
    Message Type: OPN
    Chunk Type: F
    Message Size: 133
    SecureChannelId: 0
    SecurityPolicyUri: http://opcfoundation.org/UA/SecurityPolicy#None
    SenderCertificate: <MISSING>[OpcUa Null ByteString]
    ReceiverCertificateThumbprint: <MISSING>[OpcUa Null ByteString]
    Sequence Number: 1
    RequestId: 1
    Message: Encodeable Object
        TypeId: ExpandedNodeId
        OpenSecureChannelRequest

No.     DeltaTime Time                    Source                Destination           Protocol Length Stream Index Info                                                            SrcPort DstPort Src Time
     37 0.059s    2025-07-04 06:44:33.238 GYANDE2L.ptcnet.ptc.com 192.168.15.139        OpcUa    189    3            OpenSecureChannel message                                       49320   50852   

Frame 37: 189 bytes on wire (1512 bits), 189 bytes captured (1512 bits) on interface \Device\NPF_{AF38AF37-B5CF-4E8F-867B-264BC8F540A8}, id 0
Ethernet II, Src: VMware_f9:fd:da (00:50:56:f9:fd:da), Dst: VMware_c0:b1:ab (00:0c:29:c0:b1:ab)
Internet Protocol Version 4, Src: GYANDE2L.ptcnet.ptc.com (100.64.1.34), Dst: 192.168.15.139 (192.168.15.139)
Transmission Control Protocol, Src Port: 49320, Dst Port: 50852, Seq: 29, Ack: 205, Len: 135
OpcUa Binary Protocol
    Message Type: OPN
    Chunk Type: F
    Message Size: 135
    SecureChannelId: 1364440749
    SecurityPolicyUri: http://opcfoundation.org/UA/SecurityPolicy#None
    SenderCertificate: <MISSING>[OpcUa Null ByteString]
    ReceiverCertificateThumbprint: <MISSING>[OpcUa Null ByteString]
    Sequence Number: 512
    RequestId: 1
    Message: Encodeable Object
        TypeId: ExpandedNodeId
        OpenSecureChannelResponse

No.     DeltaTime Time                    Source                Destination           Protocol Length Stream Index Info                                                            SrcPort DstPort Src Time
     38 0.000s    2025-07-04 06:44:33.238 192.168.15.139        GYANDE2L.ptcnet.ptc.com OpcUa    348    3            UA Secure Conversation Message: CreateSessionRequest            50852   49320   

Frame 38: 348 bytes on wire (2784 bits), 348 bytes captured (2784 bits) on interface \Device\NPF_{AF38AF37-B5CF-4E8F-867B-264BC8F540A8}, id 0
Ethernet II, Src: VMware_c0:b1:ab (00:0c:29:c0:b1:ab), Dst: VMware_f9:fd:da (00:50:56:f9:fd:da)
Internet Protocol Version 4, Src: 192.168.15.139 (192.168.15.139), Dst: GYANDE2L.ptcnet.ptc.com (100.64.1.34)
Transmission Control Protocol, Src Port: 50852, Dst Port: 49320, Seq: 205, Ack: 164, Len: 294
OpcUa Binary Protocol
    Message Type: MSG
    Chunk Type: F
    Message Size: 294
    SecureChannelId: 1364440749
    Security Token Id: 1
    Sequence Number: 2
    RequestId: 2
    Message: Encodeable Object
        TypeId: ExpandedNodeId
        CreateSessionRequest

No.     DeltaTime Time                    Source                Destination           Protocol Length Stream Index Info                                                            SrcPort DstPort Src Time
     42 0.067s    2025-07-04 06:44:33.306 GYANDE2L.ptcnet.ptc.com 192.168.15.139        OpcUa    562    3            UA Secure Conversation Message: CreateSessionResponse           49320   50852   

Frame 42: 562 bytes on wire (4496 bits), 562 bytes captured (4496 bits) on interface \Device\NPF_{AF38AF37-B5CF-4E8F-867B-264BC8F540A8}, id 0
Ethernet II, Src: VMware_f9:fd:da (00:50:56:f9:fd:da), Dst: VMware_c0:b1:ab (00:0c:29:c0:b1:ab)
Internet Protocol Version 4, Src: GYANDE2L.ptcnet.ptc.com (100.64.1.34), Dst: 192.168.15.139 (192.168.15.139)
Transmission Control Protocol, Src Port: 49320, Dst Port: 50852, Seq: 3084, Ack: 499, Len: 508
[3 Reassembled TCP Segments (3428 bytes): #40(1460), #41(1460), #42(508)]
OpcUa Binary Protocol
    Message Type: MSG
    Chunk Type: F
    Message Size: 3428
    SecureChannelId: 1364440749
    Security Token Id: 1
    Sequence Number: 513
    RequestId: 2
    Message: Encodeable Object
        TypeId: ExpandedNodeId
        CreateSessionResponse

No.     DeltaTime Time                    Source                Destination           Protocol Length Stream Index Info                                                            SrcPort DstPort Src Time
     44 0.000s    2025-07-04 06:44:33.307 192.168.15.139        GYANDE2L.ptcnet.ptc.com OpcUa    171    3            UA Secure Conversation Message: ActivateSessionRequest          50852   49320   

Frame 44: 171 bytes on wire (1368 bits), 171 bytes captured (1368 bits) on interface \Device\NPF_{AF38AF37-B5CF-4E8F-867B-264BC8F540A8}, id 0
Ethernet II, Src: VMware_c0:b1:ab (00:0c:29:c0:b1:ab), Dst: VMware_f9:fd:da (00:50:56:f9:fd:da)
Internet Protocol Version 4, Src: 192.168.15.139 (192.168.15.139), Dst: GYANDE2L.ptcnet.ptc.com (100.64.1.34)
Transmission Control Protocol, Src Port: 50852, Dst Port: 49320, Seq: 499, Ack: 3592, Len: 117
OpcUa Binary Protocol
    Message Type: MSG
    Chunk Type: F
    Message Size: 117
    SecureChannelId: 1364440749
    Security Token Id: 1
    Sequence Number: 3
    RequestId: 3
    Message: Encodeable Object
        TypeId: ExpandedNodeId
        ActivateSessionRequest

No.     DeltaTime Time                    Source                Destination           Protocol Length Stream Index Info                                                            SrcPort DstPort Src Time
     46 0.018s    2025-07-04 06:44:33.326 GYANDE2L.ptcnet.ptc.com 192.168.15.139        OpcUa    150    3            UA Secure Conversation Message: ActivateSessionResponse         49320   50852   

Frame 46: 150 bytes on wire (1200 bits), 150 bytes captured (1200 bits) on interface \Device\NPF_{AF38AF37-B5CF-4E8F-867B-264BC8F540A8}, id 0
Ethernet II, Src: VMware_f9:fd:da (00:50:56:f9:fd:da), Dst: VMware_c0:b1:ab (00:0c:29:c0:b1:ab)
Internet Protocol Version 4, Src: GYANDE2L.ptcnet.ptc.com (100.64.1.34), Dst: 192.168.15.139 (192.168.15.139)
Transmission Control Protocol, Src Port: 49320, Dst Port: 50852, Seq: 3592, Ack: 616, Len: 96
OpcUa Binary Protocol
    Message Type: MSG
    Chunk Type: F
    Message Size: 96
    SecureChannelId: 1364440749
    Security Token Id: 1
    Sequence Number: 514
    RequestId: 3
    Message: Encodeable Object
        TypeId: ExpandedNodeId
        ActivateSessionResponse

No.     DeltaTime Time                    Source                Destination           Protocol Length Stream Index Info                                                            SrcPort DstPort Src Time
     47 0.000s    2025-07-04 06:44:33.326 192.168.15.139        GYANDE2L.ptcnet.ptc.com OpcUa    168    3            UA Secure Conversation Message: ReadRequest                     50852   49320   

Frame 47: 168 bytes on wire (1344 bits), 168 bytes captured (1344 bits) on interface \Device\NPF_{AF38AF37-B5CF-4E8F-867B-264BC8F540A8}, id 0
Ethernet II, Src: VMware_c0:b1:ab (00:0c:29:c0:b1:ab), Dst: VMware_f9:fd:da (00:50:56:f9:fd:da)
Internet Protocol Version 4, Src: 192.168.15.139 (192.168.15.139), Dst: GYANDE2L.ptcnet.ptc.com (100.64.1.34)
Transmission Control Protocol, Src Port: 50852, Dst Port: 49320, Seq: 616, Ack: 3688, Len: 114
OpcUa Binary Protocol
    Message Type: MSG
    Chunk Type: F
    Message Size: 114
    SecureChannelId: 1364440749
    Security Token Id: 1
    Sequence Number: 4
    RequestId: 4
    Message: Encodeable Object
        TypeId: ExpandedNodeId
        ReadRequest
            RequestHeader: RequestHeader
            MaxAge: 0
            TimestampsToReturn: Neither (0x00000003)
            NodesToRead: Array of ReadValueId
                ArraySize: 2
                [0]: ReadValueId
                    NodeId: NodeId
                        .... 0001 = EncodingMask: Four byte encoded Numeric (0x1)
                        Namespace Index: 0
                        Identifier Numeric: 11702
                    AttributeId: Value (0x0000000d)
                    IndexRange: [OpcUa Null String]
                    DataEncoding: QualifiedName
                        Id: 0
                        Name: [OpcUa Null String]
                [1]: ReadValueId
                    NodeId: NodeId
                        .... 0001 = EncodingMask: Four byte encoded Numeric (0x1)
                        Namespace Index: 0
                        Identifier Numeric: 11705
                    AttributeId: Value (0x0000000d)
                    IndexRange: [OpcUa Null String]
                    DataEncoding: QualifiedName
                        Id: 0
                        Name: [OpcUa Null String]

No.     DeltaTime Time                    Source                Destination           Protocol Length Stream Index Info                                                            SrcPort DstPort Src Time
     49 0.057s    2025-07-04 06:44:33.383 GYANDE2L.ptcnet.ptc.com 192.168.15.139        OpcUa    124    3            UA Secure Conversation Message: ReadResponse                    49320   50852   

Frame 49: 124 bytes on wire (992 bits), 124 bytes captured (992 bits) on interface \Device\NPF_{AF38AF37-B5CF-4E8F-867B-264BC8F540A8}, id 0
Ethernet II, Src: VMware_f9:fd:da (00:50:56:f9:fd:da), Dst: VMware_c0:b1:ab (00:0c:29:c0:b1:ab)
Internet Protocol Version 4, Src: GYANDE2L.ptcnet.ptc.com (100.64.1.34), Dst: 192.168.15.139 (192.168.15.139)
Transmission Control Protocol, Src Port: 49320, Dst Port: 50852, Seq: 3688, Ack: 730, Len: 70
OpcUa Binary Protocol
    Message Type: MSG
    Chunk Type: F
    Message Size: 70
    SecureChannelId: 1364440749
    Security Token Id: 1
    Sequence Number: 515
    RequestId: 4
    Message: Encodeable Object
        TypeId: ExpandedNodeId
        ReadResponse

No.     DeltaTime Time                    Source                Destination           Protocol Length Stream Index Info                                                            SrcPort DstPort Src Time
     50 0.000s    2025-07-04 06:44:33.383 192.168.15.139        GYANDE2L.ptcnet.ptc.com OpcUa    474    3            UA Secure Conversation Message: ReadRequest                     50852   49320   

Frame 50: 474 bytes on wire (3792 bits), 474 bytes captured (3792 bits) on interface \Device\NPF_{AF38AF37-B5CF-4E8F-867B-264BC8F540A8}, id 0
Ethernet II, Src: VMware_c0:b1:ab (00:0c:29:c0:b1:ab), Dst: VMware_f9:fd:da (00:50:56:f9:fd:da)
Internet Protocol Version 4, Src: 192.168.15.139 (192.168.15.139), Dst: GYANDE2L.ptcnet.ptc.com (100.64.1.34)
Transmission Control Protocol, Src Port: 50852, Dst Port: 49320, Seq: 730, Ack: 3758, Len: 420
OpcUa Binary Protocol
    Message Type: MSG
    Chunk Type: F
    Message Size: 420
    SecureChannelId: 1364440749
    Security Token Id: 1
    Sequence Number: 5
    RequestId: 5
    Message: Encodeable Object
        TypeId: ExpandedNodeId
        ReadRequest
            RequestHeader: RequestHeader
            MaxAge: 0
            TimestampsToReturn: Neither (0x00000003)
            NodesToRead: Array of ReadValueId
                ArraySize: 19
                [0]: ReadValueId
                    NodeId: NodeId
                        .... 0001 = EncodingMask: Four byte encoded Numeric (0x1)
                        Namespace Index: 0
                        Identifier Numeric: 2255
                    AttributeId: Value (0x0000000d)
                    IndexRange: [OpcUa Null String]
                    DataEncoding: QualifiedName
                        Id: 0
                        Name: [OpcUa Null String]
                [1]: ReadValueId
                    NodeId: NodeId
                        .... 0001 = EncodingMask: Four byte encoded Numeric (0x1)
                        Namespace Index: 0
                        Identifier Numeric: 2735
                    AttributeId: Value (0x0000000d)
                    IndexRange: [OpcUa Null String]
                    DataEncoding: QualifiedName
                        Id: 0
                        Name: [OpcUa Null String]
                [2]: ReadValueId
                    NodeId: NodeId
                        .... 0001 = EncodingMask: Four byte encoded Numeric (0x1)
                        Namespace Index: 0
                        Identifier Numeric: 12911
                    AttributeId: Value (0x0000000d)
                    IndexRange: [OpcUa Null String]
                    DataEncoding: QualifiedName
                        Id: 0
                        Name: [OpcUa Null String]
                [3]: ReadValueId
                    NodeId: NodeId
                        .... 0001 = EncodingMask: Four byte encoded Numeric (0x1)
                        Namespace Index: 0
                        Identifier Numeric: 2737
                    AttributeId: Value (0x0000000d)
                    IndexRange: [OpcUa Null String]
                    DataEncoding: QualifiedName
                        Id: 0
                        Name: [OpcUa Null String]
                [4]: ReadValueId
                    NodeId: NodeId
                        .... 0001 = EncodingMask: Four byte encoded Numeric (0x1)
                        Namespace Index: 0
                        Identifier Numeric: 2736
                    AttributeId: Value (0x0000000d)
                    IndexRange: [OpcUa Null String]
                    DataEncoding: QualifiedName
                        Id: 0
                        Name: [OpcUa Null String]
                [5]: ReadValueId
                    NodeId: NodeId
                        .... 0001 = EncodingMask: Four byte encoded Numeric (0x1)
                        Namespace Index: 0
                        Identifier Numeric: 11703
                    AttributeId: Value (0x0000000d)
                    IndexRange: [OpcUa Null String]
                    DataEncoding: QualifiedName
                        Id: 0
                        Name: [OpcUa Null String]
                [6]: ReadValueId
                    NodeId: NodeId
                        .... 0001 = EncodingMask: Four byte encoded Numeric (0x1)
                        Namespace Index: 0
                        Identifier Numeric: 2272
                    AttributeId: Value (0x0000000d)
                    IndexRange: [OpcUa Null String]
                    DataEncoding: QualifiedName
                        Id: 0
                        Name: [OpcUa Null String]
                [7]: ReadValueId
                    NodeId: NodeId
                        .... 0001 = EncodingMask: Four byte encoded Numeric (0x1)
                        Namespace Index: 0
                        Identifier Numeric: 11714
                    AttributeId: Value (0x0000000d)
                    IndexRange: [OpcUa Null String]
                    DataEncoding: QualifiedName
                        Id: 0
                        Name: [OpcUa Null String]
                [8]: ReadValueId
                    NodeId: NodeId
                        .... 0001 = EncodingMask: Four byte encoded Numeric (0x1)
                        Namespace Index: 0
                        Identifier Numeric: 11710
                    AttributeId: Value (0x0000000d)
                    IndexRange: [OpcUa Null String]
                    DataEncoding: QualifiedName
                        Id: 0
                        Name: [OpcUa Null String]
                [9]: ReadValueId
                    NodeId: NodeId
                        .... 0001 = EncodingMask: Four byte encoded Numeric (0x1)
                        Namespace Index: 0
                        Identifier Numeric: 12165
                    AttributeId: Value (0x0000000d)
                    IndexRange: [OpcUa Null String]
                    DataEncoding: QualifiedName
                        Id: 0
                        Name: [OpcUa Null String]
                [10]: ReadValueId
                    NodeId: NodeId
                        .... 0001 = EncodingMask: Four byte encoded Numeric (0x1)
                        Namespace Index: 0
                        Identifier Numeric: 12166
                    AttributeId: Value (0x0000000d)
                    IndexRange: [OpcUa Null String]
                    DataEncoding: QualifiedName
                        Id: 0
                        Name: [OpcUa Null String]
                [11]: ReadValueId
                    NodeId: NodeId
                        .... 0001 = EncodingMask: Four byte encoded Numeric (0x1)
                        Namespace Index: 0
                        Identifier Numeric: 12167
                    AttributeId: Value (0x0000000d)
                    IndexRange: [OpcUa Null String]
                    DataEncoding: QualifiedName
                        Id: 0
                        Name: [OpcUa Null String]
                [12]: ReadValueId
                    NodeId: NodeId
                        .... 0001 = EncodingMask: Four byte encoded Numeric (0x1)
                        Namespace Index: 0
                        Identifier Numeric: 12168
                    AttributeId: Value (0x0000000d)
                    IndexRange: [OpcUa Null String]
                    DataEncoding: QualifiedName
                        Id: 0
                        Name: [OpcUa Null String]
                [13]: ReadValueId
                    NodeId: NodeId
                        .... 0001 = EncodingMask: Four byte encoded Numeric (0x1)
                        Namespace Index: 0
                        Identifier Numeric: 11709
                    AttributeId: Value (0x0000000d)
                    IndexRange: [OpcUa Null String]
                    DataEncoding: QualifiedName
                        Id: 0
                        Name: [OpcUa Null String]
                [14]: ReadValueId
                    NodeId: NodeId
                        .... 0001 = EncodingMask: Four byte encoded Numeric (0x1)
                        Namespace Index: 0
                        Identifier Numeric: 11713
                    AttributeId: Value (0x0000000d)
                    IndexRange: [OpcUa Null String]
                    DataEncoding: QualifiedName
                        Id: 0
                        Name: [OpcUa Null String]
                [15]: ReadValueId
                    NodeId: NodeId
                        .... 0001 = EncodingMask: Four byte encoded Numeric (0x1)
                        Namespace Index: 0
                        Identifier Numeric: 11711
                    AttributeId: Value (0x0000000d)
                    IndexRange: [OpcUa Null String]
                    DataEncoding: QualifiedName
                        Id: 0
                        Name: [OpcUa Null String]
                [16]: ReadValueId
                    NodeId: NodeId
                        .... 0001 = EncodingMask: Four byte encoded Numeric (0x1)
                        Namespace Index: 0
                        Identifier Numeric: 11712
                    AttributeId: Value (0x0000000d)
                    IndexRange: [OpcUa Null String]
                    DataEncoding: QualifiedName
                        Id: 0
                        Name: [OpcUa Null String]
                [17]: ReadValueId
                    NodeId: NodeId
                        .... 0001 = EncodingMask: Four byte encoded Numeric (0x1)
                        Namespace Index: 0
                        Identifier Numeric: 11707
                    AttributeId: Value (0x0000000d)
                    IndexRange: [OpcUa Null String]
                    DataEncoding: QualifiedName
                        Id: 0
                        Name: [OpcUa Null String]
                [18]: ReadValueId
                    NodeId: NodeId
                        .... 0001 = EncodingMask: Four byte encoded Numeric (0x1)
                        Namespace Index: 0
                        Identifier Numeric: 2259
                    AttributeId: Value (0x0000000d)
                    IndexRange: [OpcUa Null String]
                    DataEncoding: QualifiedName
                        Id: 0
                        Name: [OpcUa Null String]

No.     DeltaTime Time                    Source                Destination           Protocol Length Stream Index Info                                                            SrcPort DstPort Src Time
     53 0.059s    2025-07-04 06:44:33.443 GYANDE2L.ptcnet.ptc.com 192.168.15.139        OpcUa    343    3            UA Secure Conversation Message: ReadResponse                    49320   50852   

Frame 53: 343 bytes on wire (2744 bits), 343 bytes captured (2744 bits) on interface \Device\NPF_{AF38AF37-B5CF-4E8F-867B-264BC8F540A8}, id 0
Ethernet II, Src: VMware_f9:fd:da (00:50:56:f9:fd:da), Dst: VMware_c0:b1:ab (00:0c:29:c0:b1:ab)
Internet Protocol Version 4, Src: GYANDE2L.ptcnet.ptc.com (100.64.1.34), Dst: 192.168.15.139 (192.168.15.139)
Transmission Control Protocol, Src Port: 49320, Dst Port: 50852, Seq: 3758, Ack: 1150, Len: 289
OpcUa Binary Protocol
    Message Type: MSG
    Chunk Type: F
    Message Size: 289
    SecureChannelId: 1364440749
    Security Token Id: 1
    Sequence Number: 516
    RequestId: 5
    Message: Encodeable Object
        TypeId: ExpandedNodeId
        ReadResponse

No.     DeltaTime Time                    Source                Destination           Protocol Length Stream Index Info                                                            SrcPort DstPort Src Time
     54 0.002s    2025-07-04 06:44:33.445 192.168.15.139        GYANDE2L.ptcnet.ptc.com OpcUa    155    3            UA Secure Conversation Message: BrowseRequest                   50852   49320   

Frame 54: 155 bytes on wire (1240 bits), 155 bytes captured (1240 bits) on interface \Device\NPF_{AF38AF37-B5CF-4E8F-867B-264BC8F540A8}, id 0
Ethernet II, Src: VMware_c0:b1:ab (00:0c:29:c0:b1:ab), Dst: VMware_f9:fd:da (00:50:56:f9:fd:da)
Internet Protocol Version 4, Src: 192.168.15.139 (192.168.15.139), Dst: GYANDE2L.ptcnet.ptc.com (100.64.1.34)
Transmission Control Protocol, Src Port: 50852, Dst Port: 49320, Seq: 1150, Ack: 4047, Len: 101
OpcUa Binary Protocol
    Message Type: MSG
    Chunk Type: F
    Message Size: 101
    SecureChannelId: 1364440749
    Security Token Id: 1
    Sequence Number: 6
    RequestId: 6
    Message: Encodeable Object
        TypeId: ExpandedNodeId
        BrowseRequest

No.     DeltaTime Time                    Source                Destination           Protocol Length Stream Index Info                                                            SrcPort DstPort Src Time
     56 0.019s    2025-07-04 06:44:33.464 GYANDE2L.ptcnet.ptc.com 192.168.15.139        OpcUa    534    3            UA Secure Conversation Message: BrowseResponse                  49320   50852   

Frame 56: 534 bytes on wire (4272 bits), 534 bytes captured (4272 bits) on interface \Device\NPF_{AF38AF37-B5CF-4E8F-867B-264BC8F540A8}, id 0
Ethernet II, Src: VMware_f9:fd:da (00:50:56:f9:fd:da), Dst: VMware_c0:b1:ab (00:0c:29:c0:b1:ab)
Internet Protocol Version 4, Src: GYANDE2L.ptcnet.ptc.com (100.64.1.34), Dst: 192.168.15.139 (192.168.15.139)
Transmission Control Protocol, Src Port: 49320, Dst Port: 50852, Seq: 4047, Ack: 1251, Len: 480
OpcUa Binary Protocol
    Message Type: MSG
    Chunk Type: F
    Message Size: 480
    SecureChannelId: 1364440749
    Security Token Id: 1
    Sequence Number: 517
    RequestId: 6
    Message: Encodeable Object
        TypeId: ExpandedNodeId
        BrowseResponse

No.     DeltaTime Time                    Source                Destination           Protocol Length Stream Index Info                                                            SrcPort DstPort Src Time
     57 0.000s    2025-07-04 06:44:33.465 192.168.15.139        GYANDE2L.ptcnet.ptc.com OpcUa    269    3            UA Secure Conversation Message: BrowseRequest                   50852   49320   

Frame 57: 269 bytes on wire (2152 bits), 269 bytes captured (2152 bits) on interface \Device\NPF_{AF38AF37-B5CF-4E8F-867B-264BC8F540A8}, id 0
Ethernet II, Src: VMware_c0:b1:ab (00:0c:29:c0:b1:ab), Dst: VMware_f9:fd:da (00:50:56:f9:fd:da)
Internet Protocol Version 4, Src: 192.168.15.139 (192.168.15.139), Dst: GYANDE2L.ptcnet.ptc.com (100.64.1.34)
Transmission Control Protocol, Src Port: 50852, Dst Port: 49320, Seq: 1251, Ack: 4527, Len: 215
OpcUa Binary Protocol
    Message Type: MSG
    Chunk Type: F
    Message Size: 215
    SecureChannelId: 1364440749
    Security Token Id: 1
    Sequence Number: 7
    RequestId: 7
    Message: Encodeable Object
        TypeId: ExpandedNodeId
        BrowseRequest

No.     DeltaTime Time                    Source                Destination           Protocol Length Stream Index Info                                                            SrcPort DstPort Src Time
     59 0.057s    2025-07-04 06:44:33.522 GYANDE2L.ptcnet.ptc.com 192.168.15.139        OpcUa    198    3            UA Secure Conversation Message: BrowseResponse                  49320   50852   

Frame 59: 198 bytes on wire (1584 bits), 198 bytes captured (1584 bits) on interface \Device\NPF_{AF38AF37-B5CF-4E8F-867B-264BC8F540A8}, id 0
Ethernet II, Src: VMware_f9:fd:da (00:50:56:f9:fd:da), Dst: VMware_c0:b1:ab (00:0c:29:c0:b1:ab)
Internet Protocol Version 4, Src: GYANDE2L.ptcnet.ptc.com (100.64.1.34), Dst: 192.168.15.139 (192.168.15.139)
Transmission Control Protocol, Src Port: 49320, Dst Port: 50852, Seq: 4527, Ack: 1466, Len: 144
OpcUa Binary Protocol
    Message Type: MSG
    Chunk Type: F
    Message Size: 144
    SecureChannelId: 1364440749
    Security Token Id: 1
    Sequence Number: 518
    RequestId: 7
    Message: Encodeable Object
        TypeId: ExpandedNodeId
        BrowseResponse

No.     DeltaTime Time                    Source                Destination           Protocol Length Stream Index Info                                                            SrcPort DstPort Src Time
     60 0.000s    2025-07-04 06:44:33.522 192.168.15.139        GYANDE2L.ptcnet.ptc.com OpcUa    225    3            UA Secure Conversation Message: BrowseRequest                   50852   49320   

Frame 60: 225 bytes on wire (1800 bits), 225 bytes captured (1800 bits) on interface \Device\NPF_{AF38AF37-B5CF-4E8F-867B-264BC8F540A8}, id 0
Ethernet II, Src: VMware_c0:b1:ab (00:0c:29:c0:b1:ab), Dst: VMware_f9:fd:da (00:50:56:f9:fd:da)
Internet Protocol Version 4, Src: 192.168.15.139 (192.168.15.139), Dst: GYANDE2L.ptcnet.ptc.com (100.64.1.34)
Transmission Control Protocol, Src Port: 50852, Dst Port: 49320, Seq: 1466, Ack: 4671, Len: 171
OpcUa Binary Protocol
    Message Type: MSG
    Chunk Type: F
    Message Size: 171
    SecureChannelId: 1364440749
    Security Token Id: 1
    Sequence Number: 8
    RequestId: 8
    Message: Encodeable Object
        TypeId: ExpandedNodeId
        BrowseRequest

No.     DeltaTime Time                    Source                Destination           Protocol Length Stream Index Info                                                            SrcPort DstPort Src Time
     62 0.057s    2025-07-04 06:44:33.580 GYANDE2L.ptcnet.ptc.com 192.168.15.139        OpcUa    174    3            UA Secure Conversation Message: BrowseResponse                  49320   50852   

Frame 62: 174 bytes on wire (1392 bits), 174 bytes captured (1392 bits) on interface \Device\NPF_{AF38AF37-B5CF-4E8F-867B-264BC8F540A8}, id 0
Ethernet II, Src: VMware_f9:fd:da (00:50:56:f9:fd:da), Dst: VMware_c0:b1:ab (00:0c:29:c0:b1:ab)
Internet Protocol Version 4, Src: GYANDE2L.ptcnet.ptc.com (100.64.1.34), Dst: 192.168.15.139 (192.168.15.139)
Transmission Control Protocol, Src Port: 49320, Dst Port: 50852, Seq: 4671, Ack: 1637, Len: 120
OpcUa Binary Protocol
    Message Type: MSG
    Chunk Type: F
    Message Size: 120
    SecureChannelId: 1364440749
    Security Token Id: 1
    Sequence Number: 519
    RequestId: 8
    Message: Encodeable Object
        TypeId: ExpandedNodeId
        BrowseResponse

No.     DeltaTime Time                    Source                Destination           Protocol Length Stream Index Info                                                            SrcPort DstPort Src Time
