No.     DeltaTime Time                    Source                Destination           Protocol Length Stream Index Info                                                            SrcPort DstPort Src Time
     44 0.000s    2025-07-04 05:53:11.890 192.168.15.139        GYANDE2L.ptcnet.ptc.com OpcUa    125    3            Hello message                                                   50302   49320   

Frame 44: 125 bytes on wire (1000 bits), 125 bytes captured (1000 bits) on interface \Device\NPF_{AF38AF37-B5CF-4E8F-867B-264BC8F540A8}, id 0
Ethernet II, Src: VMware_c0:b1:ab (00:0c:29:c0:b1:ab), Dst: VMware_f9:fd:da (00:50:56:f9:fd:da)
Internet Protocol Version 4, Src: 192.168.15.139 (192.168.15.139), Dst: GYANDE2L.ptcnet.ptc.com (100.64.1.34)
Transmission Control Protocol, Src Port: 50302, Dst Port: 49320, Seq: 1, Ack: 1, Len: 71
OpcUa Binary Protocol

No.     DeltaTime Time                    Source                Destination           Protocol Length Stream Index Info                                                            SrcPort DstPort Src Time
     46 0.032s    2025-07-04 05:53:11.922 GYANDE2L.ptcnet.ptc.com 192.168.15.139        OpcUa    82     3            Acknowledge message                                             49320   50302   

Frame 46: 82 bytes on wire (656 bits), 82 bytes captured (656 bits) on interface \Device\NPF_{AF38AF37-B5CF-4E8F-867B-264BC8F540A8}, id 0
Ethernet II, Src: VMware_f9:fd:da (00:50:56:f9:fd:da), Dst: VMware_c0:b1:ab (00:0c:29:c0:b1:ab)
Internet Protocol Version 4, Src: GYANDE2L.ptcnet.ptc.com (100.64.1.34), Dst: 192.168.15.139 (192.168.15.139)
Transmission Control Protocol, Src Port: 49320, Dst Port: 50302, Seq: 1, Ack: 72, Len: 28
OpcUa Binary Protocol

No.     DeltaTime Time                    Source                Destination           Protocol Length Stream Index Info                                                            SrcPort DstPort Src Time
     47 0.000s    2025-07-04 05:53:11.922 192.168.15.139        GYANDE2L.ptcnet.ptc.com OpcUa    187    3            OpenSecureChannel message                                       50302   49320   

Frame 47: 187 bytes on wire (1496 bits), 187 bytes captured (1496 bits) on interface \Device\NPF_{AF38AF37-B5CF-4E8F-867B-264BC8F540A8}, id 0
Ethernet II, Src: VMware_c0:b1:ab (00:0c:29:c0:b1:ab), Dst: VMware_f9:fd:da (00:50:56:f9:fd:da)
Internet Protocol Version 4, Src: 192.168.15.139 (192.168.15.139), Dst: GYANDE2L.ptcnet.ptc.com (100.64.1.34)
Transmission Control Protocol, Src Port: 50302, Dst Port: 49320, Seq: 72, Ack: 29, Len: 133
OpcUa Binary Protocol

No.     DeltaTime Time                    Source                Destination           Protocol Length Stream Index Info                                                            SrcPort DstPort Src Time
     49 0.018s    2025-07-04 05:53:11.941 GYANDE2L.ptcnet.ptc.com 192.168.15.139        OpcUa    189    3            OpenSecureChannel message                                       49320   50302   

Frame 49: 189 bytes on wire (1512 bits), 189 bytes captured (1512 bits) on interface \Device\NPF_{AF38AF37-B5CF-4E8F-867B-264BC8F540A8}, id 0
Ethernet II, Src: VMware_f9:fd:da (00:50:56:f9:fd:da), Dst: VMware_c0:b1:ab (00:0c:29:c0:b1:ab)
Internet Protocol Version 4, Src: GYANDE2L.ptcnet.ptc.com (100.64.1.34), Dst: 192.168.15.139 (192.168.15.139)
Transmission Control Protocol, Src Port: 49320, Dst Port: 50302, Seq: 29, Ack: 205, Len: 135
OpcUa Binary Protocol

No.     DeltaTime Time                    Source                Destination           Protocol Length Stream Index Info                                                            SrcPort DstPort Src Time
     50 0.000s    2025-07-04 05:53:11.941 192.168.15.139        GYANDE2L.ptcnet.ptc.com OpcUa    162    3            UA Secure Conversation Message: GetEndpointsRequest             50302   49320   

Frame 50: 162 bytes on wire (1296 bits), 162 bytes captured (1296 bits) on interface \Device\NPF_{AF38AF37-B5CF-4E8F-867B-264BC8F540A8}, id 0
Ethernet II, Src: VMware_c0:b1:ab (00:0c:29:c0:b1:ab), Dst: VMware_f9:fd:da (00:50:56:f9:fd:da)
Internet Protocol Version 4, Src: 192.168.15.139 (192.168.15.139), Dst: GYANDE2L.ptcnet.ptc.com (100.64.1.34)
Transmission Control Protocol, Src Port: 50302, Dst Port: 49320, Seq: 205, Ack: 164, Len: 108
OpcUa Binary Protocol

No.     DeltaTime Time                    Source                Destination           Protocol Length Stream Index Info                                                            SrcPort DstPort Src Time
     53 0.019s    2025-07-04 05:53:11.961 GYANDE2L.ptcnet.ptc.com 192.168.15.139        OpcUa    590    3            UA Secure Conversation Message: GetEndpointsResponse            49320   50302   

Frame 53: 590 bytes on wire (4720 bits), 590 bytes captured (4720 bits) on interface \Device\NPF_{AF38AF37-B5CF-4E8F-867B-264BC8F540A8}, id 0
Ethernet II, Src: VMware_f9:fd:da (00:50:56:f9:fd:da), Dst: VMware_c0:b1:ab (00:0c:29:c0:b1:ab)
Internet Protocol Version 4, Src: GYANDE2L.ptcnet.ptc.com (100.64.1.34), Dst: 192.168.15.139 (192.168.15.139)
Transmission Control Protocol, Src Port: 49320, Dst Port: 50302, Seq: 1624, Ack: 313, Len: 536
[2 Reassembled TCP Segments (1996 bytes): #52(1460), #53(536)]
OpcUa Binary Protocol

No.     DeltaTime Time                    Source                Destination           Protocol Length Stream Index Info                                                            SrcPort DstPort Src Time
     55 0.000s    2025-07-04 05:53:11.961 192.168.15.139        GYANDE2L.ptcnet.ptc.com OpcUa    111    3            CloseSecureChannel message: CloseSecureChannelRequest           50302   49320   

Frame 55: 111 bytes on wire (888 bits), 111 bytes captured (888 bits) on interface \Device\NPF_{AF38AF37-B5CF-4E8F-867B-264BC8F540A8}, id 0
Ethernet II, Src: VMware_c0:b1:ab (00:0c:29:c0:b1:ab), Dst: VMware_f9:fd:da (00:50:56:f9:fd:da)
Internet Protocol Version 4, Src: 192.168.15.139 (192.168.15.139), Dst: GYANDE2L.ptcnet.ptc.com (100.64.1.34)
Transmission Control Protocol, Src Port: 50302, Dst Port: 49320, Seq: 313, Ack: 2160, Len: 57
OpcUa Binary Protocol

No.     DeltaTime Time                    Source                Destination           Protocol Length Stream Index Info                                                            SrcPort DstPort Src Time
     63 0.052s    2025-07-04 05:53:12.013 192.168.15.139        GYANDE2L.ptcnet.ptc.com OpcUa    125    4            Hello message                                                   50303   49320   

Frame 63: 125 bytes on wire (1000 bits), 125 bytes captured (1000 bits) on interface \Device\NPF_{AF38AF37-B5CF-4E8F-867B-264BC8F540A8}, id 0
Ethernet II, Src: VMware_c0:b1:ab (00:0c:29:c0:b1:ab), Dst: VMware_f9:fd:da (00:50:56:f9:fd:da)
Internet Protocol Version 4, Src: 192.168.15.139 (192.168.15.139), Dst: GYANDE2L.ptcnet.ptc.com (100.64.1.34)
Transmission Control Protocol, Src Port: 50303, Dst Port: 49320, Seq: 1, Ack: 1, Len: 71
OpcUa Binary Protocol

No.     DeltaTime Time                    Source                Destination           Protocol Length Stream Index Info                                                            SrcPort DstPort Src Time
     65 0.029s    2025-07-04 05:53:12.043 GYANDE2L.ptcnet.ptc.com 192.168.15.139        OpcUa    82     4            Acknowledge message                                             49320   50303   

Frame 65: 82 bytes on wire (656 bits), 82 bytes captured (656 bits) on interface \Device\NPF_{AF38AF37-B5CF-4E8F-867B-264BC8F540A8}, id 0
Ethernet II, Src: VMware_f9:fd:da (00:50:56:f9:fd:da), Dst: VMware_c0:b1:ab (00:0c:29:c0:b1:ab)
Internet Protocol Version 4, Src: GYANDE2L.ptcnet.ptc.com (100.64.1.34), Dst: 192.168.15.139 (192.168.15.139)
Transmission Control Protocol, Src Port: 49320, Dst Port: 50303, Seq: 1, Ack: 72, Len: 28
OpcUa Binary Protocol

No.     DeltaTime Time                    Source                Destination           Protocol Length Stream Index Info                                                            SrcPort DstPort Src Time
     66 0.000s    2025-07-04 05:53:12.043 192.168.15.139        GYANDE2L.ptcnet.ptc.com OpcUa    187    4            OpenSecureChannel message                                       50303   49320   

Frame 66: 187 bytes on wire (1496 bits), 187 bytes captured (1496 bits) on interface \Device\NPF_{AF38AF37-B5CF-4E8F-867B-264BC8F540A8}, id 0
Ethernet II, Src: VMware_c0:b1:ab (00:0c:29:c0:b1:ab), Dst: VMware_f9:fd:da (00:50:56:f9:fd:da)
Internet Protocol Version 4, Src: 192.168.15.139 (192.168.15.139), Dst: GYANDE2L.ptcnet.ptc.com (100.64.1.34)
Transmission Control Protocol, Src Port: 50303, Dst Port: 49320, Seq: 72, Ack: 29, Len: 133
OpcUa Binary Protocol

No.     DeltaTime Time                    Source                Destination           Protocol Length Stream Index Info                                                            SrcPort DstPort Src Time
     68 0.017s    2025-07-04 05:53:12.061 GYANDE2L.ptcnet.ptc.com 192.168.15.139        OpcUa    189    4            OpenSecureChannel message                                       49320   50303   

Frame 68: 189 bytes on wire (1512 bits), 189 bytes captured (1512 bits) on interface \Device\NPF_{AF38AF37-B5CF-4E8F-867B-264BC8F540A8}, id 0
Ethernet II, Src: VMware_f9:fd:da (00:50:56:f9:fd:da), Dst: VMware_c0:b1:ab (00:0c:29:c0:b1:ab)
Internet Protocol Version 4, Src: GYANDE2L.ptcnet.ptc.com (100.64.1.34), Dst: 192.168.15.139 (192.168.15.139)
Transmission Control Protocol, Src Port: 49320, Dst Port: 50303, Seq: 29, Ack: 205, Len: 135
OpcUa Binary Protocol

No.     DeltaTime Time                    Source                Destination           Protocol Length Stream Index Info                                                            SrcPort DstPort Src Time
     69 0.000s    2025-07-04 05:53:12.061 192.168.15.139        GYANDE2L.ptcnet.ptc.com OpcUa    348    4            UA Secure Conversation Message: CreateSessionRequest            50303   49320   

Frame 69: 348 bytes on wire (2784 bits), 348 bytes captured (2784 bits) on interface \Device\NPF_{AF38AF37-B5CF-4E8F-867B-264BC8F540A8}, id 0
Ethernet II, Src: VMware_c0:b1:ab (00:0c:29:c0:b1:ab), Dst: VMware_f9:fd:da (00:50:56:f9:fd:da)
Internet Protocol Version 4, Src: 192.168.15.139 (192.168.15.139), Dst: GYANDE2L.ptcnet.ptc.com (100.64.1.34)
Transmission Control Protocol, Src Port: 50303, Dst Port: 49320, Seq: 205, Ack: 164, Len: 294
OpcUa Binary Protocol

No.     DeltaTime Time                    Source                Destination           Protocol Length Stream Index Info                                                            SrcPort DstPort Src Time
     73 0.020s    2025-07-04 05:53:12.081 GYANDE2L.ptcnet.ptc.com 192.168.15.139        OpcUa    1496   4            UA Secure Conversation Message: CreateSessionResponse           49320   50303   

Frame 73: 1496 bytes on wire (11968 bits), 1496 bytes captured (11968 bits) on interface \Device\NPF_{AF38AF37-B5CF-4E8F-867B-264BC8F540A8}, id 0
Ethernet II, Src: VMware_f9:fd:da (00:50:56:f9:fd:da), Dst: VMware_c0:b1:ab (00:0c:29:c0:b1:ab)
Internet Protocol Version 4, Src: GYANDE2L.ptcnet.ptc.com (100.64.1.34), Dst: 192.168.15.139 (192.168.15.139)
Transmission Control Protocol, Src Port: 49320, Dst Port: 50303, Seq: 2150, Ack: 499, Len: 1442
[3 Reassembled TCP Segments (3428 bytes): #71(526), #72(1460), #73(1442)]
OpcUa Binary Protocol

No.     DeltaTime Time                    Source                Destination           Protocol Length Stream Index Info                                                            SrcPort DstPort Src Time
     75 0.000s    2025-07-04 05:53:12.082 192.168.15.139        GYANDE2L.ptcnet.ptc.com OpcUa    171    4            UA Secure Conversation Message: ActivateSessionRequest          50303   49320   

Frame 75: 171 bytes on wire (1368 bits), 171 bytes captured (1368 bits) on interface \Device\NPF_{AF38AF37-B5CF-4E8F-867B-264BC8F540A8}, id 0
Ethernet II, Src: VMware_c0:b1:ab (00:0c:29:c0:b1:ab), Dst: VMware_f9:fd:da (00:50:56:f9:fd:da)
Internet Protocol Version 4, Src: 192.168.15.139 (192.168.15.139), Dst: GYANDE2L.ptcnet.ptc.com (100.64.1.34)
Transmission Control Protocol, Src Port: 50303, Dst Port: 49320, Seq: 499, Ack: 3592, Len: 117
OpcUa Binary Protocol

No.     DeltaTime Time                    Source                Destination           Protocol Length Stream Index Info                                                            SrcPort DstPort Src Time
     77 0.018s    2025-07-04 05:53:12.100 GYANDE2L.ptcnet.ptc.com 192.168.15.139        OpcUa    150    4            UA Secure Conversation Message: ActivateSessionResponse         49320   50303   

Frame 77: 150 bytes on wire (1200 bits), 150 bytes captured (1200 bits) on interface \Device\NPF_{AF38AF37-B5CF-4E8F-867B-264BC8F540A8}, id 0
Ethernet II, Src: VMware_f9:fd:da (00:50:56:f9:fd:da), Dst: VMware_c0:b1:ab (00:0c:29:c0:b1:ab)
Internet Protocol Version 4, Src: GYANDE2L.ptcnet.ptc.com (100.64.1.34), Dst: 192.168.15.139 (192.168.15.139)
Transmission Control Protocol, Src Port: 49320, Dst Port: 50303, Seq: 3592, Ack: 616, Len: 96
OpcUa Binary Protocol

No.     DeltaTime Time                    Source                Destination           Protocol Length Stream Index Info                                                            SrcPort DstPort Src Time
     78 0.000s    2025-07-04 05:53:12.100 192.168.15.139        GYANDE2L.ptcnet.ptc.com OpcUa    168    4            UA Secure Conversation Message: ReadRequest                     50303   49320   

Frame 78: 168 bytes on wire (1344 bits), 168 bytes captured (1344 bits) on interface \Device\NPF_{AF38AF37-B5CF-4E8F-867B-264BC8F540A8}, id 0
Ethernet II, Src: VMware_c0:b1:ab (00:0c:29:c0:b1:ab), Dst: VMware_f9:fd:da (00:50:56:f9:fd:da)
Internet Protocol Version 4, Src: 192.168.15.139 (192.168.15.139), Dst: GYANDE2L.ptcnet.ptc.com (100.64.1.34)
Transmission Control Protocol, Src Port: 50303, Dst Port: 49320, Seq: 616, Ack: 3688, Len: 114
OpcUa Binary Protocol

No.     DeltaTime Time                    Source                Destination           Protocol Length Stream Index Info                                                            SrcPort DstPort Src Time
     80 0.019s    2025-07-04 05:53:12.120 GYANDE2L.ptcnet.ptc.com 192.168.15.139        OpcUa    124    4            UA Secure Conversation Message: ReadResponse                    49320   50303   

Frame 80: 124 bytes on wire (992 bits), 124 bytes captured (992 bits) on interface \Device\NPF_{AF38AF37-B5CF-4E8F-867B-264BC8F540A8}, id 0
Ethernet II, Src: VMware_f9:fd:da (00:50:56:f9:fd:da), Dst: VMware_c0:b1:ab (00:0c:29:c0:b1:ab)
Internet Protocol Version 4, Src: GYANDE2L.ptcnet.ptc.com (100.64.1.34), Dst: 192.168.15.139 (192.168.15.139)
Transmission Control Protocol, Src Port: 49320, Dst Port: 50303, Seq: 3688, Ack: 730, Len: 70
OpcUa Binary Protocol

No.     DeltaTime Time                    Source                Destination           Protocol Length Stream Index Info                                                            SrcPort DstPort Src Time
     81 0.001s    2025-07-04 05:53:12.122 192.168.15.139        GYANDE2L.ptcnet.ptc.com OpcUa    474    4            UA Secure Conversation Message: ReadRequest                     50303   49320   

Frame 81: 474 bytes on wire (3792 bits), 474 bytes captured (3792 bits) on interface \Device\NPF_{AF38AF37-B5CF-4E8F-867B-264BC8F540A8}, id 0
Ethernet II, Src: VMware_c0:b1:ab (00:0c:29:c0:b1:ab), Dst: VMware_f9:fd:da (00:50:56:f9:fd:da)
Internet Protocol Version 4, Src: 192.168.15.139 (192.168.15.139), Dst: GYANDE2L.ptcnet.ptc.com (100.64.1.34)
Transmission Control Protocol, Src Port: 50303, Dst Port: 49320, Seq: 730, Ack: 3758, Len: 420
OpcUa Binary Protocol

No.     DeltaTime Time                    Source                Destination           Protocol Length Stream Index Info                                                            SrcPort DstPort Src Time
     84 0.028s    2025-07-04 05:53:12.151 GYANDE2L.ptcnet.ptc.com 192.168.15.139        OpcUa    327    4            UA Secure Conversation Message: ReadResponse                    49320   50303   

Frame 84: 327 bytes on wire (2616 bits), 327 bytes captured (2616 bits) on interface \Device\NPF_{AF38AF37-B5CF-4E8F-867B-264BC8F540A8}, id 0
Ethernet II, Src: VMware_f9:fd:da (00:50:56:f9:fd:da), Dst: VMware_c0:b1:ab (00:0c:29:c0:b1:ab)
Internet Protocol Version 4, Src: GYANDE2L.ptcnet.ptc.com (100.64.1.34), Dst: 192.168.15.139 (192.168.15.139)
Transmission Control Protocol, Src Port: 49320, Dst Port: 50303, Seq: 3774, Ack: 1150, Len: 273
[2 Reassembled TCP Segments (289 bytes): #83(16), #84(273)]
OpcUa Binary Protocol

No.     DeltaTime Time                    Source                Destination           Protocol Length Stream Index Info                                                            SrcPort DstPort Src Time
     86 0.005s    2025-07-04 05:53:12.156 192.168.15.139        GYANDE2L.ptcnet.ptc.com OpcUa    155    4            UA Secure Conversation Message: BrowseRequest                   50303   49320   

Frame 86: 155 bytes on wire (1240 bits), 155 bytes captured (1240 bits) on interface \Device\NPF_{AF38AF37-B5CF-4E8F-867B-264BC8F540A8}, id 0
Ethernet II, Src: VMware_c0:b1:ab (00:0c:29:c0:b1:ab), Dst: VMware_f9:fd:da (00:50:56:f9:fd:da)
Internet Protocol Version 4, Src: 192.168.15.139 (192.168.15.139), Dst: GYANDE2L.ptcnet.ptc.com (100.64.1.34)
Transmission Control Protocol, Src Port: 50303, Dst Port: 49320, Seq: 1150, Ack: 4047, Len: 101
OpcUa Binary Protocol

No.     DeltaTime Time                    Source                Destination           Protocol Length Stream Index Info                                                            SrcPort DstPort Src Time
     88 0.026s    2025-07-04 05:53:12.183 GYANDE2L.ptcnet.ptc.com 192.168.15.139        OpcUa    534    4            UA Secure Conversation Message: BrowseResponse                  49320   50303   

Frame 88: 534 bytes on wire (4272 bits), 534 bytes captured (4272 bits) on interface \Device\NPF_{AF38AF37-B5CF-4E8F-867B-264BC8F540A8}, id 0
Ethernet II, Src: VMware_f9:fd:da (00:50:56:f9:fd:da), Dst: VMware_c0:b1:ab (00:0c:29:c0:b1:ab)
Internet Protocol Version 4, Src: GYANDE2L.ptcnet.ptc.com (100.64.1.34), Dst: 192.168.15.139 (192.168.15.139)
Transmission Control Protocol, Src Port: 49320, Dst Port: 50303, Seq: 4047, Ack: 1251, Len: 480
OpcUa Binary Protocol

No.     DeltaTime Time                    Source                Destination           Protocol Length Stream Index Info                                                            SrcPort DstPort Src Time
     89 0.000s    2025-07-04 05:53:12.183 192.168.15.139        GYANDE2L.ptcnet.ptc.com OpcUa    269    4            UA Secure Conversation Message: BrowseRequest                   50303   49320   

Frame 89: 269 bytes on wire (2152 bits), 269 bytes captured (2152 bits) on interface \Device\NPF_{AF38AF37-B5CF-4E8F-867B-264BC8F540A8}, id 0
Ethernet II, Src: VMware_c0:b1:ab (00:0c:29:c0:b1:ab), Dst: VMware_f9:fd:da (00:50:56:f9:fd:da)
Internet Protocol Version 4, Src: 192.168.15.139 (192.168.15.139), Dst: GYANDE2L.ptcnet.ptc.com (100.64.1.34)
Transmission Control Protocol, Src Port: 50303, Dst Port: 49320, Seq: 1251, Ack: 4527, Len: 215
OpcUa Binary Protocol

No.     DeltaTime Time                    Source                Destination           Protocol Length Stream Index Info                                                            SrcPort DstPort Src Time
     92 0.021s    2025-07-04 05:53:12.205 GYANDE2L.ptcnet.ptc.com 192.168.15.139        OpcUa    186    4            UA Secure Conversation Message: BrowseResponse                  49320   50303   

Frame 92: 186 bytes on wire (1488 bits), 186 bytes captured (1488 bits) on interface \Device\NPF_{AF38AF37-B5CF-4E8F-867B-264BC8F540A8}, id 0
Ethernet II, Src: VMware_f9:fd:da (00:50:56:f9:fd:da), Dst: VMware_c0:b1:ab (00:0c:29:c0:b1:ab)
Internet Protocol Version 4, Src: GYANDE2L.ptcnet.ptc.com (100.64.1.34), Dst: 192.168.15.139 (192.168.15.139)
Transmission Control Protocol, Src Port: 49320, Dst Port: 50303, Seq: 4539, Ack: 1466, Len: 132
[2 Reassembled TCP Segments (144 bytes): #91(12), #92(132)]
OpcUa Binary Protocol

No.     DeltaTime Time                    Source                Destination           Protocol Length Stream Index Info                                                            SrcPort DstPort Src Time
     94 0.000s    2025-07-04 05:53:12.206 192.168.15.139        GYANDE2L.ptcnet.ptc.com OpcUa    225    4            UA Secure Conversation Message: BrowseRequest                   50303   49320   

Frame 94: 225 bytes on wire (1800 bits), 225 bytes captured (1800 bits) on interface \Device\NPF_{AF38AF37-B5CF-4E8F-867B-264BC8F540A8}, id 0
Ethernet II, Src: VMware_c0:b1:ab (00:0c:29:c0:b1:ab), Dst: VMware_f9:fd:da (00:50:56:f9:fd:da)
Internet Protocol Version 4, Src: 192.168.15.139 (192.168.15.139), Dst: GYANDE2L.ptcnet.ptc.com (100.64.1.34)
Transmission Control Protocol, Src Port: 50303, Dst Port: 49320, Seq: 1466, Ack: 4671, Len: 171
OpcUa Binary Protocol

No.     DeltaTime Time                    Source                Destination           Protocol Length Stream Index Info                                                            SrcPort DstPort Src Time
     97 0.022s    2025-07-04 05:53:12.228 GYANDE2L.ptcnet.ptc.com 192.168.15.139        OpcUa    158    4            UA Secure Conversation Message: BrowseResponse                  49320   50303   

Frame 97: 158 bytes on wire (1264 bits), 158 bytes captured (1264 bits) on interface \Device\NPF_{AF38AF37-B5CF-4E8F-867B-264BC8F540A8}, id 0
Ethernet II, Src: VMware_f9:fd:da (00:50:56:f9:fd:da), Dst: VMware_c0:b1:ab (00:0c:29:c0:b1:ab)
Internet Protocol Version 4, Src: GYANDE2L.ptcnet.ptc.com (100.64.1.34), Dst: 192.168.15.139 (192.168.15.139)
Transmission Control Protocol, Src Port: 49320, Dst Port: 50303, Seq: 4687, Ack: 1637, Len: 104
[2 Reassembled TCP Segments (120 bytes): #96(16), #97(104)]
OpcUa Binary Protocol

No.     DeltaTime Time                    Source                Destination           Protocol Length Stream Index Info                                                            SrcPort DstPort Src Time
     99 0.000s    2025-07-04 05:53:12.229 192.168.15.139        GYANDE2L.ptcnet.ptc.com OpcUa    155    4            UA Secure Conversation Message: BrowseRequest                   50303   49320   

Frame 99: 155 bytes on wire (1240 bits), 155 bytes captured (1240 bits) on interface \Device\NPF_{AF38AF37-B5CF-4E8F-867B-264BC8F540A8}, id 0
Ethernet II, Src: VMware_c0:b1:ab (00:0c:29:c0:b1:ab), Dst: VMware_f9:fd:da (00:50:56:f9:fd:da)
Internet Protocol Version 4, Src: 192.168.15.139 (192.168.15.139), Dst: GYANDE2L.ptcnet.ptc.com (100.64.1.34)
Transmission Control Protocol, Src Port: 50303, Dst Port: 49320, Seq: 1637, Ack: 4791, Len: 101
OpcUa Binary Protocol

No.     DeltaTime Time                    Source                Destination           Protocol Length Stream Index Info                                                            SrcPort DstPort Src Time
    104 0.022s    2025-07-04 05:53:12.252 GYANDE2L.ptcnet.ptc.com 192.168.15.139        OpcUa    110    4            UA Secure Conversation Message: BrowseResponse                  49320   50303   

Frame 104: 110 bytes on wire (880 bits), 110 bytes captured (880 bits) on interface \Device\NPF_{AF38AF37-B5CF-4E8F-867B-264BC8F540A8}, id 0
Ethernet II, Src: VMware_f9:fd:da (00:50:56:f9:fd:da), Dst: VMware_c0:b1:ab (00:0c:29:c0:b1:ab)
Internet Protocol Version 4, Src: GYANDE2L.ptcnet.ptc.com (100.64.1.34), Dst: 192.168.15.139 (192.168.15.139)
Transmission Control Protocol, Src Port: 49320, Dst Port: 50303, Seq: 4807, Ack: 1738, Len: 56
[3 Reassembled TCP Segments (72 bytes): #101(12), #102(4), #104(56)]
OpcUa Binary Protocol

No.     DeltaTime Time                    Source                Destination           Protocol Length Stream Index Info                                                            SrcPort DstPort Src Time
    105 0.000s    2025-07-04 05:53:12.252 192.168.15.139        GYANDE2L.ptcnet.ptc.com OpcUa    150    4            UA Secure Conversation Message: ReadRequest                     50303   49320   

Frame 105: 150 bytes on wire (1200 bits), 150 bytes captured (1200 bits) on interface \Device\NPF_{AF38AF37-B5CF-4E8F-867B-264BC8F540A8}, id 0
Ethernet II, Src: VMware_c0:b1:ab (00:0c:29:c0:b1:ab), Dst: VMware_f9:fd:da (00:50:56:f9:fd:da)
Internet Protocol Version 4, Src: 192.168.15.139 (192.168.15.139), Dst: GYANDE2L.ptcnet.ptc.com (100.64.1.34)
Transmission Control Protocol, Src Port: 50303, Dst Port: 49320, Seq: 1738, Ack: 4863, Len: 96
OpcUa Binary Protocol

No.     DeltaTime Time                    Source                Destination           Protocol Length Stream Index Info                                                            SrcPort DstPort Src Time
    107 0.021s    2025-07-04 05:53:12.274 GYANDE2L.ptcnet.ptc.com 192.168.15.139        OpcUa    117    4            UA Secure Conversation Message: ReadResponse                    49320   50303   

Frame 107: 117 bytes on wire (936 bits), 117 bytes captured (936 bits) on interface \Device\NPF_{AF38AF37-B5CF-4E8F-867B-264BC8F540A8}, id 0
Ethernet II, Src: VMware_f9:fd:da (00:50:56:f9:fd:da), Dst: VMware_c0:b1:ab (00:0c:29:c0:b1:ab)
Internet Protocol Version 4, Src: GYANDE2L.ptcnet.ptc.com (100.64.1.34), Dst: 192.168.15.139 (192.168.15.139)
Transmission Control Protocol, Src Port: 49320, Dst Port: 50303, Seq: 4863, Ack: 1834, Len: 63
OpcUa Binary Protocol

No.     DeltaTime Time                    Source                Destination           Protocol Length Stream Index Info                                                            SrcPort DstPort Src Time
    108 0.000s    2025-07-04 05:53:12.274 192.168.15.139        GYANDE2L.ptcnet.ptc.com OpcUa    138    4            UA Secure Conversation Message: CreateSubscriptionRequest       50303   49320   

Frame 108: 138 bytes on wire (1104 bits), 138 bytes captured (1104 bits) on interface \Device\NPF_{AF38AF37-B5CF-4E8F-867B-264BC8F540A8}, id 0
Ethernet II, Src: VMware_c0:b1:ab (00:0c:29:c0:b1:ab), Dst: VMware_f9:fd:da (00:50:56:f9:fd:da)
Internet Protocol Version 4, Src: 192.168.15.139 (192.168.15.139), Dst: GYANDE2L.ptcnet.ptc.com (100.64.1.34)
Transmission Control Protocol, Src Port: 50303, Dst Port: 49320, Seq: 1834, Ack: 4926, Len: 84
OpcUa Binary Protocol

No.     DeltaTime Time                    Source                Destination           Protocol Length Stream Index Info                                                            SrcPort DstPort Src Time
    110 0.019s    2025-07-04 05:53:12.293 GYANDE2L.ptcnet.ptc.com 192.168.15.139        OpcUa    126    4            UA Secure Conversation Message: CreateSubscriptionResponse      49320   50303   

Frame 110: 126 bytes on wire (1008 bits), 126 bytes captured (1008 bits) on interface \Device\NPF_{AF38AF37-B5CF-4E8F-867B-264BC8F540A8}, id 0
Ethernet II, Src: VMware_f9:fd:da (00:50:56:f9:fd:da), Dst: VMware_c0:b1:ab (00:0c:29:c0:b1:ab)
Internet Protocol Version 4, Src: GYANDE2L.ptcnet.ptc.com (100.64.1.34), Dst: 192.168.15.139 (192.168.15.139)
Transmission Control Protocol, Src Port: 49320, Dst Port: 50303, Seq: 4926, Ack: 1918, Len: 72
OpcUa Binary Protocol

No.     DeltaTime Time                    Source                Destination           Protocol Length Stream Index Info                                                            SrcPort DstPort Src Time
    111 0.000s    2025-07-04 05:53:12.294 192.168.15.139        GYANDE2L.ptcnet.ptc.com OpcUa    298    4            UA Secure Conversation Message: CreateMonitoredItemsRequest     50303   49320   

Frame 111: 298 bytes on wire (2384 bits), 298 bytes captured (2384 bits) on interface \Device\NPF_{AF38AF37-B5CF-4E8F-867B-264BC8F540A8}, id 0
Ethernet II, Src: VMware_c0:b1:ab (00:0c:29:c0:b1:ab), Dst: VMware_f9:fd:da (00:50:56:f9:fd:da)
Internet Protocol Version 4, Src: 192.168.15.139 (192.168.15.139), Dst: GYANDE2L.ptcnet.ptc.com (100.64.1.34)
Transmission Control Protocol, Src Port: 50303, Dst Port: 49320, Seq: 1918, Ack: 4998, Len: 244
OpcUa Binary Protocol

No.     DeltaTime Time                    Source                Destination           Protocol Length Stream Index Info                                                            SrcPort DstPort Src Time
    113 0.018s    2025-07-04 05:53:12.312 GYANDE2L.ptcnet.ptc.com 192.168.15.139        OpcUa    137    4            UA Secure Conversation Message: CreateMonitoredItemsResponse    49320   50303   

Frame 113: 137 bytes on wire (1096 bits), 137 bytes captured (1096 bits) on interface \Device\NPF_{AF38AF37-B5CF-4E8F-867B-264BC8F540A8}, id 0
Ethernet II, Src: VMware_f9:fd:da (00:50:56:f9:fd:da), Dst: VMware_c0:b1:ab (00:0c:29:c0:b1:ab)
Internet Protocol Version 4, Src: GYANDE2L.ptcnet.ptc.com (100.64.1.34), Dst: 192.168.15.139 (192.168.15.139)
Transmission Control Protocol, Src Port: 49320, Dst Port: 50303, Seq: 4998, Ack: 2162, Len: 83
OpcUa Binary Protocol

No.     DeltaTime Time                    Source                Destination           Protocol Length Stream Index Info                                                            SrcPort DstPort Src Time
    114 0.000s    2025-07-04 05:53:12.313 192.168.15.139        GYANDE2L.ptcnet.ptc.com OpcUa    124    4            UA Secure Conversation Message: DeleteSubscriptionsRequest      50303   49320   

Frame 114: 124 bytes on wire (992 bits), 124 bytes captured (992 bits) on interface \Device\NPF_{AF38AF37-B5CF-4E8F-867B-264BC8F540A8}, id 0
Ethernet II, Src: VMware_c0:b1:ab (00:0c:29:c0:b1:ab), Dst: VMware_f9:fd:da (00:50:56:f9:fd:da)
Internet Protocol Version 4, Src: 192.168.15.139 (192.168.15.139), Dst: GYANDE2L.ptcnet.ptc.com (100.64.1.34)
Transmission Control Protocol, Src Port: 50303, Dst Port: 49320, Seq: 2162, Ack: 5081, Len: 70
OpcUa Binary Protocol

No.     DeltaTime Time                    Source                Destination           Protocol Length Stream Index Info                                                            SrcPort DstPort Src Time
    116 0.017s    2025-07-04 05:53:12.330 GYANDE2L.ptcnet.ptc.com 192.168.15.139        OpcUa    118    4            UA Secure Conversation Message: DeleteSubscriptionsResponse     49320   50303   

Frame 116: 118 bytes on wire (944 bits), 118 bytes captured (944 bits) on interface \Device\NPF_{AF38AF37-B5CF-4E8F-867B-264BC8F540A8}, id 0
Ethernet II, Src: VMware_f9:fd:da (00:50:56:f9:fd:da), Dst: VMware_c0:b1:ab (00:0c:29:c0:b1:ab)
Internet Protocol Version 4, Src: GYANDE2L.ptcnet.ptc.com (100.64.1.34), Dst: 192.168.15.139 (192.168.15.139)
Transmission Control Protocol, Src Port: 49320, Dst Port: 50303, Seq: 5081, Ack: 2232, Len: 64
OpcUa Binary Protocol

No.     DeltaTime Time                    Source                Destination           Protocol Length Stream Index Info                                                            SrcPort DstPort Src Time
    117 0.000s    2025-07-04 05:53:12.331 192.168.15.139        GYANDE2L.ptcnet.ptc.com OpcUa    155    4            UA Secure Conversation Message: BrowseRequest                   50303   49320   

Frame 117: 155 bytes on wire (1240 bits), 155 bytes captured (1240 bits) on interface \Device\NPF_{AF38AF37-B5CF-4E8F-867B-264BC8F540A8}, id 0
Ethernet II, Src: VMware_c0:b1:ab (00:0c:29:c0:b1:ab), Dst: VMware_f9:fd:da (00:50:56:f9:fd:da)
Internet Protocol Version 4, Src: 192.168.15.139 (192.168.15.139), Dst: GYANDE2L.ptcnet.ptc.com (100.64.1.34)
Transmission Control Protocol, Src Port: 50303, Dst Port: 49320, Seq: 2232, Ack: 5145, Len: 101
OpcUa Binary Protocol

No.     DeltaTime Time                    Source                Destination           Protocol Length Stream Index Info                                                            SrcPort DstPort Src Time
    120 0.018s    2025-07-04 05:53:12.349 GYANDE2L.ptcnet.ptc.com 192.168.15.139        OpcUa    244    4            UA Secure Conversation Message: BrowseResponse                  49320   50303   

Frame 120: 244 bytes on wire (1952 bits), 244 bytes captured (1952 bits) on interface \Device\NPF_{AF38AF37-B5CF-4E8F-867B-264BC8F540A8}, id 0
Ethernet II, Src: VMware_f9:fd:da (00:50:56:f9:fd:da), Dst: VMware_c0:b1:ab (00:0c:29:c0:b1:ab)
Internet Protocol Version 4, Src: GYANDE2L.ptcnet.ptc.com (100.64.1.34), Dst: 192.168.15.139 (192.168.15.139)
Transmission Control Protocol, Src Port: 49320, Dst Port: 50303, Seq: 5145, Ack: 2333, Len: 190
OpcUa Binary Protocol

No.     DeltaTime Time                    Source                Destination           Protocol Length Stream Index Info                                                            SrcPort DstPort Src Time
    121 0.000s    2025-07-04 05:53:12.350 192.168.15.139        GYANDE2L.ptcnet.ptc.com OpcUa    292    4            UA Secure Conversation Message: ReadRequest                     50303   49320   

Frame 121: 292 bytes on wire (2336 bits), 292 bytes captured (2336 bits) on interface \Device\NPF_{AF38AF37-B5CF-4E8F-867B-264BC8F540A8}, id 0
Ethernet II, Src: VMware_c0:b1:ab (00:0c:29:c0:b1:ab), Dst: VMware_f9:fd:da (00:50:56:f9:fd:da)
Internet Protocol Version 4, Src: 192.168.15.139 (192.168.15.139), Dst: GYANDE2L.ptcnet.ptc.com (100.64.1.34)
Transmission Control Protocol, Src Port: 50303, Dst Port: 49320, Seq: 2333, Ack: 5335, Len: 238
OpcUa Binary Protocol

No.     DeltaTime Time                    Source                Destination           Protocol Length Stream Index Info                                                            SrcPort DstPort Src Time
    123 0.018s    2025-07-04 05:53:12.368 GYANDE2L.ptcnet.ptc.com 192.168.15.139        OpcUa    290    4            UA Secure Conversation Message: ReadResponse                    49320   50303   

Frame 123: 290 bytes on wire (2320 bits), 290 bytes captured (2320 bits) on interface \Device\NPF_{AF38AF37-B5CF-4E8F-867B-264BC8F540A8}, id 0
Ethernet II, Src: VMware_f9:fd:da (00:50:56:f9:fd:da), Dst: VMware_c0:b1:ab (00:0c:29:c0:b1:ab)
Internet Protocol Version 4, Src: GYANDE2L.ptcnet.ptc.com (100.64.1.34), Dst: 192.168.15.139 (192.168.15.139)
Transmission Control Protocol, Src Port: 49320, Dst Port: 50303, Seq: 5335, Ack: 2571, Len: 236
OpcUa Binary Protocol

No.     DeltaTime Time                    Source                Destination           Protocol Length Stream Index Info                                                            SrcPort DstPort Src Time
    124 0.000s    2025-07-04 05:53:12.368 192.168.15.139        GYANDE2L.ptcnet.ptc.com OpcUa    155    4            UA Secure Conversation Message: BrowseRequest                   50303   49320   

Frame 124: 155 bytes on wire (1240 bits), 155 bytes captured (1240 bits) on interface \Device\NPF_{AF38AF37-B5CF-4E8F-867B-264BC8F540A8}, id 0
Ethernet II, Src: VMware_c0:b1:ab (00:0c:29:c0:b1:ab), Dst: VMware_f9:fd:da (00:50:56:f9:fd:da)
Internet Protocol Version 4, Src: 192.168.15.139 (192.168.15.139), Dst: GYANDE2L.ptcnet.ptc.com (100.64.1.34)
Transmission Control Protocol, Src Port: 50303, Dst Port: 49320, Seq: 2571, Ack: 5571, Len: 101
OpcUa Binary Protocol

No.     DeltaTime Time                    Source                Destination           Protocol Length Stream Index Info                                                            SrcPort DstPort Src Time
    126 0.017s    2025-07-04 05:53:12.386 GYANDE2L.ptcnet.ptc.com 192.168.15.139        OpcUa    144    4            UA Secure Conversation Message: BrowseResponse                  49320   50303   

Frame 126: 144 bytes on wire (1152 bits), 144 bytes captured (1152 bits) on interface \Device\NPF_{AF38AF37-B5CF-4E8F-867B-264BC8F540A8}, id 0
Ethernet II, Src: VMware_f9:fd:da (00:50:56:f9:fd:da), Dst: VMware_c0:b1:ab (00:0c:29:c0:b1:ab)
Internet Protocol Version 4, Src: GYANDE2L.ptcnet.ptc.com (100.64.1.34), Dst: 192.168.15.139 (192.168.15.139)
Transmission Control Protocol, Src Port: 49320, Dst Port: 50303, Seq: 5571, Ack: 2672, Len: 90
OpcUa Binary Protocol

No.     DeltaTime Time                    Source                Destination           Protocol Length Stream Index Info                                                            SrcPort DstPort Src Time
    127 0.000s    2025-07-04 05:53:12.386 192.168.15.139        GYANDE2L.ptcnet.ptc.com OpcUa    292    4            UA Secure Conversation Message: ReadRequest                     50303   49320   

Frame 127: 292 bytes on wire (2336 bits), 292 bytes captured (2336 bits) on interface \Device\NPF_{AF38AF37-B5CF-4E8F-867B-264BC8F540A8}, id 0
Ethernet II, Src: VMware_c0:b1:ab (00:0c:29:c0:b1:ab), Dst: VMware_f9:fd:da (00:50:56:f9:fd:da)
Internet Protocol Version 4, Src: 192.168.15.139 (192.168.15.139), Dst: GYANDE2L.ptcnet.ptc.com (100.64.1.34)
Transmission Control Protocol, Src Port: 50303, Dst Port: 49320, Seq: 2672, Ack: 5661, Len: 238
OpcUa Binary Protocol

No.     DeltaTime Time                    Source                Destination           Protocol Length Stream Index Info                                                            SrcPort DstPort Src Time
    129 0.018s    2025-07-04 05:53:12.404 GYANDE2L.ptcnet.ptc.com 192.168.15.139        OpcUa    279    4            UA Secure Conversation Message: ReadResponse                    49320   50303   

Frame 129: 279 bytes on wire (2232 bits), 279 bytes captured (2232 bits) on interface \Device\NPF_{AF38AF37-B5CF-4E8F-867B-264BC8F540A8}, id 0
Ethernet II, Src: VMware_f9:fd:da (00:50:56:f9:fd:da), Dst: VMware_c0:b1:ab (00:0c:29:c0:b1:ab)
Internet Protocol Version 4, Src: GYANDE2L.ptcnet.ptc.com (100.64.1.34), Dst: 192.168.15.139 (192.168.15.139)
Transmission Control Protocol, Src Port: 49320, Dst Port: 50303, Seq: 5661, Ack: 2910, Len: 225
OpcUa Binary Protocol

No.     DeltaTime Time                    Source                Destination           Protocol Length Stream Index Info                                                            SrcPort DstPort Src Time
    130 0.000s    2025-07-04 05:53:12.404 192.168.15.139        GYANDE2L.ptcnet.ptc.com OpcUa    155    4            UA Secure Conversation Message: BrowseRequest                   50303   49320   

Frame 130: 155 bytes on wire (1240 bits), 155 bytes captured (1240 bits) on interface \Device\NPF_{AF38AF37-B5CF-4E8F-867B-264BC8F540A8}, id 0
Ethernet II, Src: VMware_c0:b1:ab (00:0c:29:c0:b1:ab), Dst: VMware_f9:fd:da (00:50:56:f9:fd:da)
Internet Protocol Version 4, Src: 192.168.15.139 (192.168.15.139), Dst: GYANDE2L.ptcnet.ptc.com (100.64.1.34)
Transmission Control Protocol, Src Port: 50303, Dst Port: 49320, Seq: 2910, Ack: 5886, Len: 101
OpcUa Binary Protocol

No.     DeltaTime Time                    Source                Destination           Protocol Length Stream Index Info                                                            SrcPort DstPort Src Time
    132 0.017s    2025-07-04 05:53:12.422 GYANDE2L.ptcnet.ptc.com 192.168.15.139        OpcUa    144    4            UA Secure Conversation Message: BrowseResponse                  49320   50303   

Frame 132: 144 bytes on wire (1152 bits), 144 bytes captured (1152 bits) on interface \Device\NPF_{AF38AF37-B5CF-4E8F-867B-264BC8F540A8}, id 0
Ethernet II, Src: VMware_f9:fd:da (00:50:56:f9:fd:da), Dst: VMware_c0:b1:ab (00:0c:29:c0:b1:ab)
Internet Protocol Version 4, Src: GYANDE2L.ptcnet.ptc.com (100.64.1.34), Dst: 192.168.15.139 (192.168.15.139)
Transmission Control Protocol, Src Port: 49320, Dst Port: 50303, Seq: 5886, Ack: 3011, Len: 90
OpcUa Binary Protocol

