No.     DeltaTime Time                    Source                Destination           Protocol Length Stream Index Info                                                            SrcPort DstPort Src Time
     72 0.000s    2025-07-04 06:43:01.619 192.168.15.139        GYANDE2L.ptcnet.ptc.com OpcUa    125    2            Hello message                                                   50835   60001   

Frame 72: 125 bytes on wire (1000 bits), 125 bytes captured (1000 bits) on interface \Device\NPF_{AF38AF37-B5CF-4E8F-867B-264BC8F540A8}, id 0
Ethernet II, Src: VMware_c0:b1:ab (00:0c:29:c0:b1:ab), Dst: VMware_f9:fd:da (00:50:56:f9:fd:da)
Internet Protocol Version 4, Src: 192.168.15.139 (192.168.15.139), Dst: GYANDE2L.ptcnet.ptc.com (100.64.1.34)
Transmission Control Protocol, Src Port: 50835, Dst Port: 60001, Seq: 1, Ack: 1, Len: 71
OpcUa Binary Protocol
    Message Type: HEL
    Chunk Type: F
    Message Size: 71
    Version: 0
    ReceiveBufferSize: 65536
    SendBufferSize: 65536
    MaxMessageSize: 16777216
    MaxChunkCount: 5000
    EndpointUrl: opc.tcp://GYANDE2L.ptcnet.ptc.com:60001

No.     DeltaTime Time                    Source                Destination           Protocol Length Stream Index Info                                                            SrcPort DstPort Src Time
     74 0.033s    2025-07-04 06:43:01.652 GYANDE2L.ptcnet.ptc.com 192.168.15.139        OpcUa    82     2            Acknowledge message                                             60001   50835   

Frame 74: 82 bytes on wire (656 bits), 82 bytes captured (656 bits) on interface \Device\NPF_{AF38AF37-B5CF-4E8F-867B-264BC8F540A8}, id 0
Ethernet II, Src: VMware_f9:fd:da (00:50:56:f9:fd:da), Dst: VMware_c0:b1:ab (00:0c:29:c0:b1:ab)
Internet Protocol Version 4, Src: GYANDE2L.ptcnet.ptc.com (100.64.1.34), Dst: 192.168.15.139 (192.168.15.139)
Transmission Control Protocol, Src Port: 60001, Dst Port: 50835, Seq: 1, Ack: 72, Len: 28
OpcUa Binary Protocol
    Message Type: ACK
    Chunk Type: F
    Message Size: 28
    Version: 0
    ReceiveBufferSize: 65535
    SendBufferSize: 65535
    MaxMessageSize: 4194304
    MaxChunkCount: 65

No.     DeltaTime Time                    Source                Destination           Protocol Length Stream Index Info                                                            SrcPort DstPort Src Time
     75 0.000s    2025-07-04 06:43:01.653 192.168.15.139        GYANDE2L.ptcnet.ptc.com OpcUa    187    2            OpenSecureChannel message                                       50835   60001   

Frame 75: 187 bytes on wire (1496 bits), 187 bytes captured (1496 bits) on interface \Device\NPF_{AF38AF37-B5CF-4E8F-867B-264BC8F540A8}, id 0
Ethernet II, Src: VMware_c0:b1:ab (00:0c:29:c0:b1:ab), Dst: VMware_f9:fd:da (00:50:56:f9:fd:da)
Internet Protocol Version 4, Src: 192.168.15.139 (192.168.15.139), Dst: GYANDE2L.ptcnet.ptc.com (100.64.1.34)
Transmission Control Protocol, Src Port: 50835, Dst Port: 60001, Seq: 72, Ack: 29, Len: 133
OpcUa Binary Protocol
    Message Type: OPN
    Chunk Type: F
    Message Size: 133
    SecureChannelId: 0
    SecurityPolicyUri: http://opcfoundation.org/UA/SecurityPolicy#None
    SenderCertificate: <MISSING>[OpcUa Null ByteString]
    ReceiverCertificateThumbprint: <MISSING>[OpcUa Null ByteString]
    Sequence Number: 1
    RequestId: 1
    Message: Encodeable Object
        TypeId: ExpandedNodeId
            NodeId EncodingMask: Four byte encoded Numeric (0x01)
            NodeId Namespace Index: 0
            NodeId Identifier Numeric: OpenSecureChannelRequest (446)
        OpenSecureChannelRequest
            RequestHeader: RequestHeader
                AuthenticationToken: NodeId
                    .... 0000 = EncodingMask: Two byte encoded Numeric (0x0)
                    Identifier Numeric: 0
                Timestamp: Jul  4, 2025 12:13:01.653051500 India Standard Time
                RequestHandle: 0
                Return Diagnostics: 0x00000000
                    .... .... .... ...0 = ServiceLevel / SymbolicId: False
                    .... .... .... ..0. = ServiceLevel / LocalizedText: False
                    .... .... .... .0.. = ServiceLevel / AdditionalInfo: False
                    .... .... .... 0... = ServiceLevel / Inner StatusCode: False
                    .... .... ...0 .... = ServiceLevel / Inner Diagnostics: False
                    .... .... ..0. .... = OperationLevel / SymbolicId: False
                    .... .... .0.. .... = OperationLevel / LocalizedText: False
                    .... .... 0... .... = OperationLevel / AdditionalInfo: False
                    .... ...0 .... .... = OperationLevel / Inner StatusCode: False
                    .... ..0. .... .... = OperationLevel / Inner Diagnostics: False
                AuditEntryId: [OpcUa Null String]
                TimeoutHint: 0
                AdditionalHeader: ExtensionObject
                    TypeId: NodeId
                        .... 0000 = EncodingMask: Two byte encoded Numeric (0x0)
                        Identifier Numeric: 0
                    EncodingMask: 0x00
                        .... ...0 = has binary body: False
                        .... ..0. = has xml body: False
            ClientProtocolVersion: 0
            SecurityTokenRequestType: Issue (0x00000000)
            MessageSecurityMode: None (0x00000001)
            ClientNonce: 00
            RequestedLifetime: 300000

No.     DeltaTime Time                    Source                Destination           Protocol Length Stream Index Info                                                            SrcPort DstPort Src Time
     77 0.018s    2025-07-04 06:43:01.672 GYANDE2L.ptcnet.ptc.com 192.168.15.139        OpcUa    189    2            OpenSecureChannel message                                       60001   50835   

Frame 77: 189 bytes on wire (1512 bits), 189 bytes captured (1512 bits) on interface \Device\NPF_{AF38AF37-B5CF-4E8F-867B-264BC8F540A8}, id 0
Ethernet II, Src: VMware_f9:fd:da (00:50:56:f9:fd:da), Dst: VMware_c0:b1:ab (00:0c:29:c0:b1:ab)
Internet Protocol Version 4, Src: GYANDE2L.ptcnet.ptc.com (100.64.1.34), Dst: 192.168.15.139 (192.168.15.139)
Transmission Control Protocol, Src Port: 60001, Dst Port: 50835, Seq: 29, Ack: 205, Len: 135
OpcUa Binary Protocol
    Message Type: OPN
    Chunk Type: F
    Message Size: 135
    SecureChannelId: 3
    SecurityPolicyUri: http://opcfoundation.org/UA/SecurityPolicy#None
    SenderCertificate: <MISSING>[OpcUa Null ByteString]
    ReceiverCertificateThumbprint: <MISSING>[OpcUa Null ByteString]
    Sequence Number: 1
    RequestId: 1
    Message: Encodeable Object
        TypeId: ExpandedNodeId
            NodeId EncodingMask: Four byte encoded Numeric (0x01)
            NodeId Namespace Index: 0
            NodeId Identifier Numeric: OpenSecureChannelResponse (449)
        OpenSecureChannelResponse
            ResponseHeader: ResponseHeader
                Timestamp: Jul  4, 2025 12:13:01.725972200 India Standard Time
                RequestHandle: 0
                ServiceResult: 0x00000000 [Good]
                ServiceDiagnostics: DiagnosticInfo
                    EncodingMask: 0x00
                        .... ...0 = has symbolic id: False
                        .... ..0. = has namespace: False
                        .... .0.. = has localizedtext: False
                        .... 0... = has locale: False
                        ...0 .... = has additional info: False
                        ..0. .... = has inner statuscode: False
                        .0.. .... = has inner diagnostic info: False
                StringTable: Array of String
                    ArraySize: 0
                AdditionalHeader: ExtensionObject
                    TypeId: NodeId
                        .... 0000 = EncodingMask: Two byte encoded Numeric (0x0)
                        Identifier Numeric: 0
                    EncodingMask: 0x00
                        .... ...0 = has binary body: False
                        .... ..0. = has xml body: False
            ServerProtocolVersion: 0
            SecurityToken: ChannelSecurityToken
                ChannelId: 3
                TokenId: 1
                CreatedAt: Jul  4, 2025 12:13:01.725955400 India Standard Time
                RevisedLifetime: 300000
            ServerNonce: <MISSING>[OpcUa Null ByteString]

No.     DeltaTime Time                    Source                Destination           Protocol Length Stream Index Info                                                            SrcPort DstPort Src Time
     78 0.000s    2025-07-04 06:43:01.672 192.168.15.139        GYANDE2L.ptcnet.ptc.com OpcUa    162    2            UA Secure Conversation Message: GetEndpointsRequest             50835   60001   

Frame 78: 162 bytes on wire (1296 bits), 162 bytes captured (1296 bits) on interface \Device\NPF_{AF38AF37-B5CF-4E8F-867B-264BC8F540A8}, id 0
Ethernet II, Src: VMware_c0:b1:ab (00:0c:29:c0:b1:ab), Dst: VMware_f9:fd:da (00:50:56:f9:fd:da)
Internet Protocol Version 4, Src: 192.168.15.139 (192.168.15.139), Dst: GYANDE2L.ptcnet.ptc.com (100.64.1.34)
Transmission Control Protocol, Src Port: 50835, Dst Port: 60001, Seq: 205, Ack: 164, Len: 108
OpcUa Binary Protocol
    Message Type: MSG
    Chunk Type: F
    Message Size: 108
    SecureChannelId: 3
    Security Token Id: 1
    Sequence Number: 2
    RequestId: 2
    Message: Encodeable Object
        TypeId: ExpandedNodeId
            NodeId EncodingMask: Four byte encoded Numeric (0x01)
            NodeId Namespace Index: 0
            NodeId Identifier Numeric: GetEndpointsRequest (428)
        GetEndpointsRequest
            RequestHeader: RequestHeader
                AuthenticationToken: NodeId
                    .... 0000 = EncodingMask: Two byte encoded Numeric (0x0)
                    Identifier Numeric: 0
                Timestamp: Jul  4, 2025 12:13:01.672088400 India Standard Time
                RequestHandle: 1
                Return Diagnostics: 0x00000000
                    .... .... .... ...0 = ServiceLevel / SymbolicId: False
                    .... .... .... ..0. = ServiceLevel / LocalizedText: False
                    .... .... .... .0.. = ServiceLevel / AdditionalInfo: False
                    .... .... .... 0... = ServiceLevel / Inner StatusCode: False
                    .... .... ...0 .... = ServiceLevel / Inner Diagnostics: False
                    .... .... ..0. .... = OperationLevel / SymbolicId: False
                    .... .... .0.. .... = OperationLevel / LocalizedText: False
                    .... .... 0... .... = OperationLevel / AdditionalInfo: False
                    .... ...0 .... .... = OperationLevel / Inner StatusCode: False
                    .... ..0. .... .... = OperationLevel / Inner Diagnostics: False
                AuditEntryId: [OpcUa Null String]
                TimeoutHint: 10000
                AdditionalHeader: ExtensionObject
                    TypeId: NodeId
                        .... 0000 = EncodingMask: Two byte encoded Numeric (0x0)
                        Identifier Numeric: 0
                    EncodingMask: 0x00
                        .... ...0 = has binary body: False
                        .... ..0. = has xml body: False
            EndpointUrl: opc.tcp://GYANDE2L.ptcnet.ptc.com:60001
            LocaleIds: Array of String
                ArraySize: 0
            ProfileUris: Array of String
                ArraySize: 0

No.     DeltaTime Time                    Source                Destination           Protocol Length Stream Index Info                                                            SrcPort DstPort Src Time
     80 0.020s    2025-07-04 06:43:01.692 GYANDE2L.ptcnet.ptc.com 192.168.15.139        OpcUa    459    2            UA Secure Conversation Message: GetEndpointsResponse            60001   50835   

Frame 80: 459 bytes on wire (3672 bits), 459 bytes captured (3672 bits) on interface \Device\NPF_{AF38AF37-B5CF-4E8F-867B-264BC8F540A8}, id 0
Ethernet II, Src: VMware_f9:fd:da (00:50:56:f9:fd:da), Dst: VMware_c0:b1:ab (00:0c:29:c0:b1:ab)
Internet Protocol Version 4, Src: GYANDE2L.ptcnet.ptc.com (100.64.1.34), Dst: 192.168.15.139 (192.168.15.139)
Transmission Control Protocol, Src Port: 60001, Dst Port: 50835, Seq: 164, Ack: 313, Len: 405
OpcUa Binary Protocol
    Message Type: MSG
    Chunk Type: F
    Message Size: 405
    SecureChannelId: 3
    Security Token Id: 1
    Sequence Number: 2
    RequestId: 2
    Message: Encodeable Object
        TypeId: ExpandedNodeId
            NodeId EncodingMask: Four byte encoded Numeric (0x01)
            NodeId Namespace Index: 0
            NodeId Identifier Numeric: GetEndpointsResponse (431)
        GetEndpointsResponse
            ResponseHeader: ResponseHeader
                Timestamp: Jul  4, 2025 12:13:01.746181400 India Standard Time
                RequestHandle: 1
                ServiceResult: 0x00000000 [Good]
                ServiceDiagnostics: DiagnosticInfo
                    EncodingMask: 0x00
                        .... ...0 = has symbolic id: False
                        .... ..0. = has namespace: False
                        .... .0.. = has localizedtext: False
                        .... 0... = has locale: False
                        ...0 .... = has additional info: False
                        ..0. .... = has inner statuscode: False
                        .0.. .... = has inner diagnostic info: False
                StringTable: Array of String
                    ArraySize: 0
                AdditionalHeader: ExtensionObject
                    TypeId: NodeId
                        .... 0000 = EncodingMask: Two byte encoded Numeric (0x0)
                        Identifier Numeric: 0
                    EncodingMask: 0x00
                        .... ...0 = has binary body: False
                        .... ..0. = has xml body: False
            Endpoints: Array of EndpointDescription
                ArraySize: 1
                [0]: EndpointDescription
                    EndpointUrl: opc.tcp://gyande2l:60001/
                    Server: ApplicationDescription
                        ApplicationUri: urn:GYANDE2L:UA:UAGateway
                        ProductUri: uri:ptc:UAGateway
                        ApplicationName: LocalizedText
                            EncodingMask: 0x03, has locale information, has text
                                .... ...1 = has locale information: True
                                .... ..1. = has text: True
                            Locale: en-US
                            Text: UA Gateway
                        ApplicationType: ClientAndServer (0x00000002)
                        GatewayServerUri: [OpcUa Null String]
                        DiscoveryProfileUri: [OpcUa Null String]
                        DiscoveryUrls: Array of String
                            ArraySize: 1
                            [0]: DiscoveryUrls: opc.tcp://gyande2l:60001/
                    ServerCertificate: <MISSING>[OpcUa Null ByteString]
                    MessageSecurityMode: None (0x00000001)
                    SecurityPolicyUri: http://opcfoundation.org/UA/SecurityPolicy#None
                    UserIdentityTokens: Array of UserTokenPolicy
                        ArraySize: 1
                        [0]: UserTokenPolicy
                            PolicyId: 1
                            UserTokenType: Anonymous (0x00000000)
                            IssuedTokenType: [OpcUa Null String]
                            IssuerEndpointUrl: [OpcUa Null String]
                            SecurityPolicyUri: http://opcfoundation.org/UA/SecurityPolicy#None
                    TransportProfileUri: http://opcfoundation.org/UA-Profile/Transport/uatcp-uasc-uabinary
                    SecurityLevel: 0

No.     DeltaTime Time                    Source                Destination           Protocol Length Stream Index Info                                                            SrcPort DstPort Src Time
     81 0.000s    2025-07-04 06:43:01.693 192.168.15.139        GYANDE2L.ptcnet.ptc.com OpcUa    111    2            CloseSecureChannel message: CloseSecureChannelRequest           50835   60001   

Frame 81: 111 bytes on wire (888 bits), 111 bytes captured (888 bits) on interface \Device\NPF_{AF38AF37-B5CF-4E8F-867B-264BC8F540A8}, id 0
Ethernet II, Src: VMware_c0:b1:ab (00:0c:29:c0:b1:ab), Dst: VMware_f9:fd:da (00:50:56:f9:fd:da)
Internet Protocol Version 4, Src: 192.168.15.139 (192.168.15.139), Dst: GYANDE2L.ptcnet.ptc.com (100.64.1.34)
Transmission Control Protocol, Src Port: 50835, Dst Port: 60001, Seq: 313, Ack: 569, Len: 57
OpcUa Binary Protocol
    Message Type: CLO
    Chunk Type: F
    Message Size: 57
    SecureChannelId: 3
    Security Token Id: 1
    Sequence Number: 3
    RequestId: 3
    Message: Encodeable Object
        TypeId: ExpandedNodeId
            NodeId EncodingMask: Four byte encoded Numeric (0x01)
            NodeId Namespace Index: 0
            NodeId Identifier Numeric: CloseSecureChannelRequest (452)
        CloseSecureChannelRequest
            RequestHeader: RequestHeader
                AuthenticationToken: NodeId
                    .... 0000 = EncodingMask: Two byte encoded Numeric (0x0)
                    Identifier Numeric: 0
                Timestamp: Jul  4, 2025 12:13:01.693040600 India Standard Time
                RequestHandle: 0
                Return Diagnostics: 0x00000000
                    .... .... .... ...0 = ServiceLevel / SymbolicId: False
                    .... .... .... ..0. = ServiceLevel / LocalizedText: False
                    .... .... .... .0.. = ServiceLevel / AdditionalInfo: False
                    .... .... .... 0... = ServiceLevel / Inner StatusCode: False
                    .... .... ...0 .... = ServiceLevel / Inner Diagnostics: False
                    .... .... ..0. .... = OperationLevel / SymbolicId: False
                    .... .... .0.. .... = OperationLevel / LocalizedText: False
                    .... .... 0... .... = OperationLevel / AdditionalInfo: False
                    .... ...0 .... .... = OperationLevel / Inner StatusCode: False
                    .... ..0. .... .... = OperationLevel / Inner Diagnostics: False
                AuditEntryId: [OpcUa Null String]
                TimeoutHint: 0
                AdditionalHeader: ExtensionObject
                    TypeId: NodeId
                        .... 0000 = EncodingMask: Two byte encoded Numeric (0x0)
                        Identifier Numeric: 0
                    EncodingMask: 0x00
                        .... ...0 = has binary body: False
                        .... ..0. = has xml body: False

No.     DeltaTime Time                    Source                Destination           Protocol Length Stream Index Info                                                            SrcPort DstPort Src Time
     90 0.061s    2025-07-04 06:43:01.754 192.168.15.139        GYANDE2L.ptcnet.ptc.com OpcUa    125    3            Hello message                                                   50836   60001   

Frame 90: 125 bytes on wire (1000 bits), 125 bytes captured (1000 bits) on interface \Device\NPF_{AF38AF37-B5CF-4E8F-867B-264BC8F540A8}, id 0
Ethernet II, Src: VMware_c0:b1:ab (00:0c:29:c0:b1:ab), Dst: VMware_f9:fd:da (00:50:56:f9:fd:da)
Internet Protocol Version 4, Src: 192.168.15.139 (192.168.15.139), Dst: GYANDE2L.ptcnet.ptc.com (100.64.1.34)
Transmission Control Protocol, Src Port: 50836, Dst Port: 60001, Seq: 1, Ack: 1, Len: 71
OpcUa Binary Protocol
    Message Type: HEL
    Chunk Type: F
    Message Size: 71
    Version: 0
    ReceiveBufferSize: 65536
    SendBufferSize: 65536
    MaxMessageSize: 16777216
    MaxChunkCount: 5000
    EndpointUrl: opc.tcp://GYANDE2L.ptcnet.ptc.com:60001

No.     DeltaTime Time                    Source                Destination           Protocol Length Stream Index Info                                                            SrcPort DstPort Src Time
     92 0.083s    2025-07-04 06:43:01.837 GYANDE2L.ptcnet.ptc.com 192.168.15.139        OpcUa    82     3            Acknowledge message                                             60001   50836   

Frame 92: 82 bytes on wire (656 bits), 82 bytes captured (656 bits) on interface \Device\NPF_{AF38AF37-B5CF-4E8F-867B-264BC8F540A8}, id 0
Ethernet II, Src: VMware_f9:fd:da (00:50:56:f9:fd:da), Dst: VMware_c0:b1:ab (00:0c:29:c0:b1:ab)
Internet Protocol Version 4, Src: GYANDE2L.ptcnet.ptc.com (100.64.1.34), Dst: 192.168.15.139 (192.168.15.139)
Transmission Control Protocol, Src Port: 60001, Dst Port: 50836, Seq: 1, Ack: 72, Len: 28
OpcUa Binary Protocol
    Message Type: ACK
    Chunk Type: F
    Message Size: 28
    Version: 0
    ReceiveBufferSize: 65535
    SendBufferSize: 65535
    MaxMessageSize: 4194304
    MaxChunkCount: 65

No.     DeltaTime Time                    Source                Destination           Protocol Length Stream Index Info                                                            SrcPort DstPort Src Time
     93 0.000s    2025-07-04 06:43:01.838 192.168.15.139        GYANDE2L.ptcnet.ptc.com OpcUa    187    3            OpenSecureChannel message                                       50836   60001   

Frame 93: 187 bytes on wire (1496 bits), 187 bytes captured (1496 bits) on interface \Device\NPF_{AF38AF37-B5CF-4E8F-867B-264BC8F540A8}, id 0
Ethernet II, Src: VMware_c0:b1:ab (00:0c:29:c0:b1:ab), Dst: VMware_f9:fd:da (00:50:56:f9:fd:da)
Internet Protocol Version 4, Src: 192.168.15.139 (192.168.15.139), Dst: GYANDE2L.ptcnet.ptc.com (100.64.1.34)
Transmission Control Protocol, Src Port: 50836, Dst Port: 60001, Seq: 72, Ack: 29, Len: 133
OpcUa Binary Protocol
    Message Type: OPN
    Chunk Type: F
    Message Size: 133
    SecureChannelId: 0
    SecurityPolicyUri: http://opcfoundation.org/UA/SecurityPolicy#None
    SenderCertificate: <MISSING>[OpcUa Null ByteString]
    ReceiverCertificateThumbprint: <MISSING>[OpcUa Null ByteString]
    Sequence Number: 1
    RequestId: 1
    Message: Encodeable Object
        TypeId: ExpandedNodeId
            NodeId EncodingMask: Four byte encoded Numeric (0x01)
            NodeId Namespace Index: 0
            NodeId Identifier Numeric: OpenSecureChannelRequest (446)
        OpenSecureChannelRequest
            RequestHeader: RequestHeader
                AuthenticationToken: NodeId
                    .... 0000 = EncodingMask: Two byte encoded Numeric (0x0)
                    Identifier Numeric: 0
                Timestamp: Jul  4, 2025 12:13:01.838009000 India Standard Time
                RequestHandle: 0
                Return Diagnostics: 0x00000000
                    .... .... .... ...0 = ServiceLevel / SymbolicId: False
                    .... .... .... ..0. = ServiceLevel / LocalizedText: False
                    .... .... .... .0.. = ServiceLevel / AdditionalInfo: False
                    .... .... .... 0... = ServiceLevel / Inner StatusCode: False
                    .... .... ...0 .... = ServiceLevel / Inner Diagnostics: False
                    .... .... ..0. .... = OperationLevel / SymbolicId: False
                    .... .... .0.. .... = OperationLevel / LocalizedText: False
                    .... .... 0... .... = OperationLevel / AdditionalInfo: False
                    .... ...0 .... .... = OperationLevel / Inner StatusCode: False
                    .... ..0. .... .... = OperationLevel / Inner Diagnostics: False
                AuditEntryId: [OpcUa Null String]
                TimeoutHint: 0
                AdditionalHeader: ExtensionObject
                    TypeId: NodeId
                        .... 0000 = EncodingMask: Two byte encoded Numeric (0x0)
                        Identifier Numeric: 0
                    EncodingMask: 0x00
                        .... ...0 = has binary body: False
                        .... ..0. = has xml body: False
            ClientProtocolVersion: 0
            SecurityTokenRequestType: Issue (0x00000000)
            MessageSecurityMode: None (0x00000001)
            ClientNonce: 00
            RequestedLifetime: 3600000

No.     DeltaTime Time                    Source                Destination           Protocol Length Stream Index Info                                                            SrcPort DstPort Src Time
     95 0.021s    2025-07-04 06:43:01.859 GYANDE2L.ptcnet.ptc.com 192.168.15.139        OpcUa    189    3            OpenSecureChannel message                                       60001   50836   

Frame 95: 189 bytes on wire (1512 bits), 189 bytes captured (1512 bits) on interface \Device\NPF_{AF38AF37-B5CF-4E8F-867B-264BC8F540A8}, id 0
Ethernet II, Src: VMware_f9:fd:da (00:50:56:f9:fd:da), Dst: VMware_c0:b1:ab (00:0c:29:c0:b1:ab)
Internet Protocol Version 4, Src: GYANDE2L.ptcnet.ptc.com (100.64.1.34), Dst: 192.168.15.139 (192.168.15.139)
Transmission Control Protocol, Src Port: 60001, Dst Port: 50836, Seq: 29, Ack: 205, Len: 135
OpcUa Binary Protocol
    Message Type: OPN
    Chunk Type: F
    Message Size: 135
    SecureChannelId: 4
    SecurityPolicyUri: http://opcfoundation.org/UA/SecurityPolicy#None
    SenderCertificate: <MISSING>[OpcUa Null ByteString]
    ReceiverCertificateThumbprint: <MISSING>[OpcUa Null ByteString]
    Sequence Number: 1
    RequestId: 1
    Message: Encodeable Object
        TypeId: ExpandedNodeId
            NodeId EncodingMask: Four byte encoded Numeric (0x01)
            NodeId Namespace Index: 0
            NodeId Identifier Numeric: OpenSecureChannelResponse (449)
        OpenSecureChannelResponse
            ResponseHeader: ResponseHeader
                Timestamp: Jul  4, 2025 12:13:01.910677500 India Standard Time
                RequestHandle: 0
                ServiceResult: 0x00000000 [Good]
                ServiceDiagnostics: DiagnosticInfo
                    EncodingMask: 0x00
                        .... ...0 = has symbolic id: False
                        .... ..0. = has namespace: False
                        .... .0.. = has localizedtext: False
                        .... 0... = has locale: False
                        ...0 .... = has additional info: False
                        ..0. .... = has inner statuscode: False
                        .0.. .... = has inner diagnostic info: False
                StringTable: Array of String
                    ArraySize: 0
                AdditionalHeader: ExtensionObject
                    TypeId: NodeId
                        .... 0000 = EncodingMask: Two byte encoded Numeric (0x0)
                        Identifier Numeric: 0
                    EncodingMask: 0x00
                        .... ...0 = has binary body: False
                        .... ..0. = has xml body: False
            ServerProtocolVersion: 0
            SecurityToken: ChannelSecurityToken
                ChannelId: 4
                TokenId: 1
                CreatedAt: Jul  4, 2025 12:13:01.910663700 India Standard Time
                RevisedLifetime: 3600000
            ServerNonce: <MISSING>[OpcUa Null ByteString]

No.     DeltaTime Time                    Source                Destination           Protocol Length Stream Index Info                                                            SrcPort DstPort Src Time
     96 0.000s    2025-07-04 06:43:01.860 192.168.15.139        GYANDE2L.ptcnet.ptc.com OpcUa    380    3            UA Secure Conversation Message: CreateSessionRequest            50836   60001   

Frame 96: 380 bytes on wire (3040 bits), 380 bytes captured (3040 bits) on interface \Device\NPF_{AF38AF37-B5CF-4E8F-867B-264BC8F540A8}, id 0
Ethernet II, Src: VMware_c0:b1:ab (00:0c:29:c0:b1:ab), Dst: VMware_f9:fd:da (00:50:56:f9:fd:da)
Internet Protocol Version 4, Src: 192.168.15.139 (192.168.15.139), Dst: GYANDE2L.ptcnet.ptc.com (100.64.1.34)
Transmission Control Protocol, Src Port: 50836, Dst Port: 60001, Seq: 205, Ack: 164, Len: 326
OpcUa Binary Protocol
    Message Type: MSG
    Chunk Type: F
    Message Size: 326
    SecureChannelId: 4
    Security Token Id: 1
    Sequence Number: 2
    RequestId: 2
    Message: Encodeable Object
        TypeId: ExpandedNodeId
            NodeId EncodingMask: Four byte encoded Numeric (0x01)
            NodeId Namespace Index: 0
            NodeId Identifier Numeric: CreateSessionRequest (461)
        CreateSessionRequest
            RequestHeader: RequestHeader
                AuthenticationToken: NodeId
                    .... 0101 = EncodingMask: Opaque (0x5)
                    Namespace Index: 0
                    Identifier ByteString: 60fd8fb5b2449e1fbafa72d3e97b4f73d7310c3b9c5487e22585d5b1e7c2e09e
                Timestamp: Jul  4, 2025 12:13:01.859948300 India Standard Time
                RequestHandle: 1000001
                Return Diagnostics: 0x00000000
                    .... .... .... ...0 = ServiceLevel / SymbolicId: False
                    .... .... .... ..0. = ServiceLevel / LocalizedText: False
                    .... .... .... .0.. = ServiceLevel / AdditionalInfo: False
                    .... .... .... 0... = ServiceLevel / Inner StatusCode: False
                    .... .... ...0 .... = ServiceLevel / Inner Diagnostics: False
                    .... .... ..0. .... = OperationLevel / SymbolicId: False
                    .... .... .0.. .... = OperationLevel / LocalizedText: False
                    .... .... 0... .... = OperationLevel / AdditionalInfo: False
                    .... ...0 .... .... = OperationLevel / Inner StatusCode: False
                    .... ..0. .... .... = OperationLevel / Inner Diagnostics: False
                AuditEntryId: [OpcUa Null String]
                TimeoutHint: 10000
                AdditionalHeader: ExtensionObject
                    TypeId: NodeId
                        .... 0000 = EncodingMask: Two byte encoded Numeric (0x0)
                        Identifier Numeric: 0
                    EncodingMask: 0x00
                        .... ...0 = has binary body: False
                        .... ..0. = has xml body: False
            ClientDescription: ApplicationDescription
                ApplicationUri: urn:DESKTOP-9JQ0B5B:UnifiedAutomation:UaExpert
                ProductUri: urn:UnifiedAutomation:UaExpert
                ApplicationName: LocalizedText
                    EncodingMask: 0x02, has text
                        .... ...0 = has locale information: False
                        .... ..1. = has text: True
                    Text: UaExpert@DESKTOP-9JQ0B5B
                ApplicationType: Client (0x00000001)
                GatewayServerUri: [OpcUa Null String]
                DiscoveryProfileUri: [OpcUa Null String]
                DiscoveryUrls: Array of String
                    ArraySize: 0
            ServerUri: [OpcUa Null String]
            EndpointUrl: opc.tcp://GYANDE2L.ptcnet.ptc.com:60001
            SessionName: [OpcUa Empty String]
            ClientNonce: 0000000000000000000000000000000000000000000000000000000000000000
            ClientCertificate: <MISSING>[OpcUa Null ByteString]
            RequestedSessionTimeout: 1200000
            MaxResponseMessageSize: 16777216

No.     DeltaTime Time                    Source                Destination           Protocol Length Stream Index Info                                                            SrcPort DstPort Src Time
     99 0.024s    2025-07-04 06:43:01.884 GYANDE2L.ptcnet.ptc.com 192.168.15.139        OpcUa    569    3            UA Secure Conversation Message: CreateSessionResponse           60001   50836   

Frame 99: 569 bytes on wire (4552 bits), 569 bytes captured (4552 bits) on interface \Device\NPF_{AF38AF37-B5CF-4E8F-867B-264BC8F540A8}, id 0
Ethernet II, Src: VMware_f9:fd:da (00:50:56:f9:fd:da), Dst: VMware_c0:b1:ab (00:0c:29:c0:b1:ab)
Internet Protocol Version 4, Src: GYANDE2L.ptcnet.ptc.com (100.64.1.34), Dst: 192.168.15.139 (192.168.15.139)
Transmission Control Protocol, Src Port: 60001, Dst Port: 50836, Seq: 164, Ack: 531, Len: 515
OpcUa Binary Protocol
    Message Type: MSG
    Chunk Type: F
    Message Size: 515
    SecureChannelId: 4
    Security Token Id: 1
    Sequence Number: 2
    RequestId: 2
    Message: Encodeable Object
        TypeId: ExpandedNodeId
            NodeId EncodingMask: Four byte encoded Numeric (0x01)
            NodeId Namespace Index: 0
            NodeId Identifier Numeric: CreateSessionResponse (464)
        CreateSessionResponse
            ResponseHeader: ResponseHeader
                Timestamp: Jul  4, 2025 12:13:01.935373700 India Standard Time
                RequestHandle: 1000001
                ServiceResult: 0x00000000 [Good]
                ServiceDiagnostics: DiagnosticInfo
                    EncodingMask: 0x00
                        .... ...0 = has symbolic id: False
                        .... ..0. = has namespace: False
                        .... .0.. = has localizedtext: False
                        .... 0... = has locale: False
                        ...0 .... = has additional info: False
                        ..0. .... = has inner statuscode: False
                        .0.. .... = has inner diagnostic info: False
                StringTable: Array of String
                    ArraySize: 0
                AdditionalHeader: ExtensionObject
                    TypeId: NodeId
                        .... 0000 = EncodingMask: Two byte encoded Numeric (0x0)
                        Identifier Numeric: 0
                    EncodingMask: 0x00
                        .... ...0 = has binary body: False
                        .... ..0. = has xml body: False
            SessionId: NodeId
                .... 0010 = EncodingMask: Numeric of arbitrary length (0x2)
                Namespace Index: 2
                Identifier Numeric: 1923017465
            AuthenticationToken: NodeId
                .... 0101 = EncodingMask: Opaque (0x5)
                Namespace Index: 0
                Identifier ByteString: 4d98aea19e3b5c219e6757bc27d898408bda415c71bcf70c301d54f0b8d239b8
            RevisedSessionTimeout: 1200000
            ServerNonce: 4f2b0b5213749d18e048ad773376b9525d126c600660ad3d6dcdb9a1b8750d1f
            ServerCertificate: <MISSING>[OpcUa Null ByteString]
            ServerEndpoints: Array of EndpointDescription
                ArraySize: 1
                [0]: EndpointDescription
                    EndpointUrl: opc.tcp://gyande2l:60001/
                    Server: ApplicationDescription
                        ApplicationUri: urn:GYANDE2L:UA:UAGateway
                        ProductUri: uri:ptc:UAGateway
                        ApplicationName: LocalizedText
                            EncodingMask: 0x03, has locale information, has text
                                .... ...1 = has locale information: True
                                .... ..1. = has text: True
                            Locale: en-US
                            Text: UA Gateway
                        ApplicationType: ClientAndServer (0x00000002)
                        GatewayServerUri: [OpcUa Null String]
                        DiscoveryProfileUri: [OpcUa Null String]
                        DiscoveryUrls: Array of String
                            ArraySize: 1
                            [0]: DiscoveryUrls: opc.tcp://gyande2l:60001/
                    ServerCertificate: <MISSING>[OpcUa Null ByteString]
                    MessageSecurityMode: None (0x00000001)
                    SecurityPolicyUri: http://opcfoundation.org/UA/SecurityPolicy#None
                    UserIdentityTokens: Array of UserTokenPolicy
                        ArraySize: 1
                        [0]: UserTokenPolicy
                            PolicyId: 1
                            UserTokenType: Anonymous (0x00000000)
                            IssuedTokenType: [OpcUa Null String]
                            IssuerEndpointUrl: [OpcUa Null String]
                            SecurityPolicyUri: http://opcfoundation.org/UA/SecurityPolicy#None
                    TransportProfileUri: http://opcfoundation.org/UA-Profile/Transport/uatcp-uasc-uabinary
                    SecurityLevel: 0
            ServerSoftwareCertificates: Array of SignedSoftwareCertificate
                ArraySize: 0
            ServerSignature: SignatureData
                Algorithm: [OpcUa Null String]
                Signature: <MISSING>[OpcUa Null ByteString]
            MaxRequestMessageSize: 4194304

No.     DeltaTime Time                    Source                Destination           Protocol Length Stream Index Info                                                            SrcPort DstPort Src Time
    100 0.000s    2025-07-04 06:43:01.884 192.168.15.139        GYANDE2L.ptcnet.ptc.com OpcUa    195    3            UA Secure Conversation Message: ActivateSessionRequest          50836   60001   

Frame 100: 195 bytes on wire (1560 bits), 195 bytes captured (1560 bits) on interface \Device\NPF_{AF38AF37-B5CF-4E8F-867B-264BC8F540A8}, id 0
Ethernet II, Src: VMware_c0:b1:ab (00:0c:29:c0:b1:ab), Dst: VMware_f9:fd:da (00:50:56:f9:fd:da)
Internet Protocol Version 4, Src: 192.168.15.139 (192.168.15.139), Dst: GYANDE2L.ptcnet.ptc.com (100.64.1.34)
Transmission Control Protocol, Src Port: 50836, Dst Port: 60001, Seq: 531, Ack: 679, Len: 141
OpcUa Binary Protocol
    Message Type: MSG
    Chunk Type: F
    Message Size: 141
    SecureChannelId: 4
    Security Token Id: 1
    Sequence Number: 3
    RequestId: 3
    Message: Encodeable Object
        TypeId: ExpandedNodeId
            NodeId EncodingMask: Four byte encoded Numeric (0x01)
            NodeId Namespace Index: 0
            NodeId Identifier Numeric: ActivateSessionRequest (467)
        ActivateSessionRequest
            RequestHeader: RequestHeader
                AuthenticationToken: NodeId
                    .... 0101 = EncodingMask: Opaque (0x5)
                    Namespace Index: 0
                    Identifier ByteString: 4d98aea19e3b5c219e6757bc27d898408bda415c71bcf70c301d54f0b8d239b8
                Timestamp: Jul  4, 2025 12:13:01.884752000 India Standard Time
                RequestHandle: 1000002
                Return Diagnostics: 0x00000000
                    .... .... .... ...0 = ServiceLevel / SymbolicId: False
                    .... .... .... ..0. = ServiceLevel / LocalizedText: False
                    .... .... .... .0.. = ServiceLevel / AdditionalInfo: False
                    .... .... .... 0... = ServiceLevel / Inner StatusCode: False
                    .... .... ...0 .... = ServiceLevel / Inner Diagnostics: False
                    .... .... ..0. .... = OperationLevel / SymbolicId: False
                    .... .... .0.. .... = OperationLevel / LocalizedText: False
                    .... .... 0... .... = OperationLevel / AdditionalInfo: False
                    .... ...0 .... .... = OperationLevel / Inner StatusCode: False
                    .... ..0. .... .... = OperationLevel / Inner Diagnostics: False
                AuditEntryId: [OpcUa Null String]
                TimeoutHint: 10000
                AdditionalHeader: ExtensionObject
                    TypeId: NodeId
                        .... 0000 = EncodingMask: Two byte encoded Numeric (0x0)
                        Identifier Numeric: 0
                    EncodingMask: 0x00
