No.     DeltaTime Time                    Source                Destination           Protocol Length Stream Index Info                                                            SrcPort DstPort Src Time
     40 0.000s    2025-07-04 05:51:25.043 192.168.15.139        GYANDE2L.ptcnet.ptc.com OpcUa    125    1            Hello message                                                   50282   60001   

Frame 40: 125 bytes on wire (1000 bits), 125 bytes captured (1000 bits) on interface \Device\NPF_{AF38AF37-B5CF-4E8F-867B-264BC8F540A8}, id 0
Ethernet II, Src: VMware_c0:b1:ab (00:0c:29:c0:b1:ab), Dst: VMware_f9:fd:da (00:50:56:f9:fd:da)
Internet Protocol Version 4, Src: 192.168.15.139 (192.168.15.139), Dst: GYANDE2L.ptcnet.ptc.com (100.64.1.34)
Transmission Control Protocol, Src Port: 50282, Dst Port: 60001, Seq: 1, Ack: 1, Len: 71
OpcUa Binary Protocol

No.     DeltaTime Time                    Source                Destination           Protocol Length Stream Index Info                                                            SrcPort DstPort Src Time
     43 0.035s    2025-07-04 05:51:25.079 GYANDE2L.ptcnet.ptc.com 192.168.15.139        OpcUa    82     1            Acknowledge message                                             60001   50282   

Frame 43: 82 bytes on wire (656 bits), 82 bytes captured (656 bits) on interface \Device\NPF_{AF38AF37-B5CF-4E8F-867B-264BC8F540A8}, id 0
Ethernet II, Src: VMware_f9:fd:da (00:50:56:f9:fd:da), Dst: VMware_c0:b1:ab (00:0c:29:c0:b1:ab)
Internet Protocol Version 4, Src: GYANDE2L.ptcnet.ptc.com (100.64.1.34), Dst: 192.168.15.139 (192.168.15.139)
Transmission Control Protocol, Src Port: 60001, Dst Port: 50282, Seq: 1, Ack: 72, Len: 28
OpcUa Binary Protocol

No.     DeltaTime Time                    Source                Destination           Protocol Length Stream Index Info                                                            SrcPort DstPort Src Time
     44 0.000s    2025-07-04 05:51:25.079 192.168.15.139        GYANDE2L.ptcnet.ptc.com OpcUa    187    1            OpenSecureChannel message                                       50282   60001   

Frame 44: 187 bytes on wire (1496 bits), 187 bytes captured (1496 bits) on interface \Device\NPF_{AF38AF37-B5CF-4E8F-867B-264BC8F540A8}, id 0
Ethernet II, Src: VMware_c0:b1:ab (00:0c:29:c0:b1:ab), Dst: VMware_f9:fd:da (00:50:56:f9:fd:da)
Internet Protocol Version 4, Src: 192.168.15.139 (192.168.15.139), Dst: GYANDE2L.ptcnet.ptc.com (100.64.1.34)
Transmission Control Protocol, Src Port: 50282, Dst Port: 60001, Seq: 72, Ack: 29, Len: 133
OpcUa Binary Protocol

No.     DeltaTime Time                    Source                Destination           Protocol Length Stream Index Info                                                            SrcPort DstPort Src Time
     47 0.019s    2025-07-04 05:51:25.098 GYANDE2L.ptcnet.ptc.com 192.168.15.139        OpcUa    189    1            OpenSecureChannel message                                       60001   50282   

Frame 47: 189 bytes on wire (1512 bits), 189 bytes captured (1512 bits) on interface \Device\NPF_{AF38AF37-B5CF-4E8F-867B-264BC8F540A8}, id 0
Ethernet II, Src: VMware_f9:fd:da (00:50:56:f9:fd:da), Dst: VMware_c0:b1:ab (00:0c:29:c0:b1:ab)
Internet Protocol Version 4, Src: GYANDE2L.ptcnet.ptc.com (100.64.1.34), Dst: 192.168.15.139 (192.168.15.139)
Transmission Control Protocol, Src Port: 60001, Dst Port: 50282, Seq: 29, Ack: 205, Len: 135
OpcUa Binary Protocol

No.     DeltaTime Time                    Source                Destination           Protocol Length Stream Index Info                                                            SrcPort DstPort Src Time
     48 0.000s    2025-07-04 05:51:25.099 192.168.15.139        GYANDE2L.ptcnet.ptc.com OpcUa    162    1            UA Secure Conversation Message: GetEndpointsRequest             50282   60001   

Frame 48: 162 bytes on wire (1296 bits), 162 bytes captured (1296 bits) on interface \Device\NPF_{AF38AF37-B5CF-4E8F-867B-264BC8F540A8}, id 0
Ethernet II, Src: VMware_c0:b1:ab (00:0c:29:c0:b1:ab), Dst: VMware_f9:fd:da (00:50:56:f9:fd:da)
Internet Protocol Version 4, Src: 192.168.15.139 (192.168.15.139), Dst: GYANDE2L.ptcnet.ptc.com (100.64.1.34)
Transmission Control Protocol, Src Port: 50282, Dst Port: 60001, Seq: 205, Ack: 164, Len: 108
OpcUa Binary Protocol

No.     DeltaTime Time                    Source                Destination           Protocol Length Stream Index Info                                                            SrcPort DstPort Src Time
     50 0.021s    2025-07-04 05:51:25.120 GYANDE2L.ptcnet.ptc.com 192.168.15.139        OpcUa    459    1            UA Secure Conversation Message: GetEndpointsResponse            60001   50282   

Frame 50: 459 bytes on wire (3672 bits), 459 bytes captured (3672 bits) on interface \Device\NPF_{AF38AF37-B5CF-4E8F-867B-264BC8F540A8}, id 0
Ethernet II, Src: VMware_f9:fd:da (00:50:56:f9:fd:da), Dst: VMware_c0:b1:ab (00:0c:29:c0:b1:ab)
Internet Protocol Version 4, Src: GYANDE2L.ptcnet.ptc.com (100.64.1.34), Dst: 192.168.15.139 (192.168.15.139)
Transmission Control Protocol, Src Port: 60001, Dst Port: 50282, Seq: 164, Ack: 313, Len: 405
OpcUa Binary Protocol

No.     DeltaTime Time                    Source                Destination           Protocol Length Stream Index Info                                                            SrcPort DstPort Src Time
     51 0.000s    2025-07-04 05:51:25.120 192.168.15.139        GYANDE2L.ptcnet.ptc.com OpcUa    111    1            CloseSecureChannel message: CloseSecureChannelRequest           50282   60001   

Frame 51: 111 bytes on wire (888 bits), 111 bytes captured (888 bits) on interface \Device\NPF_{AF38AF37-B5CF-4E8F-867B-264BC8F540A8}, id 0
Ethernet II, Src: VMware_c0:b1:ab (00:0c:29:c0:b1:ab), Dst: VMware_f9:fd:da (00:50:56:f9:fd:da)
Internet Protocol Version 4, Src: 192.168.15.139 (192.168.15.139), Dst: GYANDE2L.ptcnet.ptc.com (100.64.1.34)
Transmission Control Protocol, Src Port: 50282, Dst Port: 60001, Seq: 313, Ack: 569, Len: 57
OpcUa Binary Protocol

No.     DeltaTime Time                    Source                Destination           Protocol Length Stream Index Info                                                            SrcPort DstPort Src Time
     60 0.035s    2025-07-04 05:51:25.156 192.168.15.139        GYANDE2L.ptcnet.ptc.com OpcUa    125    2            Hello message                                                   50283   60001   

Frame 60: 125 bytes on wire (1000 bits), 125 bytes captured (1000 bits) on interface \Device\NPF_{AF38AF37-B5CF-4E8F-867B-264BC8F540A8}, id 0
Ethernet II, Src: VMware_c0:b1:ab (00:0c:29:c0:b1:ab), Dst: VMware_f9:fd:da (00:50:56:f9:fd:da)
Internet Protocol Version 4, Src: 192.168.15.139 (192.168.15.139), Dst: GYANDE2L.ptcnet.ptc.com (100.64.1.34)
Transmission Control Protocol, Src Port: 50283, Dst Port: 60001, Seq: 1, Ack: 1, Len: 71
OpcUa Binary Protocol

No.     DeltaTime Time                    Source                Destination           Protocol Length Stream Index Info                                                            SrcPort DstPort Src Time
     62 0.029s    2025-07-04 05:51:25.185 GYANDE2L.ptcnet.ptc.com 192.168.15.139        OpcUa    82     2            Acknowledge message                                             60001   50283   

Frame 62: 82 bytes on wire (656 bits), 82 bytes captured (656 bits) on interface \Device\NPF_{AF38AF37-B5CF-4E8F-867B-264BC8F540A8}, id 0
Ethernet II, Src: VMware_f9:fd:da (00:50:56:f9:fd:da), Dst: VMware_c0:b1:ab (00:0c:29:c0:b1:ab)
Internet Protocol Version 4, Src: GYANDE2L.ptcnet.ptc.com (100.64.1.34), Dst: 192.168.15.139 (192.168.15.139)
Transmission Control Protocol, Src Port: 60001, Dst Port: 50283, Seq: 1, Ack: 72, Len: 28
OpcUa Binary Protocol

No.     DeltaTime Time                    Source                Destination           Protocol Length Stream Index Info                                                            SrcPort DstPort Src Time
     63 0.000s    2025-07-04 05:51:25.186 192.168.15.139        GYANDE2L.ptcnet.ptc.com OpcUa    187    2            OpenSecureChannel message                                       50283   60001   

Frame 63: 187 bytes on wire (1496 bits), 187 bytes captured (1496 bits) on interface \Device\NPF_{AF38AF37-B5CF-4E8F-867B-264BC8F540A8}, id 0
Ethernet II, Src: VMware_c0:b1:ab (00:0c:29:c0:b1:ab), Dst: VMware_f9:fd:da (00:50:56:f9:fd:da)
Internet Protocol Version 4, Src: 192.168.15.139 (192.168.15.139), Dst: GYANDE2L.ptcnet.ptc.com (100.64.1.34)
Transmission Control Protocol, Src Port: 50283, Dst Port: 60001, Seq: 72, Ack: 29, Len: 133
OpcUa Binary Protocol

No.     DeltaTime Time                    Source                Destination           Protocol Length Stream Index Info                                                            SrcPort DstPort Src Time
     65 0.024s    2025-07-04 05:51:25.210 GYANDE2L.ptcnet.ptc.com 192.168.15.139        OpcUa    189    2            OpenSecureChannel message                                       60001   50283   

Frame 65: 189 bytes on wire (1512 bits), 189 bytes captured (1512 bits) on interface \Device\NPF_{AF38AF37-B5CF-4E8F-867B-264BC8F540A8}, id 0
Ethernet II, Src: VMware_f9:fd:da (00:50:56:f9:fd:da), Dst: VMware_c0:b1:ab (00:0c:29:c0:b1:ab)
Internet Protocol Version 4, Src: GYANDE2L.ptcnet.ptc.com (100.64.1.34), Dst: 192.168.15.139 (192.168.15.139)
Transmission Control Protocol, Src Port: 60001, Dst Port: 50283, Seq: 29, Ack: 205, Len: 135
OpcUa Binary Protocol

No.     DeltaTime Time                    Source                Destination           Protocol Length Stream Index Info                                                            SrcPort DstPort Src Time
     66 0.000s    2025-07-04 05:51:25.210 192.168.15.139        GYANDE2L.ptcnet.ptc.com OpcUa    380    2            UA Secure Conversation Message: CreateSessionRequest            50283   60001   

Frame 66: 380 bytes on wire (3040 bits), 380 bytes captured (3040 bits) on interface \Device\NPF_{AF38AF37-B5CF-4E8F-867B-264BC8F540A8}, id 0
Ethernet II, Src: VMware_c0:b1:ab (00:0c:29:c0:b1:ab), Dst: VMware_f9:fd:da (00:50:56:f9:fd:da)
Internet Protocol Version 4, Src: 192.168.15.139 (192.168.15.139), Dst: GYANDE2L.ptcnet.ptc.com (100.64.1.34)
Transmission Control Protocol, Src Port: 50283, Dst Port: 60001, Seq: 205, Ack: 164, Len: 326
OpcUa Binary Protocol

No.     DeltaTime Time                    Source                Destination           Protocol Length Stream Index Info                                                            SrcPort DstPort Src Time
     68 0.019s    2025-07-04 05:51:25.230 GYANDE2L.ptcnet.ptc.com 192.168.15.139        OpcUa    569    2            UA Secure Conversation Message: CreateSessionResponse           60001   50283   

Frame 68: 569 bytes on wire (4552 bits), 569 bytes captured (4552 bits) on interface \Device\NPF_{AF38AF37-B5CF-4E8F-867B-264BC8F540A8}, id 0
Ethernet II, Src: VMware_f9:fd:da (00:50:56:f9:fd:da), Dst: VMware_c0:b1:ab (00:0c:29:c0:b1:ab)
Internet Protocol Version 4, Src: GYANDE2L.ptcnet.ptc.com (100.64.1.34), Dst: 192.168.15.139 (192.168.15.139)
Transmission Control Protocol, Src Port: 60001, Dst Port: 50283, Seq: 164, Ack: 531, Len: 515
OpcUa Binary Protocol

No.     DeltaTime Time                    Source                Destination           Protocol Length Stream Index Info                                                            SrcPort DstPort Src Time
     69 0.000s    2025-07-04 05:51:25.230 192.168.15.139        GYANDE2L.ptcnet.ptc.com OpcUa    195    2            UA Secure Conversation Message: ActivateSessionRequest          50283   60001   

Frame 69: 195 bytes on wire (1560 bits), 195 bytes captured (1560 bits) on interface \Device\NPF_{AF38AF37-B5CF-4E8F-867B-264BC8F540A8}, id 0
Ethernet II, Src: VMware_c0:b1:ab (00:0c:29:c0:b1:ab), Dst: VMware_f9:fd:da (00:50:56:f9:fd:da)
Internet Protocol Version 4, Src: 192.168.15.139 (192.168.15.139), Dst: GYANDE2L.ptcnet.ptc.com (100.64.1.34)
Transmission Control Protocol, Src Port: 50283, Dst Port: 60001, Seq: 531, Ack: 679, Len: 141
OpcUa Binary Protocol

No.     DeltaTime Time                    Source                Destination           Protocol Length Stream Index Info                                                            SrcPort DstPort Src Time
     73 0.020s    2025-07-04 05:51:25.250 GYANDE2L.ptcnet.ptc.com 192.168.15.139        OpcUa    150    2            UA Secure Conversation Message: ActivateSessionResponse         60001   50283   

Frame 73: 150 bytes on wire (1200 bits), 150 bytes captured (1200 bits) on interface \Device\NPF_{AF38AF37-B5CF-4E8F-867B-264BC8F540A8}, id 0
Ethernet II, Src: VMware_f9:fd:da (00:50:56:f9:fd:da), Dst: VMware_c0:b1:ab (00:0c:29:c0:b1:ab)
Internet Protocol Version 4, Src: GYANDE2L.ptcnet.ptc.com (100.64.1.34), Dst: 192.168.15.139 (192.168.15.139)
Transmission Control Protocol, Src Port: 60001, Dst Port: 50283, Seq: 679, Ack: 672, Len: 96
OpcUa Binary Protocol

No.     DeltaTime Time                    Source                Destination           Protocol Length Stream Index Info                                                            SrcPort DstPort Src Time
     74 0.000s    2025-07-04 05:51:25.251 192.168.15.139        GYANDE2L.ptcnet.ptc.com OpcUa    200    2            UA Secure Conversation Message: ReadRequest                     50283   60001   

Frame 74: 200 bytes on wire (1600 bits), 200 bytes captured (1600 bits) on interface \Device\NPF_{AF38AF37-B5CF-4E8F-867B-264BC8F540A8}, id 0
Ethernet II, Src: VMware_c0:b1:ab (00:0c:29:c0:b1:ab), Dst: VMware_f9:fd:da (00:50:56:f9:fd:da)
Internet Protocol Version 4, Src: 192.168.15.139 (192.168.15.139), Dst: GYANDE2L.ptcnet.ptc.com (100.64.1.34)
Transmission Control Protocol, Src Port: 50283, Dst Port: 60001, Seq: 672, Ack: 775, Len: 146
OpcUa Binary Protocol

No.     DeltaTime Time                    Source                Destination           Protocol Length Stream Index Info                                                            SrcPort DstPort Src Time
     76 0.018s    2025-07-04 05:51:25.269 GYANDE2L.ptcnet.ptc.com 192.168.15.139        OpcUa    126    2            UA Secure Conversation Message: ReadResponse                    60001   50283   

Frame 76: 126 bytes on wire (1008 bits), 126 bytes captured (1008 bits) on interface \Device\NPF_{AF38AF37-B5CF-4E8F-867B-264BC8F540A8}, id 0
Ethernet II, Src: VMware_f9:fd:da (00:50:56:f9:fd:da), Dst: VMware_c0:b1:ab (00:0c:29:c0:b1:ab)
Internet Protocol Version 4, Src: GYANDE2L.ptcnet.ptc.com (100.64.1.34), Dst: 192.168.15.139 (192.168.15.139)
Transmission Control Protocol, Src Port: 60001, Dst Port: 50283, Seq: 775, Ack: 818, Len: 72
OpcUa Binary Protocol

No.     DeltaTime Time                    Source                Destination           Protocol Length Stream Index Info                                                            SrcPort DstPort Src Time
     77 0.000s    2025-07-04 05:51:25.269 192.168.15.139        GYANDE2L.ptcnet.ptc.com OpcUa    506    2            UA Secure Conversation Message: ReadRequest                     50283   60001   

Frame 77: 506 bytes on wire (4048 bits), 506 bytes captured (4048 bits) on interface \Device\NPF_{AF38AF37-B5CF-4E8F-867B-264BC8F540A8}, id 0
Ethernet II, Src: VMware_c0:b1:ab (00:0c:29:c0:b1:ab), Dst: VMware_f9:fd:da (00:50:56:f9:fd:da)
Internet Protocol Version 4, Src: 192.168.15.139 (192.168.15.139), Dst: GYANDE2L.ptcnet.ptc.com (100.64.1.34)
Transmission Control Protocol, Src Port: 50283, Dst Port: 60001, Seq: 818, Ack: 847, Len: 452
OpcUa Binary Protocol

No.     DeltaTime Time                    Source                Destination           Protocol Length Stream Index Info                                                            SrcPort DstPort Src Time
     79 0.018s    2025-07-04 05:51:25.288 GYANDE2L.ptcnet.ptc.com 192.168.15.139        OpcUa    627    2            UA Secure Conversation Message: ReadResponse                    60001   50283   

Frame 79: 627 bytes on wire (5016 bits), 627 bytes captured (5016 bits) on interface \Device\NPF_{AF38AF37-B5CF-4E8F-867B-264BC8F540A8}, id 0
Ethernet II, Src: VMware_f9:fd:da (00:50:56:f9:fd:da), Dst: VMware_c0:b1:ab (00:0c:29:c0:b1:ab)
Internet Protocol Version 4, Src: GYANDE2L.ptcnet.ptc.com (100.64.1.34), Dst: 192.168.15.139 (192.168.15.139)
Transmission Control Protocol, Src Port: 60001, Dst Port: 50283, Seq: 847, Ack: 1270, Len: 573
OpcUa Binary Protocol

No.     DeltaTime Time                    Source                Destination           Protocol Length Stream Index Info                                                            SrcPort DstPort Src Time
     80 0.001s    2025-07-04 05:51:25.290 192.168.15.139        GYANDE2L.ptcnet.ptc.com OpcUa    187    2            UA Secure Conversation Message: BrowseRequest                   50283   60001   

Frame 80: 187 bytes on wire (1496 bits), 187 bytes captured (1496 bits) on interface \Device\NPF_{AF38AF37-B5CF-4E8F-867B-264BC8F540A8}, id 0
Ethernet II, Src: VMware_c0:b1:ab (00:0c:29:c0:b1:ab), Dst: VMware_f9:fd:da (00:50:56:f9:fd:da)
Internet Protocol Version 4, Src: 192.168.15.139 (192.168.15.139), Dst: GYANDE2L.ptcnet.ptc.com (100.64.1.34)
Transmission Control Protocol, Src Port: 50283, Dst Port: 60001, Seq: 1270, Ack: 1420, Len: 133
OpcUa Binary Protocol

No.     DeltaTime Time                    Source                Destination           Protocol Length Stream Index Info                                                            SrcPort DstPort Src Time
     83 0.017s    2025-07-04 05:51:25.307 GYANDE2L.ptcnet.ptc.com 192.168.15.139        OpcUa    564    2            UA Secure Conversation Message: BrowseResponse                  60001   50283   

Frame 83: 564 bytes on wire (4512 bits), 564 bytes captured (4512 bits) on interface \Device\NPF_{AF38AF37-B5CF-4E8F-867B-264BC8F540A8}, id 0
Ethernet II, Src: VMware_f9:fd:da (00:50:56:f9:fd:da), Dst: VMware_c0:b1:ab (00:0c:29:c0:b1:ab)
Internet Protocol Version 4, Src: GYANDE2L.ptcnet.ptc.com (100.64.1.34), Dst: 192.168.15.139 (192.168.15.139)
Transmission Control Protocol, Src Port: 60001, Dst Port: 50283, Seq: 2880, Ack: 1403, Len: 510
[2 Reassembled TCP Segments (1970 bytes): #82(1460), #83(510)]
OpcUa Binary Protocol

No.     DeltaTime Time                    Source                Destination           Protocol Length Stream Index Info                                                            SrcPort DstPort Src Time
     85 0.000s    2025-07-04 05:51:25.307 192.168.15.139        GYANDE2L.ptcnet.ptc.com OpcUa    793    2            UA Secure Conversation Message: BrowseRequest                   50283   60001   

Frame 85: 793 bytes on wire (6344 bits), 793 bytes captured (6344 bits) on interface \Device\NPF_{AF38AF37-B5CF-4E8F-867B-264BC8F540A8}, id 0
Ethernet II, Src: VMware_c0:b1:ab (00:0c:29:c0:b1:ab), Dst: VMware_f9:fd:da (00:50:56:f9:fd:da)
Internet Protocol Version 4, Src: 192.168.15.139 (192.168.15.139), Dst: GYANDE2L.ptcnet.ptc.com (100.64.1.34)
Transmission Control Protocol, Src Port: 50283, Dst Port: 60001, Seq: 1403, Ack: 3390, Len: 739
OpcUa Binary Protocol

No.     DeltaTime Time                    Source                Destination           Protocol Length Stream Index Info                                                            SrcPort DstPort Src Time
     91 0.019s    2025-07-04 05:51:25.327 GYANDE2L.ptcnet.ptc.com 192.168.15.139        OpcUa    510    2            UA Secure Conversation Message: BrowseResponse                  60001   50283   

Frame 91: 510 bytes on wire (4080 bits), 510 bytes captured (4080 bits) on interface \Device\NPF_{AF38AF37-B5CF-4E8F-867B-264BC8F540A8}, id 0
Ethernet II, Src: VMware_f9:fd:da (00:50:56:f9:fd:da), Dst: VMware_c0:b1:ab (00:0c:29:c0:b1:ab)
Internet Protocol Version 4, Src: GYANDE2L.ptcnet.ptc.com (100.64.1.34), Dst: 192.168.15.139 (192.168.15.139)
Transmission Control Protocol, Src Port: 60001, Dst Port: 50283, Seq: 3390, Ack: 2142, Len: 456
OpcUa Binary Protocol

No.     DeltaTime Time                    Source                Destination           Protocol Length Stream Index Info                                                            SrcPort DstPort Src Time
     92 0.000s    2025-07-04 05:51:25.327 192.168.15.139        GYANDE2L.ptcnet.ptc.com OpcUa    257    2            UA Secure Conversation Message: BrowseRequest                   50283   60001   

Frame 92: 257 bytes on wire (2056 bits), 257 bytes captured (2056 bits) on interface \Device\NPF_{AF38AF37-B5CF-4E8F-867B-264BC8F540A8}, id 0
Ethernet II, Src: VMware_c0:b1:ab (00:0c:29:c0:b1:ab), Dst: VMware_f9:fd:da (00:50:56:f9:fd:da)
Internet Protocol Version 4, Src: 192.168.15.139 (192.168.15.139), Dst: GYANDE2L.ptcnet.ptc.com (100.64.1.34)
Transmission Control Protocol, Src Port: 50283, Dst Port: 60001, Seq: 2142, Ack: 3846, Len: 203
OpcUa Binary Protocol

No.     DeltaTime Time                    Source                Destination           Protocol Length Stream Index Info                                                            SrcPort DstPort Src Time
     94 0.017s    2025-07-04 05:51:25.345 GYANDE2L.ptcnet.ptc.com 192.168.15.139        OpcUa    1198   2            UA Secure Conversation Message: BrowseResponse                  60001   50283   

Frame 94: 1198 bytes on wire (9584 bits), 1198 bytes captured (9584 bits) on interface \Device\NPF_{AF38AF37-B5CF-4E8F-867B-264BC8F540A8}, id 0
Ethernet II, Src: VMware_f9:fd:da (00:50:56:f9:fd:da), Dst: VMware_c0:b1:ab (00:0c:29:c0:b1:ab)
Internet Protocol Version 4, Src: GYANDE2L.ptcnet.ptc.com (100.64.1.34), Dst: 192.168.15.139 (192.168.15.139)
Transmission Control Protocol, Src Port: 60001, Dst Port: 50283, Seq: 3846, Ack: 2345, Len: 1144
OpcUa Binary Protocol

No.     DeltaTime Time                    Source                Destination           Protocol Length Stream Index Info                                                            SrcPort DstPort Src Time
     95 0.000s    2025-07-04 05:51:25.345 192.168.15.139        GYANDE2L.ptcnet.ptc.com OpcUa    709    2            UA Secure Conversation Message: TranslateBrowsePathsToNodeIdsRequest 50283   60001   

Frame 95: 709 bytes on wire (5672 bits), 709 bytes captured (5672 bits) on interface \Device\NPF_{AF38AF37-B5CF-4E8F-867B-264BC8F540A8}, id 0
Ethernet II, Src: VMware_c0:b1:ab (00:0c:29:c0:b1:ab), Dst: VMware_f9:fd:da (00:50:56:f9:fd:da)
Internet Protocol Version 4, Src: 192.168.15.139 (192.168.15.139), Dst: GYANDE2L.ptcnet.ptc.com (100.64.1.34)
Transmission Control Protocol, Src Port: 50283, Dst Port: 60001, Seq: 2345, Ack: 4990, Len: 655
OpcUa Binary Protocol

No.     DeltaTime Time                    Source                Destination           Protocol Length Stream Index Info                                                            SrcPort DstPort Src Time
     97 0.017s    2025-07-04 05:51:25.363 GYANDE2L.ptcnet.ptc.com 192.168.15.139        OpcUa    346    2            UA Secure Conversation Message: TranslateBrowsePathsToNodeIdsResponse 60001   50283   

Frame 97: 346 bytes on wire (2768 bits), 346 bytes captured (2768 bits) on interface \Device\NPF_{AF38AF37-B5CF-4E8F-867B-264BC8F540A8}, id 0
Ethernet II, Src: VMware_f9:fd:da (00:50:56:f9:fd:da), Dst: VMware_c0:b1:ab (00:0c:29:c0:b1:ab)
Internet Protocol Version 4, Src: GYANDE2L.ptcnet.ptc.com (100.64.1.34), Dst: 192.168.15.139 (192.168.15.139)
Transmission Control Protocol, Src Port: 60001, Dst Port: 50283, Seq: 4990, Ack: 3000, Len: 292
OpcUa Binary Protocol

No.     DeltaTime Time                    Source                Destination           Protocol Length Stream Index Info                                                            SrcPort DstPort Src Time
     98 0.000s    2025-07-04 05:51:25.363 192.168.15.139        GYANDE2L.ptcnet.ptc.com OpcUa    692    2            UA Secure Conversation Message: TranslateBrowsePathsToNodeIdsRequest 50283   60001   

Frame 98: 692 bytes on wire (5536 bits), 692 bytes captured (5536 bits) on interface \Device\NPF_{AF38AF37-B5CF-4E8F-867B-264BC8F540A8}, id 0
Ethernet II, Src: VMware_c0:b1:ab (00:0c:29:c0:b1:ab), Dst: VMware_f9:fd:da (00:50:56:f9:fd:da)
Internet Protocol Version 4, Src: 192.168.15.139 (192.168.15.139), Dst: GYANDE2L.ptcnet.ptc.com (100.64.1.34)
Transmission Control Protocol, Src Port: 50283, Dst Port: 60001, Seq: 3000, Ack: 5282, Len: 638
OpcUa Binary Protocol

No.     DeltaTime Time                    Source                Destination           Protocol Length Stream Index Info                                                            SrcPort DstPort Src Time
    100 0.018s    2025-07-04 05:51:25.382 GYANDE2L.ptcnet.ptc.com 192.168.15.139        OpcUa    250    2            UA Secure Conversation Message: TranslateBrowsePathsToNodeIdsResponse 60001   50283   

Frame 100: 250 bytes on wire (2000 bits), 250 bytes captured (2000 bits) on interface \Device\NPF_{AF38AF37-B5CF-4E8F-867B-264BC8F540A8}, id 0
Ethernet II, Src: VMware_f9:fd:da (00:50:56:f9:fd:da), Dst: VMware_c0:b1:ab (00:0c:29:c0:b1:ab)
Internet Protocol Version 4, Src: GYANDE2L.ptcnet.ptc.com (100.64.1.34), Dst: 192.168.15.139 (192.168.15.139)
Transmission Control Protocol, Src Port: 60001, Dst Port: 50283, Seq: 5282, Ack: 3638, Len: 196
OpcUa Binary Protocol

No.     DeltaTime Time                    Source                Destination           Protocol Length Stream Index Info                                                            SrcPort DstPort Src Time
    101 0.000s    2025-07-04 05:51:25.382 192.168.15.139        GYANDE2L.ptcnet.ptc.com OpcUa    187    2            UA Secure Conversation Message: BrowseRequest                   50283   60001   

Frame 101: 187 bytes on wire (1496 bits), 187 bytes captured (1496 bits) on interface \Device\NPF_{AF38AF37-B5CF-4E8F-867B-264BC8F540A8}, id 0
Ethernet II, Src: VMware_c0:b1:ab (00:0c:29:c0:b1:ab), Dst: VMware_f9:fd:da (00:50:56:f9:fd:da)
Internet Protocol Version 4, Src: 192.168.15.139 (192.168.15.139), Dst: GYANDE2L.ptcnet.ptc.com (100.64.1.34)
Transmission Control Protocol, Src Port: 50283, Dst Port: 60001, Seq: 3638, Ack: 5478, Len: 133
OpcUa Binary Protocol

No.     DeltaTime Time                    Source                Destination           Protocol Length Stream Index Info                                                            SrcPort DstPort Src Time
    103 0.017s    2025-07-04 05:51:25.399 GYANDE2L.ptcnet.ptc.com 192.168.15.139        OpcUa    162    2            UA Secure Conversation Message: BrowseResponse                  60001   50283   

Frame 103: 162 bytes on wire (1296 bits), 162 bytes captured (1296 bits) on interface \Device\NPF_{AF38AF37-B5CF-4E8F-867B-264BC8F540A8}, id 0
Ethernet II, Src: VMware_f9:fd:da (00:50:56:f9:fd:da), Dst: VMware_c0:b1:ab (00:0c:29:c0:b1:ab)
Internet Protocol Version 4, Src: GYANDE2L.ptcnet.ptc.com (100.64.1.34), Dst: 192.168.15.139 (192.168.15.139)
Transmission Control Protocol, Src Port: 60001, Dst Port: 50283, Seq: 5478, Ack: 3771, Len: 108
OpcUa Binary Protocol

No.     DeltaTime Time                    Source                Destination           Protocol Length Stream Index Info                                                            SrcPort DstPort Src Time
    104 0.000s    2025-07-04 05:51:25.400 192.168.15.139        GYANDE2L.ptcnet.ptc.com OpcUa    182    2            UA Secure Conversation Message: ReadRequest                     50283   60001   

Frame 104: 182 bytes on wire (1456 bits), 182 bytes captured (1456 bits) on interface \Device\NPF_{AF38AF37-B5CF-4E8F-867B-264BC8F540A8}, id 0
Ethernet II, Src: VMware_c0:b1:ab (00:0c:29:c0:b1:ab), Dst: VMware_f9:fd:da (00:50:56:f9:fd:da)
Internet Protocol Version 4, Src: 192.168.15.139 (192.168.15.139), Dst: GYANDE2L.ptcnet.ptc.com (100.64.1.34)
Transmission Control Protocol, Src Port: 50283, Dst Port: 60001, Seq: 3771, Ack: 5586, Len: 128
OpcUa Binary Protocol

No.     DeltaTime Time                    Source                Destination           Protocol Length Stream Index Info                                                            SrcPort DstPort Src Time
    106 0.017s    2025-07-04 05:51:25.418 GYANDE2L.ptcnet.ptc.com 192.168.15.139        OpcUa    117    2            UA Secure Conversation Message: ReadResponse                    60001   50283   

Frame 106: 117 bytes on wire (936 bits), 117 bytes captured (936 bits) on interface \Device\NPF_{AF38AF37-B5CF-4E8F-867B-264BC8F540A8}, id 0
Ethernet II, Src: VMware_f9:fd:da (00:50:56:f9:fd:da), Dst: VMware_c0:b1:ab (00:0c:29:c0:b1:ab)
Internet Protocol Version 4, Src: GYANDE2L.ptcnet.ptc.com (100.64.1.34), Dst: 192.168.15.139 (192.168.15.139)
Transmission Control Protocol, Src Port: 60001, Dst Port: 50283, Seq: 5586, Ack: 3899, Len: 63
OpcUa Binary Protocol

No.     DeltaTime Time                    Source                Destination           Protocol Length Stream Index Info                                                            SrcPort DstPort Src Time
    107 0.001s    2025-07-04 05:51:25.419 192.168.15.139        GYANDE2L.ptcnet.ptc.com OpcUa    187    2            UA Secure Conversation Message: BrowseRequest                   50283   60001   

Frame 107: 187 bytes on wire (1496 bits), 187 bytes captured (1496 bits) on interface \Device\NPF_{AF38AF37-B5CF-4E8F-867B-264BC8F540A8}, id 0
Ethernet II, Src: VMware_c0:b1:ab (00:0c:29:c0:b1:ab), Dst: VMware_f9:fd:da (00:50:56:f9:fd:da)
Internet Protocol Version 4, Src: 192.168.15.139 (192.168.15.139), Dst: GYANDE2L.ptcnet.ptc.com (100.64.1.34)
Transmission Control Protocol, Src Port: 50283, Dst Port: 60001, Seq: 3899, Ack: 5649, Len: 133
OpcUa Binary Protocol

No.     DeltaTime Time                    Source                Destination           Protocol Length Stream Index Info                                                            SrcPort DstPort Src Time
    109 0.018s    2025-07-04 05:51:25.437 GYANDE2L.ptcnet.ptc.com 192.168.15.139        OpcUa    226    2            UA Secure Conversation Message: BrowseResponse                  60001   50283   

Frame 109: 226 bytes on wire (1808 bits), 226 bytes captured (1808 bits) on interface \Device\NPF_{AF38AF37-B5CF-4E8F-867B-264BC8F540A8}, id 0
Ethernet II, Src: VMware_f9:fd:da (00:50:56:f9:fd:da), Dst: VMware_c0:b1:ab (00:0c:29:c0:b1:ab)
Internet Protocol Version 4, Src: GYANDE2L.ptcnet.ptc.com (100.64.1.34), Dst: 192.168.15.139 (192.168.15.139)
Transmission Control Protocol, Src Port: 60001, Dst Port: 50283, Seq: 5649, Ack: 4032, Len: 172
OpcUa Binary Protocol

No.     DeltaTime Time                    Source                Destination           Protocol Length Stream Index Info                                                            SrcPort DstPort Src Time
    110 0.000s    2025-07-04 05:51:25.438 192.168.15.139        GYANDE2L.ptcnet.ptc.com OpcUa    324    2            UA Secure Conversation Message: ReadRequest                     50283   60001   

Frame 110: 324 bytes on wire (2592 bits), 324 bytes captured (2592 bits) on interface \Device\NPF_{AF38AF37-B5CF-4E8F-867B-264BC8F540A8}, id 0
Ethernet II, Src: VMware_c0:b1:ab (00:0c:29:c0:b1:ab), Dst: VMware_f9:fd:da (00:50:56:f9:fd:da)
Internet Protocol Version 4, Src: 192.168.15.139 (192.168.15.139), Dst: GYANDE2L.ptcnet.ptc.com (100.64.1.34)
Transmission Control Protocol, Src Port: 50283, Dst Port: 60001, Seq: 4032, Ack: 5821, Len: 270
OpcUa Binary Protocol

No.     DeltaTime Time                    Source                Destination           Protocol Length Stream Index Info                                                            SrcPort DstPort Src Time
    112 0.019s    2025-07-04 05:51:25.457 GYANDE2L.ptcnet.ptc.com 192.168.15.139        OpcUa    205    2            UA Secure Conversation Message: ReadResponse                    60001   50283   

Frame 112: 205 bytes on wire (1640 bits), 205 bytes captured (1640 bits) on interface \Device\NPF_{AF38AF37-B5CF-4E8F-867B-264BC8F540A8}, id 0
Ethernet II, Src: VMware_f9:fd:da (00:50:56:f9:fd:da), Dst: VMware_c0:b1:ab (00:0c:29:c0:b1:ab)
Internet Protocol Version 4, Src: GYANDE2L.ptcnet.ptc.com (100.64.1.34), Dst: 192.168.15.139 (192.168.15.139)
Transmission Control Protocol, Src Port: 60001, Dst Port: 50283, Seq: 5821, Ack: 4302, Len: 151
OpcUa Binary Protocol

No.     DeltaTime Time                    Source                Destination           Protocol Length Stream Index Info                                                            SrcPort DstPort Src Time
    113 0.000s    2025-07-04 05:51:25.458 192.168.15.139        GYANDE2L.ptcnet.ptc.com OpcUa    187    2            UA Secure Conversation Message: BrowseRequest                   50283   60001   

Frame 113: 187 bytes on wire (1496 bits), 187 bytes captured (1496 bits) on interface \Device\NPF_{AF38AF37-B5CF-4E8F-867B-264BC8F540A8}, id 0
Ethernet II, Src: VMware_c0:b1:ab (00:0c:29:c0:b1:ab), Dst: VMware_f9:fd:da (00:50:56:f9:fd:da)
Internet Protocol Version 4, Src: 192.168.15.139 (192.168.15.139), Dst: GYANDE2L.ptcnet.ptc.com (100.64.1.34)
Transmission Control Protocol, Src Port: 50283, Dst Port: 60001, Seq: 4302, Ack: 5972, Len: 133
OpcUa Binary Protocol

No.     DeltaTime Time                    Source                Destination           Protocol Length Stream Index Info                                                            SrcPort DstPort Src Time
    115 0.018s    2025-07-04 05:51:25.477 GYANDE2L.ptcnet.ptc.com 192.168.15.139        OpcUa    144    2            UA Secure Conversation Message: BrowseResponse                  60001   50283   

Frame 115: 144 bytes on wire (1152 bits), 144 bytes captured (1152 bits) on interface \Device\NPF_{AF38AF37-B5CF-4E8F-867B-264BC8F540A8}, id 0
Ethernet II, Src: VMware_f9:fd:da (00:50:56:f9:fd:da), Dst: VMware_c0:b1:ab (00:0c:29:c0:b1:ab)
Internet Protocol Version 4, Src: GYANDE2L.ptcnet.ptc.com (100.64.1.34), Dst: 192.168.15.139 (192.168.15.139)
Transmission Control Protocol, Src Port: 60001, Dst Port: 50283, Seq: 5972, Ack: 4435, Len: 90
OpcUa Binary Protocol

No.     DeltaTime Time                    Source                Destination           Protocol Length Stream Index Info                                                            SrcPort DstPort Src Time
    116 0.000s    2025-07-04 05:51:25.477 192.168.15.139        GYANDE2L.ptcnet.ptc.com OpcUa    324    2            UA Secure Conversation Message: ReadRequest                     50283   60001   

Frame 116: 324 bytes on wire (2592 bits), 324 bytes captured (2592 bits) on interface \Device\NPF_{AF38AF37-B5CF-4E8F-867B-264BC8F540A8}, id 0
Ethernet II, Src: VMware_c0:b1:ab (00:0c:29:c0:b1:ab), Dst: VMware_f9:fd:da (00:50:56:f9:fd:da)
Internet Protocol Version 4, Src: 192.168.15.139 (192.168.15.139), Dst: GYANDE2L.ptcnet.ptc.com (100.64.1.34)
Transmission Control Protocol, Src Port: 50283, Dst Port: 60001, Seq: 4435, Ack: 6062, Len: 270
OpcUa Binary Protocol

No.     DeltaTime Time                    Source                Destination           Protocol Length Stream Index Info                                                            SrcPort DstPort Src Time
    118 0.018s    2025-07-04 05:51:25.496 GYANDE2L.ptcnet.ptc.com 192.168.15.139        OpcUa    242    2            UA Secure Conversation Message: ReadResponse                    60001   50283   

Frame 118: 242 bytes on wire (1936 bits), 242 bytes captured (1936 bits) on interface \Device\NPF_{AF38AF37-B5CF-4E8F-867B-264BC8F540A8}, id 0
Ethernet II, Src: VMware_f9:fd:da (00:50:56:f9:fd:da), Dst: VMware_c0:b1:ab (00:0c:29:c0:b1:ab)
Internet Protocol Version 4, Src: GYANDE2L.ptcnet.ptc.com (100.64.1.34), Dst: 192.168.15.139 (192.168.15.139)
Transmission Control Protocol, Src Port: 60001, Dst Port: 50283, Seq: 6062, Ack: 4705, Len: 188
OpcUa Binary Protocol

No.     DeltaTime Time                    Source                Destination           Protocol Length Stream Index Info                                                            SrcPort DstPort Src Time
    119 0.000s    2025-07-04 05:51:25.496 192.168.15.139        GYANDE2L.ptcnet.ptc.com OpcUa    187    2            UA Secure Conversation Message: BrowseRequest                   50283   60001   

Frame 119: 187 bytes on wire (1496 bits), 187 bytes captured (1496 bits) on interface \Device\NPF_{AF38AF37-B5CF-4E8F-867B-264BC8F540A8}, id 0
Ethernet II, Src: VMware_c0:b1:ab (00:0c:29:c0:b1:ab), Dst: VMware_f9:fd:da (00:50:56:f9:fd:da)
Internet Protocol Version 4, Src: 192.168.15.139 (192.168.15.139), Dst: GYANDE2L.ptcnet.ptc.com (100.64.1.34)
Transmission Control Protocol, Src Port: 50283, Dst Port: 60001, Seq: 4705, Ack: 6250, Len: 133
OpcUa Binary Protocol

No.     DeltaTime Time                    Source                Destination           Protocol Length Stream Index Info                                                            SrcPort DstPort Src Time
    121 0.017s    2025-07-04 05:51:25.514 GYANDE2L.ptcnet.ptc.com 192.168.15.139        OpcUa    144    2            UA Secure Conversation Message: BrowseResponse                  60001   50283   

Frame 121: 144 bytes on wire (1152 bits), 144 bytes captured (1152 bits) on interface \Device\NPF_{AF38AF37-B5CF-4E8F-867B-264BC8F540A8}, id 0
Ethernet II, Src: VMware_f9:fd:da (00:50:56:f9:fd:da), Dst: VMware_c0:b1:ab (00:0c:29:c0:b1:ab)
Internet Protocol Version 4, Src: GYANDE2L.ptcnet.ptc.com (100.64.1.34), Dst: 192.168.15.139 (192.168.15.139)
Transmission Control Protocol, Src Port: 60001, Dst Port: 50283, Seq: 6250, Ack: 4838, Len: 90
OpcUa Binary Protocol

No.     DeltaTime Time                    Source                Destination           Protocol Length Stream Index Info                                                            SrcPort DstPort Src Time
    122 0.000s    2025-07-04 05:51:25.515 192.168.15.139        GYANDE2L.ptcnet.ptc.com OpcUa    324    2            UA Secure Conversation Message: ReadRequest                     50283   60001   

Frame 122: 324 bytes on wire (2592 bits), 324 bytes captured (2592 bits) on interface \Device\NPF_{AF38AF37-B5CF-4E8F-867B-264BC8F540A8}, id 0
Ethernet II, Src: VMware_c0:b1:ab (00:0c:29:c0:b1:ab), Dst: VMware_f9:fd:da (00:50:56:f9:fd:da)
Internet Protocol Version 4, Src: 192.168.15.139 (192.168.15.139), Dst: GYANDE2L.ptcnet.ptc.com (100.64.1.34)
Transmission Control Protocol, Src Port: 50283, Dst Port: 60001, Seq: 4838, Ack: 6340, Len: 270
OpcUa Binary Protocol

No.     DeltaTime Time                    Source                Destination           Protocol Length Stream Index Info                                                            SrcPort DstPort Src Time
    124 0.018s    2025-07-04 05:51:25.533 GYANDE2L.ptcnet.ptc.com 192.168.15.139        OpcUa    186    2            UA Secure Conversation Message: ReadResponse                    60001   50283   

Frame 124: 186 bytes on wire (1488 bits), 186 bytes captured (1488 bits) on interface \Device\NPF_{AF38AF37-B5CF-4E8F-867B-264BC8F540A8}, id 0
Ethernet II, Src: VMware_f9:fd:da (00:50:56:f9:fd:da), Dst: VMware_c0:b1:ab (00:0c:29:c0:b1:ab)
Internet Protocol Version 4, Src: GYANDE2L.ptcnet.ptc.com (100.64.1.34), Dst: 192.168.15.139 (192.168.15.139)
Transmission Control Protocol, Src Port: 60001, Dst Port: 50283, Seq: 6340, Ack: 5108, Len: 132
OpcUa Binary Protocol

No.     DeltaTime Time                    Source                Destination           Protocol Length Stream Index Info                                                            SrcPort DstPort Src Time
    125 0.000s    2025-07-04 05:51:25.533 192.168.15.139        GYANDE2L.ptcnet.ptc.com OpcUa    187    2            UA Secure Conversation Message: BrowseRequest                   50283   60001   

