No.     DeltaTime Time                    Source                Destination           Info                                                            SrcPort DstPort
     51 0.000     2025-07-07 10:34:09.750 192.168.15.139        100.64.1.122          Hello message                                                   62501   60001

Frame 51: 125 bytes on wire (1000 bits), 125 bytes captured (1000 bits) on interface \Device\NPF_{AF38AF37-B5CF-4E8F-867B-264BC8F540A8}, id 0
Ethernet II, Src: VMware_c0:b1:ab (00:0c:29:c0:b1:ab), Dst: VMware_f9:fd:da (00:50:56:f9:fd:da)
Internet Protocol Version 4, Src: 192.168.15.139, Dst: 100.64.1.122
Transmission Control Protocol, Src Port: 62501, Dst Port: 60001, Seq: 1, Ack: 1, Len: 71
OpcUa Binary Protocol

No.     DeltaTime Time                    Source                Destination           Info                                                            SrcPort DstPort
     53 0.079     2025-07-07 10:34:09.829 100.64.1.122          192.168.15.139        Acknowledge message                                             60001   62501

Frame 53: 82 bytes on wire (656 bits), 82 bytes captured (656 bits) on interface \Device\NPF_{AF38AF37-B5CF-4E8F-867B-264BC8F540A8}, id 0
Ethernet II, Src: VMware_f9:fd:da (00:50:56:f9:fd:da), Dst: VMware_c0:b1:ab (00:0c:29:c0:b1:ab)
Internet Protocol Version 4, Src: 100.64.1.122, Dst: 192.168.15.139
Transmission Control Protocol, Src Port: 60001, Dst Port: 62501, Seq: 1, Ack: 72, Len: 28
OpcUa Binary Protocol

No.     DeltaTime Time                    Source                Destination           Info                                                            SrcPort DstPort
     54 0.000     2025-07-07 10:34:09.830 192.168.15.139        100.64.1.122          OpenSecureChannel message: OpenSecureChannelRequest             62501   60001

Frame 54: 187 bytes on wire (1496 bits), 187 bytes captured (1496 bits) on interface \Device\NPF_{AF38AF37-B5CF-4E8F-867B-264BC8F540A8}, id 0
Ethernet II, Src: VMware_c0:b1:ab (00:0c:29:c0:b1:ab), Dst: VMware_f9:fd:da (00:50:56:f9:fd:da)
Internet Protocol Version 4, Src: 192.168.15.139, Dst: 100.64.1.122
Transmission Control Protocol, Src Port: 62501, Dst Port: 60001, Seq: 72, Ack: 29, Len: 133
OpcUa Binary Protocol

No.     DeltaTime Time                    Source                Destination           Info                                                            SrcPort DstPort
     56 0.032     2025-07-07 10:34:09.862 100.64.1.122          192.168.15.139        OpenSecureChannel message: OpenSecureChannelResponse            60001   62501

Frame 56: 189 bytes on wire (1512 bits), 189 bytes captured (1512 bits) on interface \Device\NPF_{AF38AF37-B5CF-4E8F-867B-264BC8F540A8}, id 0
Ethernet II, Src: VMware_f9:fd:da (00:50:56:f9:fd:da), Dst: VMware_c0:b1:ab (00:0c:29:c0:b1:ab)
Internet Protocol Version 4, Src: 100.64.1.122, Dst: 192.168.15.139
Transmission Control Protocol, Src Port: 60001, Dst Port: 62501, Seq: 29, Ack: 205, Len: 135
OpcUa Binary Protocol

No.     DeltaTime Time                    Source                Destination           Info                                                            SrcPort DstPort
     57 0.001     2025-07-07 10:34:09.863 192.168.15.139        100.64.1.122          UA Secure Conversation Message: GetEndpointsRequest             62501   60001

Frame 57: 162 bytes on wire (1296 bits), 162 bytes captured (1296 bits) on interface \Device\NPF_{AF38AF37-B5CF-4E8F-867B-264BC8F540A8}, id 0
Ethernet II, Src: VMware_c0:b1:ab (00:0c:29:c0:b1:ab), Dst: VMware_f9:fd:da (00:50:56:f9:fd:da)
Internet Protocol Version 4, Src: 192.168.15.139, Dst: 100.64.1.122
Transmission Control Protocol, Src Port: 62501, Dst Port: 60001, Seq: 205, Ack: 164, Len: 108
OpcUa Binary Protocol

No.     DeltaTime Time                    Source                Destination           Info                                                            SrcPort DstPort
     59 0.035     2025-07-07 10:34:09.899 100.64.1.122          192.168.15.139        UA Secure Conversation Message: GetEndpointsResponse            60001   62501

Frame 59: 459 bytes on wire (3672 bits), 459 bytes captured (3672 bits) on interface \Device\NPF_{AF38AF37-B5CF-4E8F-867B-264BC8F540A8}, id 0
Ethernet II, Src: VMware_f9:fd:da (00:50:56:f9:fd:da), Dst: VMware_c0:b1:ab (00:0c:29:c0:b1:ab)
Internet Protocol Version 4, Src: 100.64.1.122, Dst: 192.168.15.139
Transmission Control Protocol, Src Port: 60001, Dst Port: 62501, Seq: 164, Ack: 313, Len: 405
OpcUa Binary Protocol

No.     DeltaTime Time                    Source                Destination           Info                                                            SrcPort DstPort
     60 0.000     2025-07-07 10:34:09.900 192.168.15.139        100.64.1.122          CloseSecureChannel message: CloseSecureChannelRequest           62501   60001

Frame 60: 111 bytes on wire (888 bits), 111 bytes captured (888 bits) on interface \Device\NPF_{AF38AF37-B5CF-4E8F-867B-264BC8F540A8}, id 0
Ethernet II, Src: VMware_c0:b1:ab (00:0c:29:c0:b1:ab), Dst: VMware_f9:fd:da (00:50:56:f9:fd:da)
Internet Protocol Version 4, Src: 192.168.15.139, Dst: 100.64.1.122
Transmission Control Protocol, Src Port: 62501, Dst Port: 60001, Seq: 313, Ack: 569, Len: 57
OpcUa Binary Protocol

No.     DeltaTime Time                    Source                Destination           Info                                                            SrcPort DstPort
     77 0.054     2025-07-07 10:34:09.954 192.168.15.139        100.64.1.122          Hello message                                                   62502   60001

Frame 77: 125 bytes on wire (1000 bits), 125 bytes captured (1000 bits) on interface \Device\NPF_{AF38AF37-B5CF-4E8F-867B-264BC8F540A8}, id 0
Ethernet II, Src: VMware_c0:b1:ab (00:0c:29:c0:b1:ab), Dst: VMware_f9:fd:da (00:50:56:f9:fd:da)
Internet Protocol Version 4, Src: 192.168.15.139, Dst: 100.64.1.122
Transmission Control Protocol, Src Port: 62502, Dst Port: 60001, Seq: 1, Ack: 1, Len: 71
OpcUa Binary Protocol

No.     DeltaTime Time                    Source                Destination           Info                                                            SrcPort DstPort
     80 0.046     2025-07-07 10:34:10.000 100.64.1.122          192.168.15.139        Acknowledge message                                             60001   62502

Frame 80: 82 bytes on wire (656 bits), 82 bytes captured (656 bits) on interface \Device\NPF_{AF38AF37-B5CF-4E8F-867B-264BC8F540A8}, id 0
Ethernet II, Src: VMware_f9:fd:da (00:50:56:f9:fd:da), Dst: VMware_c0:b1:ab (00:0c:29:c0:b1:ab)
Internet Protocol Version 4, Src: 100.64.1.122, Dst: 192.168.15.139
Transmission Control Protocol, Src Port: 60001, Dst Port: 62502, Seq: 1, Ack: 72, Len: 28
OpcUa Binary Protocol

No.     DeltaTime Time                    Source                Destination           Info                                                            SrcPort DstPort
     81 0.000     2025-07-07 10:34:10.001 192.168.15.139        100.64.1.122          OpenSecureChannel message: OpenSecureChannelRequest             62502   60001

Frame 81: 187 bytes on wire (1496 bits), 187 bytes captured (1496 bits) on interface \Device\NPF_{AF38AF37-B5CF-4E8F-867B-264BC8F540A8}, id 0
Ethernet II, Src: VMware_c0:b1:ab (00:0c:29:c0:b1:ab), Dst: VMware_f9:fd:da (00:50:56:f9:fd:da)
Internet Protocol Version 4, Src: 192.168.15.139, Dst: 100.64.1.122
Transmission Control Protocol, Src Port: 62502, Dst Port: 60001, Seq: 72, Ack: 29, Len: 133
OpcUa Binary Protocol

No.     DeltaTime Time                    Source                Destination           Info                                                            SrcPort DstPort
     83 0.024     2025-07-07 10:34:10.025 100.64.1.122          192.168.15.139        OpenSecureChannel message: OpenSecureChannelResponse            60001   62502

Frame 83: 189 bytes on wire (1512 bits), 189 bytes captured (1512 bits) on interface \Device\NPF_{AF38AF37-B5CF-4E8F-867B-264BC8F540A8}, id 0
Ethernet II, Src: VMware_f9:fd:da (00:50:56:f9:fd:da), Dst: VMware_c0:b1:ab (00:0c:29:c0:b1:ab)
Internet Protocol Version 4, Src: 100.64.1.122, Dst: 192.168.15.139
Transmission Control Protocol, Src Port: 60001, Dst Port: 62502, Seq: 29, Ack: 205, Len: 135
OpcUa Binary Protocol

No.     DeltaTime Time                    Source                Destination           Info                                                            SrcPort DstPort
     84 0.000     2025-07-07 10:34:10.026 192.168.15.139        100.64.1.122          UA Secure Conversation Message: CreateSessionRequest            62502   60001

Frame 84: 380 bytes on wire (3040 bits), 380 bytes captured (3040 bits) on interface \Device\NPF_{AF38AF37-B5CF-4E8F-867B-264BC8F540A8}, id 0
Ethernet II, Src: VMware_c0:b1:ab (00:0c:29:c0:b1:ab), Dst: VMware_f9:fd:da (00:50:56:f9:fd:da)
Internet Protocol Version 4, Src: 192.168.15.139, Dst: 100.64.1.122
Transmission Control Protocol, Src Port: 62502, Dst Port: 60001, Seq: 205, Ack: 164, Len: 326
OpcUa Binary Protocol

No.     DeltaTime Time                    Source                Destination           Info                                                            SrcPort DstPort
     86 0.032     2025-07-07 10:34:10.058 100.64.1.122          192.168.15.139        UA Secure Conversation Message: CreateSessionResponse           60001   62502

Frame 86: 569 bytes on wire (4552 bits), 569 bytes captured (4552 bits) on interface \Device\NPF_{AF38AF37-B5CF-4E8F-867B-264BC8F540A8}, id 0
Ethernet II, Src: VMware_f9:fd:da (00:50:56:f9:fd:da), Dst: VMware_c0:b1:ab (00:0c:29:c0:b1:ab)
Internet Protocol Version 4, Src: 100.64.1.122, Dst: 192.168.15.139
Transmission Control Protocol, Src Port: 60001, Dst Port: 62502, Seq: 164, Ack: 531, Len: 515
OpcUa Binary Protocol

No.     DeltaTime Time                    Source                Destination           Info                                                            SrcPort DstPort
     87 0.001     2025-07-07 10:34:10.059 192.168.15.139        100.64.1.122          UA Secure Conversation Message: ActivateSessionRequest          62502   60001

Frame 87: 195 bytes on wire (1560 bits), 195 bytes captured (1560 bits) on interface \Device\NPF_{AF38AF37-B5CF-4E8F-867B-264BC8F540A8}, id 0
Ethernet II, Src: VMware_c0:b1:ab (00:0c:29:c0:b1:ab), Dst: VMware_f9:fd:da (00:50:56:f9:fd:da)
Internet Protocol Version 4, Src: 192.168.15.139, Dst: 100.64.1.122
Transmission Control Protocol, Src Port: 62502, Dst Port: 60001, Seq: 531, Ack: 679, Len: 141
OpcUa Binary Protocol

No.     DeltaTime Time                    Source                Destination           Info                                                            SrcPort DstPort
     89 0.032     2025-07-07 10:34:10.092 100.64.1.122          192.168.15.139        UA Secure Conversation Message: ActivateSessionResponse         60001   62502

Frame 89: 150 bytes on wire (1200 bits), 150 bytes captured (1200 bits) on interface \Device\NPF_{AF38AF37-B5CF-4E8F-867B-264BC8F540A8}, id 0
Ethernet II, Src: VMware_f9:fd:da (00:50:56:f9:fd:da), Dst: VMware_c0:b1:ab (00:0c:29:c0:b1:ab)
Internet Protocol Version 4, Src: 100.64.1.122, Dst: 192.168.15.139
Transmission Control Protocol, Src Port: 60001, Dst Port: 62502, Seq: 679, Ack: 672, Len: 96
OpcUa Binary Protocol

No.     DeltaTime Time                    Source                Destination           Info                                                            SrcPort DstPort
     90 0.000     2025-07-07 10:34:10.092 192.168.15.139        100.64.1.122          UA Secure Conversation Message: ReadRequest                     62502   60001

Frame 90: 200 bytes on wire (1600 bits), 200 bytes captured (1600 bits) on interface \Device\NPF_{AF38AF37-B5CF-4E8F-867B-264BC8F540A8}, id 0
Ethernet II, Src: VMware_c0:b1:ab (00:0c:29:c0:b1:ab), Dst: VMware_f9:fd:da (00:50:56:f9:fd:da)
Internet Protocol Version 4, Src: 192.168.15.139, Dst: 100.64.1.122
Transmission Control Protocol, Src Port: 62502, Dst Port: 60001, Seq: 672, Ack: 775, Len: 146
OpcUa Binary Protocol

No.     DeltaTime Time                    Source                Destination           Info                                                            SrcPort DstPort
     92 0.024     2025-07-07 10:34:10.116 100.64.1.122          192.168.15.139        UA Secure Conversation Message: ReadResponse                    60001   62502

Frame 92: 126 bytes on wire (1008 bits), 126 bytes captured (1008 bits) on interface \Device\NPF_{AF38AF37-B5CF-4E8F-867B-264BC8F540A8}, id 0
Ethernet II, Src: VMware_f9:fd:da (00:50:56:f9:fd:da), Dst: VMware_c0:b1:ab (00:0c:29:c0:b1:ab)
Internet Protocol Version 4, Src: 100.64.1.122, Dst: 192.168.15.139
Transmission Control Protocol, Src Port: 60001, Dst Port: 62502, Seq: 775, Ack: 818, Len: 72
OpcUa Binary Protocol

No.     DeltaTime Time                    Source                Destination           Info                                                            SrcPort DstPort
     93 0.000     2025-07-07 10:34:10.117 192.168.15.139        100.64.1.122          UA Secure Conversation Message: ReadRequest                     62502   60001

Frame 93: 506 bytes on wire (4048 bits), 506 bytes captured (4048 bits) on interface \Device\NPF_{AF38AF37-B5CF-4E8F-867B-264BC8F540A8}, id 0
Ethernet II, Src: VMware_c0:b1:ab (00:0c:29:c0:b1:ab), Dst: VMware_f9:fd:da (00:50:56:f9:fd:da)
Internet Protocol Version 4, Src: 192.168.15.139, Dst: 100.64.1.122
Transmission Control Protocol, Src Port: 62502, Dst Port: 60001, Seq: 818, Ack: 847, Len: 452
OpcUa Binary Protocol

No.     DeltaTime Time                    Source                Destination           Info                                                            SrcPort DstPort
     95 0.023     2025-07-07 10:34:10.141 100.64.1.122          192.168.15.139        UA Secure Conversation Message: ReadResponse                    60001   62502

Frame 95: 627 bytes on wire (5016 bits), 627 bytes captured (5016 bits) on interface \Device\NPF_{AF38AF37-B5CF-4E8F-867B-264BC8F540A8}, id 0
Ethernet II, Src: VMware_f9:fd:da (00:50:56:f9:fd:da), Dst: VMware_c0:b1:ab (00:0c:29:c0:b1:ab)
Internet Protocol Version 4, Src: 100.64.1.122, Dst: 192.168.15.139
Transmission Control Protocol, Src Port: 60001, Dst Port: 62502, Seq: 847, Ack: 1270, Len: 573
OpcUa Binary Protocol

No.     DeltaTime Time                    Source                Destination           Info                                                            SrcPort DstPort
     96 0.004     2025-07-07 10:34:10.145 192.168.15.139        100.64.1.122          UA Secure Conversation Message: BrowseRequest                   62502   60001

Frame 96: 187 bytes on wire (1496 bits), 187 bytes captured (1496 bits) on interface \Device\NPF_{AF38AF37-B5CF-4E8F-867B-264BC8F540A8}, id 0
Ethernet II, Src: VMware_c0:b1:ab (00:0c:29:c0:b1:ab), Dst: VMware_f9:fd:da (00:50:56:f9:fd:da)
Internet Protocol Version 4, Src: 192.168.15.139, Dst: 100.64.1.122
Transmission Control Protocol, Src Port: 62502, Dst Port: 60001, Seq: 1270, Ack: 1420, Len: 133
OpcUa Binary Protocol

No.     DeltaTime Time                    Source                Destination           Info                                                            SrcPort DstPort
     99 0.027     2025-07-07 10:34:10.173 100.64.1.122          192.168.15.139        UA Secure Conversation Message: BrowseResponse                  60001   62502

Frame 99: 564 bytes on wire (4512 bits), 564 bytes captured (4512 bits) on interface \Device\NPF_{AF38AF37-B5CF-4E8F-867B-264BC8F540A8}, id 0
Ethernet II, Src: VMware_f9:fd:da (00:50:56:f9:fd:da), Dst: VMware_c0:b1:ab (00:0c:29:c0:b1:ab)
Internet Protocol Version 4, Src: 100.64.1.122, Dst: 192.168.15.139
Transmission Control Protocol, Src Port: 60001, Dst Port: 62502, Seq: 2880, Ack: 1403, Len: 510
[2 Reassembled TCP Segments (1970 bytes): #98(1460), #99(510)]
OpcUa Binary Protocol

No.     DeltaTime Time                    Source                Destination           Info                                                            SrcPort DstPort
    101 0.000     2025-07-07 10:34:10.173 192.168.15.139        100.64.1.122          UA Secure Conversation Message: BrowseRequest                   62502   60001

Frame 101: 793 bytes on wire (6344 bits), 793 bytes captured (6344 bits) on interface \Device\NPF_{AF38AF37-B5CF-4E8F-867B-264BC8F540A8}, id 0
Ethernet II, Src: VMware_c0:b1:ab (00:0c:29:c0:b1:ab), Dst: VMware_f9:fd:da (00:50:56:f9:fd:da)
Internet Protocol Version 4, Src: 192.168.15.139, Dst: 100.64.1.122
Transmission Control Protocol, Src Port: 62502, Dst Port: 60001, Seq: 1403, Ack: 3390, Len: 739
OpcUa Binary Protocol

No.     DeltaTime Time                    Source                Destination           Info                                                            SrcPort DstPort
    104 0.026     2025-07-07 10:34:10.200 100.64.1.122          192.168.15.139        UA Secure Conversation Message: BrowseResponse                  60001   62502

Frame 104: 510 bytes on wire (4080 bits), 510 bytes captured (4080 bits) on interface \Device\NPF_{AF38AF37-B5CF-4E8F-867B-264BC8F540A8}, id 0
Ethernet II, Src: VMware_f9:fd:da (00:50:56:f9:fd:da), Dst: VMware_c0:b1:ab (00:0c:29:c0:b1:ab)
Internet Protocol Version 4, Src: 100.64.1.122, Dst: 192.168.15.139
Transmission Control Protocol, Src Port: 60001, Dst Port: 62502, Seq: 3390, Ack: 2142, Len: 456
OpcUa Binary Protocol

No.     DeltaTime Time                    Source                Destination           Info                                                            SrcPort DstPort
    105 0.000     2025-07-07 10:34:10.200 192.168.15.139        100.64.1.122          UA Secure Conversation Message: BrowseRequest                   62502   60001

Frame 105: 257 bytes on wire (2056 bits), 257 bytes captured (2056 bits) on interface \Device\NPF_{AF38AF37-B5CF-4E8F-867B-264BC8F540A8}, id 0
Ethernet II, Src: VMware_c0:b1:ab (00:0c:29:c0:b1:ab), Dst: VMware_f9:fd:da (00:50:56:f9:fd:da)
Internet Protocol Version 4, Src: 192.168.15.139, Dst: 100.64.1.122
Transmission Control Protocol, Src Port: 62502, Dst Port: 60001, Seq: 2142, Ack: 3846, Len: 203
OpcUa Binary Protocol

No.     DeltaTime Time                    Source                Destination           Info                                                            SrcPort DstPort
    107 0.023     2025-07-07 10:34:10.224 100.64.1.122          192.168.15.139        UA Secure Conversation Message: BrowseResponse                  60001   62502

Frame 107: 1198 bytes on wire (9584 bits), 1198 bytes captured (9584 bits) on interface \Device\NPF_{AF38AF37-B5CF-4E8F-867B-264BC8F540A8}, id 0
Ethernet II, Src: VMware_f9:fd:da (00:50:56:f9:fd:da), Dst: VMware_c0:b1:ab (00:0c:29:c0:b1:ab)
Internet Protocol Version 4, Src: 100.64.1.122, Dst: 192.168.15.139
Transmission Control Protocol, Src Port: 60001, Dst Port: 62502, Seq: 3846, Ack: 2345, Len: 1144
OpcUa Binary Protocol

No.     DeltaTime Time                    Source                Destination           Info                                                            SrcPort DstPort
    108 0.001     2025-07-07 10:34:10.225 192.168.15.139        100.64.1.122          UA Secure Conversation Message: TranslateBrowsePathsToNodeIdsRequest 62502   60001

Frame 108: 709 bytes on wire (5672 bits), 709 bytes captured (5672 bits) on interface \Device\NPF_{AF38AF37-B5CF-4E8F-867B-264BC8F540A8}, id 0
Ethernet II, Src: VMware_c0:b1:ab (00:0c:29:c0:b1:ab), Dst: VMware_f9:fd:da (00:50:56:f9:fd:da)
Internet Protocol Version 4, Src: 192.168.15.139, Dst: 100.64.1.122
Transmission Control Protocol, Src Port: 62502, Dst Port: 60001, Seq: 2345, Ack: 4990, Len: 655
OpcUa Binary Protocol

No.     DeltaTime Time                    Source                Destination           Info                                                            SrcPort DstPort
    110 0.026     2025-07-07 10:34:10.251 100.64.1.122          192.168.15.139        UA Secure Conversation Message: TranslateBrowsePathsToNodeIdsResponse 60001   62502

Frame 110: 346 bytes on wire (2768 bits), 346 bytes captured (2768 bits) on interface \Device\NPF_{AF38AF37-B5CF-4E8F-867B-264BC8F540A8}, id 0
Ethernet II, Src: VMware_f9:fd:da (00:50:56:f9:fd:da), Dst: VMware_c0:b1:ab (00:0c:29:c0:b1:ab)
Internet Protocol Version 4, Src: 100.64.1.122, Dst: 192.168.15.139
Transmission Control Protocol, Src Port: 60001, Dst Port: 62502, Seq: 4990, Ack: 3000, Len: 292
OpcUa Binary Protocol

No.     DeltaTime Time                    Source                Destination           Info                                                            SrcPort DstPort
    111 0.000     2025-07-07 10:34:10.252 192.168.15.139        100.64.1.122          UA Secure Conversation Message: TranslateBrowsePathsToNodeIdsRequest 62502   60001

Frame 111: 692 bytes on wire (5536 bits), 692 bytes captured (5536 bits) on interface \Device\NPF_{AF38AF37-B5CF-4E8F-867B-264BC8F540A8}, id 0
Ethernet II, Src: VMware_c0:b1:ab (00:0c:29:c0:b1:ab), Dst: VMware_f9:fd:da (00:50:56:f9:fd:da)
Internet Protocol Version 4, Src: 192.168.15.139, Dst: 100.64.1.122
Transmission Control Protocol, Src Port: 62502, Dst Port: 60001, Seq: 3000, Ack: 5282, Len: 638
OpcUa Binary Protocol

No.     DeltaTime Time                    Source                Destination           Info                                                            SrcPort DstPort
    113 0.029     2025-07-07 10:34:10.281 100.64.1.122          192.168.15.139        UA Secure Conversation Message: TranslateBrowsePathsToNodeIdsResponse 60001   62502

Frame 113: 250 bytes on wire (2000 bits), 250 bytes captured (2000 bits) on interface \Device\NPF_{AF38AF37-B5CF-4E8F-867B-264BC8F540A8}, id 0
Ethernet II, Src: VMware_f9:fd:da (00:50:56:f9:fd:da), Dst: VMware_c0:b1:ab (00:0c:29:c0:b1:ab)
Internet Protocol Version 4, Src: 100.64.1.122, Dst: 192.168.15.139
Transmission Control Protocol, Src Port: 60001, Dst Port: 62502, Seq: 5282, Ack: 3638, Len: 196
OpcUa Binary Protocol

No.     DeltaTime Time                    Source                Destination           Info                                                            SrcPort DstPort
    114 0.000     2025-07-07 10:34:10.282 192.168.15.139        100.64.1.122          UA Secure Conversation Message: BrowseRequest                   62502   60001

Frame 114: 187 bytes on wire (1496 bits), 187 bytes captured (1496 bits) on interface \Device\NPF_{AF38AF37-B5CF-4E8F-867B-264BC8F540A8}, id 0
Ethernet II, Src: VMware_c0:b1:ab (00:0c:29:c0:b1:ab), Dst: VMware_f9:fd:da (00:50:56:f9:fd:da)
Internet Protocol Version 4, Src: 192.168.15.139, Dst: 100.64.1.122
Transmission Control Protocol, Src Port: 62502, Dst Port: 60001, Seq: 3638, Ack: 5478, Len: 133
OpcUa Binary Protocol

No.     DeltaTime Time                    Source                Destination           Info                                                            SrcPort DstPort
    116 0.027     2025-07-07 10:34:10.309 100.64.1.122          192.168.15.139        UA Secure Conversation Message: BrowseResponse                  60001   62502

Frame 116: 162 bytes on wire (1296 bits), 162 bytes captured (1296 bits) on interface \Device\NPF_{AF38AF37-B5CF-4E8F-867B-264BC8F540A8}, id 0
Ethernet II, Src: VMware_f9:fd:da (00:50:56:f9:fd:da), Dst: VMware_c0:b1:ab (00:0c:29:c0:b1:ab)
Internet Protocol Version 4, Src: 100.64.1.122, Dst: 192.168.15.139
Transmission Control Protocol, Src Port: 60001, Dst Port: 62502, Seq: 5478, Ack: 3771, Len: 108
OpcUa Binary Protocol

No.     DeltaTime Time                    Source                Destination           Info                                                            SrcPort DstPort
    117 0.001     2025-07-07 10:34:10.310 192.168.15.139        100.64.1.122          UA Secure Conversation Message: ReadRequest                     62502   60001

Frame 117: 182 bytes on wire (1456 bits), 182 bytes captured (1456 bits) on interface \Device\NPF_{AF38AF37-B5CF-4E8F-867B-264BC8F540A8}, id 0
Ethernet II, Src: VMware_c0:b1:ab (00:0c:29:c0:b1:ab), Dst: VMware_f9:fd:da (00:50:56:f9:fd:da)
Internet Protocol Version 4, Src: 192.168.15.139, Dst: 100.64.1.122
Transmission Control Protocol, Src Port: 62502, Dst Port: 60001, Seq: 3771, Ack: 5586, Len: 128
OpcUa Binary Protocol

No.     DeltaTime Time                    Source                Destination           Info                                                            SrcPort DstPort
    119 0.023     2025-07-07 10:34:10.333 100.64.1.122          192.168.15.139        UA Secure Conversation Message: ReadResponse                    60001   62502

Frame 119: 117 bytes on wire (936 bits), 117 bytes captured (936 bits) on interface \Device\NPF_{AF38AF37-B5CF-4E8F-867B-264BC8F540A8}, id 0
Ethernet II, Src: VMware_f9:fd:da (00:50:56:f9:fd:da), Dst: VMware_c0:b1:ab (00:0c:29:c0:b1:ab)
Internet Protocol Version 4, Src: 100.64.1.122, Dst: 192.168.15.139
Transmission Control Protocol, Src Port: 60001, Dst Port: 62502, Seq: 5586, Ack: 3899, Len: 63
OpcUa Binary Protocol

No.     DeltaTime Time                    Source                Destination           Info                                                            SrcPort DstPort
    120 0.002     2025-07-07 10:34:10.335 192.168.15.139        100.64.1.122          UA Secure Conversation Message: BrowseRequest                   62502   60001

Frame 120: 187 bytes on wire (1496 bits), 187 bytes captured (1496 bits) on interface \Device\NPF_{AF38AF37-B5CF-4E8F-867B-264BC8F540A8}, id 0
Ethernet II, Src: VMware_c0:b1:ab (00:0c:29:c0:b1:ab), Dst: VMware_f9:fd:da (00:50:56:f9:fd:da)
Internet Protocol Version 4, Src: 192.168.15.139, Dst: 100.64.1.122
Transmission Control Protocol, Src Port: 62502, Dst Port: 60001, Seq: 3899, Ack: 5649, Len: 133
OpcUa Binary Protocol

No.     DeltaTime Time                    Source                Destination           Info                                                            SrcPort DstPort
    126 0.026     2025-07-07 10:34:10.362 100.64.1.122          192.168.15.139        UA Secure Conversation Message: BrowseResponse                  60001   62502

Frame 126: 226 bytes on wire (1808 bits), 226 bytes captured (1808 bits) on interface \Device\NPF_{AF38AF37-B5CF-4E8F-867B-264BC8F540A8}, id 0
Ethernet II, Src: VMware_f9:fd:da (00:50:56:f9:fd:da), Dst: VMware_c0:b1:ab (00:0c:29:c0:b1:ab)
Internet Protocol Version 4, Src: 100.64.1.122, Dst: 192.168.15.139
Transmission Control Protocol, Src Port: 60001, Dst Port: 62502, Seq: 5649, Ack: 4032, Len: 172
OpcUa Binary Protocol

No.     DeltaTime Time                    Source                Destination           Info                                                            SrcPort DstPort
    127 0.000     2025-07-07 10:34:10.363 192.168.15.139        100.64.1.122          UA Secure Conversation Message: ReadRequest                     62502   60001

Frame 127: 324 bytes on wire (2592 bits), 324 bytes captured (2592 bits) on interface \Device\NPF_{AF38AF37-B5CF-4E8F-867B-264BC8F540A8}, id 0
Ethernet II, Src: VMware_c0:b1:ab (00:0c:29:c0:b1:ab), Dst: VMware_f9:fd:da (00:50:56:f9:fd:da)
Internet Protocol Version 4, Src: 192.168.15.139, Dst: 100.64.1.122
Transmission Control Protocol, Src Port: 62502, Dst Port: 60001, Seq: 4032, Ack: 5821, Len: 270
OpcUa Binary Protocol

No.     DeltaTime Time                    Source                Destination           Info                                                            SrcPort DstPort
    129 0.026     2025-07-07 10:34:10.389 100.64.1.122          192.168.15.139        UA Secure Conversation Message: ReadResponse                    60001   62502

Frame 129: 205 bytes on wire (1640 bits), 205 bytes captured (1640 bits) on interface \Device\NPF_{AF38AF37-B5CF-4E8F-867B-264BC8F540A8}, id 0
Ethernet II, Src: VMware_f9:fd:da (00:50:56:f9:fd:da), Dst: VMware_c0:b1:ab (00:0c:29:c0:b1:ab)
Internet Protocol Version 4, Src: 100.64.1.122, Dst: 192.168.15.139
Transmission Control Protocol, Src Port: 60001, Dst Port: 62502, Seq: 5821, Ack: 4302, Len: 151
OpcUa Binary Protocol

No.     DeltaTime Time                    Source                Destination           Info                                                            SrcPort DstPort
    130 0.000     2025-07-07 10:34:10.389 192.168.15.139        100.64.1.122          UA Secure Conversation Message: BrowseRequest                   62502   60001

Frame 130: 187 bytes on wire (1496 bits), 187 bytes captured (1496 bits) on interface \Device\NPF_{AF38AF37-B5CF-4E8F-867B-264BC8F540A8}, id 0
Ethernet II, Src: VMware_c0:b1:ab (00:0c:29:c0:b1:ab), Dst: VMware_f9:fd:da (00:50:56:f9:fd:da)
Internet Protocol Version 4, Src: 192.168.15.139, Dst: 100.64.1.122
Transmission Control Protocol, Src Port: 62502, Dst Port: 60001, Seq: 4302, Ack: 5972, Len: 133
OpcUa Binary Protocol

No.     DeltaTime Time                    Source                Destination           Info                                                            SrcPort DstPort
    132 0.024     2025-07-07 10:34:10.414 100.64.1.122          192.168.15.139        UA Secure Conversation Message: BrowseResponse                  60001   62502

Frame 132: 144 bytes on wire (1152 bits), 144 bytes captured (1152 bits) on interface \Device\NPF_{AF38AF37-B5CF-4E8F-867B-264BC8F540A8}, id 0
Ethernet II, Src: VMware_f9:fd:da (00:50:56:f9:fd:da), Dst: VMware_c0:b1:ab (00:0c:29:c0:b1:ab)
Internet Protocol Version 4, Src: 100.64.1.122, Dst: 192.168.15.139
Transmission Control Protocol, Src Port: 60001, Dst Port: 62502, Seq: 5972, Ack: 4435, Len: 90
OpcUa Binary Protocol

No.     DeltaTime Time                    Source                Destination           Info                                                            SrcPort DstPort
    133 0.000     2025-07-07 10:34:10.414 192.168.15.139        100.64.1.122          UA Secure Conversation Message: ReadRequest                     62502   60001

Frame 133: 324 bytes on wire (2592 bits), 324 bytes captured (2592 bits) on interface \Device\NPF_{AF38AF37-B5CF-4E8F-867B-264BC8F540A8}, id 0
Ethernet II, Src: VMware_c0:b1:ab (00:0c:29:c0:b1:ab), Dst: VMware_f9:fd:da (00:50:56:f9:fd:da)
Internet Protocol Version 4, Src: 192.168.15.139, Dst: 100.64.1.122
Transmission Control Protocol, Src Port: 62502, Dst Port: 60001, Seq: 4435, Ack: 6062, Len: 270
OpcUa Binary Protocol

No.     DeltaTime Time                    Source                Destination           Info                                                            SrcPort DstPort
    135 0.022     2025-07-07 10:34:10.437 100.64.1.122          192.168.15.139        UA Secure Conversation Message: ReadResponse                    60001   62502

Frame 135: 242 bytes on wire (1936 bits), 242 bytes captured (1936 bits) on interface \Device\NPF_{AF38AF37-B5CF-4E8F-867B-264BC8F540A8}, id 0
Ethernet II, Src: VMware_f9:fd:da (00:50:56:f9:fd:da), Dst: VMware_c0:b1:ab (00:0c:29:c0:b1:ab)
Internet Protocol Version 4, Src: 100.64.1.122, Dst: 192.168.15.139
Transmission Control Protocol, Src Port: 60001, Dst Port: 62502, Seq: 6062, Ack: 4705, Len: 188
OpcUa Binary Protocol

No.     DeltaTime Time                    Source                Destination           Info                                                            SrcPort DstPort
    136 0.000     2025-07-07 10:34:10.438 192.168.15.139        100.64.1.122          UA Secure Conversation Message: BrowseRequest                   62502   60001

Frame 136: 187 bytes on wire (1496 bits), 187 bytes captured (1496 bits) on interface \Device\NPF_{AF38AF37-B5CF-4E8F-867B-264BC8F540A8}, id 0
Ethernet II, Src: VMware_c0:b1:ab (00:0c:29:c0:b1:ab), Dst: VMware_f9:fd:da (00:50:56:f9:fd:da)
Internet Protocol Version 4, Src: 192.168.15.139, Dst: 100.64.1.122
Transmission Control Protocol, Src Port: 62502, Dst Port: 60001, Seq: 4705, Ack: 6250, Len: 133
OpcUa Binary Protocol

No.     DeltaTime Time                    Source                Destination           Info                                                            SrcPort DstPort
    138 0.023     2025-07-07 10:34:10.461 100.64.1.122          192.168.15.139        UA Secure Conversation Message: BrowseResponse                  60001   62502

Frame 138: 144 bytes on wire (1152 bits), 144 bytes captured (1152 bits) on interface \Device\NPF_{AF38AF37-B5CF-4E8F-867B-264BC8F540A8}, id 0
Ethernet II, Src: VMware_f9:fd:da (00:50:56:f9:fd:da), Dst: VMware_c0:b1:ab (00:0c:29:c0:b1:ab)
Internet Protocol Version 4, Src: 100.64.1.122, Dst: 192.168.15.139
Transmission Control Protocol, Src Port: 60001, Dst Port: 62502, Seq: 6250, Ack: 4838, Len: 90
OpcUa Binary Protocol

No.     DeltaTime Time                    Source                Destination           Info                                                            SrcPort DstPort
    139 0.000     2025-07-07 10:34:10.462 192.168.15.139        100.64.1.122          UA Secure Conversation Message: ReadRequest                     62502   60001

Frame 139: 324 bytes on wire (2592 bits), 324 bytes captured (2592 bits) on interface \Device\NPF_{AF38AF37-B5CF-4E8F-867B-264BC8F540A8}, id 0
Ethernet II, Src: VMware_c0:b1:ab (00:0c:29:c0:b1:ab), Dst: VMware_f9:fd:da (00:50:56:f9:fd:da)
Internet Protocol Version 4, Src: 192.168.15.139, Dst: 100.64.1.122
Transmission Control Protocol, Src Port: 62502, Dst Port: 60001, Seq: 4838, Ack: 6340, Len: 270
OpcUa Binary Protocol

No.     DeltaTime Time                    Source                Destination           Info                                                            SrcPort DstPort
    141 0.024     2025-07-07 10:34:10.487 100.64.1.122          192.168.15.139        UA Secure Conversation Message: ReadResponse                    60001   62502

Frame 141: 186 bytes on wire (1488 bits), 186 bytes captured (1488 bits) on interface \Device\NPF_{AF38AF37-B5CF-4E8F-867B-264BC8F540A8}, id 0
Ethernet II, Src: VMware_f9:fd:da (00:50:56:f9:fd:da), Dst: VMware_c0:b1:ab (00:0c:29:c0:b1:ab)
Internet Protocol Version 4, Src: 100.64.1.122, Dst: 192.168.15.139
Transmission Control Protocol, Src Port: 60001, Dst Port: 62502, Seq: 6340, Ack: 5108, Len: 132
OpcUa Binary Protocol

No.     DeltaTime Time                    Source                Destination           Info                                                            SrcPort DstPort
    142 0.000     2025-07-07 10:34:10.488 192.168.15.139        100.64.1.122          UA Secure Conversation Message: BrowseRequest                   62502   60001

Frame 142: 187 bytes on wire (1496 bits), 187 bytes captured (1496 bits) on interface \Device\NPF_{AF38AF37-B5CF-4E8F-867B-264BC8F540A8}, id 0
Ethernet II, Src: VMware_c0:b1:ab (00:0c:29:c0:b1:ab), Dst: VMware_f9:fd:da (00:50:56:f9:fd:da)
Internet Protocol Version 4, Src: 192.168.15.139, Dst: 100.64.1.122
Transmission Control Protocol, Src Port: 62502, Dst Port: 60001, Seq: 5108, Ack: 6472, Len: 133
OpcUa Binary Protocol

No.     DeltaTime Time                    Source                Destination           Info                                                            SrcPort DstPort
    144 0.025     2025-07-07 10:34:10.514 100.64.1.122          192.168.15.139        UA Secure Conversation Message: BrowseResponse                  60001   62502

Frame 144: 126 bytes on wire (1008 bits), 126 bytes captured (1008 bits) on interface \Device\NPF_{AF38AF37-B5CF-4E8F-867B-264BC8F540A8}, id 0
Ethernet II, Src: VMware_f9:fd:da (00:50:56:f9:fd:da), Dst: VMware_c0:b1:ab (00:0c:29:c0:b1:ab)
Internet Protocol Version 4, Src: 100.64.1.122, Dst: 192.168.15.139
Transmission Control Protocol, Src Port: 60001, Dst Port: 62502, Seq: 6472, Ack: 5241, Len: 72
OpcUa Binary Protocol

No.     DeltaTime Time                    Source                Destination           Info                                                            SrcPort DstPort
    145 0.001     2025-07-07 10:34:10.515 192.168.15.139        100.64.1.122          UA Secure Conversation Message: BrowseRequest                   62502   60001

Frame 145: 187 bytes on wire (1496 bits), 187 bytes captured (1496 bits) on interface \Device\NPF_{AF38AF37-B5CF-4E8F-867B-264BC8F540A8}, id 0
Ethernet II, Src: VMware_c0:b1:ab (00:0c:29:c0:b1:ab), Dst: VMware_f9:fd:da (00:50:56:f9:fd:da)
Internet Protocol Version 4, Src: 192.168.15.139, Dst: 100.64.1.122
Transmission Control Protocol, Src Port: 62502, Dst Port: 60001, Seq: 5241, Ack: 6544, Len: 133
OpcUa Binary Protocol

No.     DeltaTime Time                    Source                Destination           Info                                                            SrcPort DstPort
    147 0.031     2025-07-07 10:34:10.546 100.64.1.122          192.168.15.139        UA Secure Conversation Message: BrowseResponse                  60001   62502

Frame 147: 277 bytes on wire (2216 bits), 277 bytes captured (2216 bits) on interface \Device\NPF_{AF38AF37-B5CF-4E8F-867B-264BC8F540A8}, id 0
Ethernet II, Src: VMware_f9:fd:da (00:50:56:f9:fd:da), Dst: VMware_c0:b1:ab (00:0c:29:c0:b1:ab)
Internet Protocol Version 4, Src: 100.64.1.122, Dst: 192.168.15.139
Transmission Control Protocol, Src Port: 60001, Dst Port: 62502, Seq: 6544, Ack: 5374, Len: 223
OpcUa Binary Protocol

No.     DeltaTime Time                    Source                Destination           Info                                                            SrcPort DstPort
    148 0.012     2025-07-07 10:34:10.559 192.168.15.139        100.64.1.122          UA Secure Conversation Message: ReadRequest                     62502   60001

Frame 148: 344 bytes on wire (2752 bits), 344 bytes captured (2752 bits) on interface \Device\NPF_{AF38AF37-B5CF-4E8F-867B-264BC8F540A8}, id 0
Ethernet II, Src: VMware_c0:b1:ab (00:0c:29:c0:b1:ab), Dst: VMware_f9:fd:da (00:50:56:f9:fd:da)
Internet Protocol Version 4, Src: 192.168.15.139, Dst: 100.64.1.122
Transmission Control Protocol, Src Port: 62502, Dst Port: 60001, Seq: 5374, Ack: 6767, Len: 290
OpcUa Binary Protocol

No.     DeltaTime Time                    Source                Destination           Info                                                            SrcPort DstPort
    150 0.028     2025-07-07 10:34:10.587 100.64.1.122          192.168.15.139        UA Secure Conversation Message: ReadResponse                    60001   62502

Frame 150: 190 bytes on wire (1520 bits), 190 bytes captured (1520 bits) on interface \Device\NPF_{AF38AF37-B5CF-4E8F-867B-264BC8F540A8}, id 0
Ethernet II, Src: VMware_f9:fd:da (00:50:56:f9:fd:da), Dst: VMware_c0:b1:ab (00:0c:29:c0:b1:ab)
Internet Protocol Version 4, Src: 100.64.1.122, Dst: 192.168.15.139
Transmission Control Protocol, Src Port: 60001, Dst Port: 62502, Seq: 6767, Ack: 5664, Len: 136
OpcUa Binary Protocol

No.     DeltaTime Time                    Source                Destination           Info                                                            SrcPort DstPort
    151 0.000     2025-07-07 10:34:10.588 192.168.15.139        100.64.1.122          UA Secure Conversation Message: BrowseRequest                   62502   60001

Frame 151: 189 bytes on wire (1512 bits), 189 bytes captured (1512 bits) on interface \Device\NPF_{AF38AF37-B5CF-4E8F-867B-264BC8F540A8}, id 0
Ethernet II, Src: VMware_c0:b1:ab (00:0c:29:c0:b1:ab), Dst: VMware_f9:fd:da (00:50:56:f9:fd:da)
Internet Protocol Version 4, Src: 192.168.15.139, Dst: 100.64.1.122
Transmission Control Protocol, Src Port: 62502, Dst Port: 60001, Seq: 5664, Ack: 6903, Len: 135
OpcUa Binary Protocol

No.     DeltaTime Time                    Source                Destination           Info                                                            SrcPort DstPort
