No.     DeltaTime Time                    Source                Destination           Info                                                            SrcPort DstPort
     42 0.000     2025-07-07 11:49:50.495 192.168.15.139        100.64.1.122          Hello message                                                   58610   49320

Frame 42: 125 bytes on wire (1000 bits), 125 bytes captured (1000 bits) on interface \Device\NPF_{AF38AF37-B5CF-4E8F-867B-264BC8F540A8}, id 0
Ethernet II, Src: VMware_c0:b1:ab (00:0c:29:c0:b1:ab), Dst: VMware_f9:fd:da (00:50:56:f9:fd:da)
Internet Protocol Version 4, Src: 192.168.15.139, Dst: 100.64.1.122
Transmission Control Protocol, Src Port: 58610, Dst Port: 49320, Seq: 1, Ack: 1, Len: 71
OpcUa Binary Protocol
    Message Type: HEL
    Chunk Type: F
    Message Size: 71
    Version: 0
    ReceiveBufferSize: 65536
    SendBufferSize: 65536
    MaxMessageSize: 16777216
    MaxChunkCount: 5000
    EndpointUrl: opc.tcp://GYANDE2L.ptcnet.ptc.com:49320

No.     DeltaTime Time                    Source                Destination           Info                                                            SrcPort DstPort
     44 0.030     2025-07-07 11:49:50.526 100.64.1.122          192.168.15.139        Acknowledge message                                             49320   58610

Frame 44: 82 bytes on wire (656 bits), 82 bytes captured (656 bits) on interface \Device\NPF_{AF38AF37-B5CF-4E8F-867B-264BC8F540A8}, id 0
Ethernet II, Src: VMware_f9:fd:da (00:50:56:f9:fd:da), Dst: VMware_c0:b1:ab (00:0c:29:c0:b1:ab)
Internet Protocol Version 4, Src: 100.64.1.122, Dst: 192.168.15.139
Transmission Control Protocol, Src Port: 49320, Dst Port: 58610, Seq: 1, Ack: 72, Len: 28
OpcUa Binary Protocol
    Message Type: ACK
    Chunk Type: F
    Message Size: 28
    Version: 0
    ReceiveBufferSize: 65536
    SendBufferSize: 65536
    MaxMessageSize: 16777216
    MaxChunkCount: 5000

No.     DeltaTime Time                    Source                Destination           Info                                                            SrcPort DstPort
     45 0.000     2025-07-07 11:49:50.526 192.168.15.139        100.64.1.122          OpenSecureChannel message: OpenSecureChannelRequest             58610   49320

Frame 45: 187 bytes on wire (1496 bits), 187 bytes captured (1496 bits) on interface \Device\NPF_{AF38AF37-B5CF-4E8F-867B-264BC8F540A8}, id 0
Ethernet II, Src: VMware_c0:b1:ab (00:0c:29:c0:b1:ab), Dst: VMware_f9:fd:da (00:50:56:f9:fd:da)
Internet Protocol Version 4, Src: 192.168.15.139, Dst: 100.64.1.122
Transmission Control Protocol, Src Port: 58610, Dst Port: 49320, Seq: 72, Ack: 29, Len: 133
OpcUa Binary Protocol
    Message Type: OPN
    Chunk Type: F
    Message Size: 133
    SecureChannelId: 0
    SecurityPolicyUri: http://opcfoundation.org/UA/SecurityPolicy#None
    SenderCertificate: <MISSING>[OpcUa Null ByteString]
    ReceiverCertificateThumbprint: <MISSING>[OpcUa Null ByteString]
    SequenceNumber: 1
    RequestId: 1
    Message : Encodeable Object
        TypeId : ExpandedNodeId
        OpenSecureChannelRequest

No.     DeltaTime Time                    Source                Destination           Info                                                            SrcPort DstPort
     56 0.018     2025-07-07 11:49:50.545 100.64.1.122          192.168.15.139        OpenSecureChannel message: OpenSecureChannelResponse            49320   58610

Frame 56: 189 bytes on wire (1512 bits), 189 bytes captured (1512 bits) on interface \Device\NPF_{AF38AF37-B5CF-4E8F-867B-264BC8F540A8}, id 0
Ethernet II, Src: VMware_f9:fd:da (00:50:56:f9:fd:da), Dst: VMware_c0:b1:ab (00:0c:29:c0:b1:ab)
Internet Protocol Version 4, Src: 100.64.1.122, Dst: 192.168.15.139
Transmission Control Protocol, Src Port: 49320, Dst Port: 58610, Seq: 29, Ack: 205, Len: 135
OpcUa Binary Protocol
    Message Type: OPN
    Chunk Type: F
    Message Size: 135
    SecureChannelId: 3444683871
    SecurityPolicyUri: http://opcfoundation.org/UA/SecurityPolicy#None
    SenderCertificate: <MISSING>[OpcUa Null ByteString]
    ReceiverCertificateThumbprint: <MISSING>[OpcUa Null ByteString]
    SequenceNumber: 512
    RequestId: 1
    Message : Encodeable Object
        TypeId : ExpandedNodeId
        OpenSecureChannelResponse

No.     DeltaTime Time                    Source                Destination           Info                                                            SrcPort DstPort
     57 0.000     2025-07-07 11:49:50.545 192.168.15.139        100.64.1.122          UA Secure Conversation Message: GetEndpointsRequest             58610   49320

Frame 57: 162 bytes on wire (1296 bits), 162 bytes captured (1296 bits) on interface \Device\NPF_{AF38AF37-B5CF-4E8F-867B-264BC8F540A8}, id 0
Ethernet II, Src: VMware_c0:b1:ab (00:0c:29:c0:b1:ab), Dst: VMware_f9:fd:da (00:50:56:f9:fd:da)
Internet Protocol Version 4, Src: 192.168.15.139, Dst: 100.64.1.122
Transmission Control Protocol, Src Port: 58610, Dst Port: 49320, Seq: 205, Ack: 164, Len: 108
OpcUa Binary Protocol
    Message Type: MSG
    Chunk Type: F
    Message Size: 108
    SecureChannelId: 3444683871
    Security Token Id: 1
    Security Sequence Number: 2
    Security RequestId: 2
    OpcUa Service : Encodeable Object
        TypeId : ExpandedNodeId
        GetEndpointsRequest

No.     DeltaTime Time                    Source                Destination           Info                                                            SrcPort DstPort
     62 0.021     2025-07-07 11:49:50.566 100.64.1.122          192.168.15.139        UA Secure Conversation Message: GetEndpointsResponse            49320   58610

Frame 62: 1014 bytes on wire (8112 bits), 1014 bytes captured (8112 bits) on interface \Device\NPF_{AF38AF37-B5CF-4E8F-867B-264BC8F540A8}, id 0
Ethernet II, Src: VMware_f9:fd:da (00:50:56:f9:fd:da), Dst: VMware_c0:b1:ab (00:0c:29:c0:b1:ab)
Internet Protocol Version 4, Src: 100.64.1.122, Dst: 192.168.15.139
Transmission Control Protocol, Src Port: 49320, Dst Port: 58610, Seq: 1200, Ack: 313, Len: 960
[3 Reassembled TCP Segments (1996 bytes): #59(271), #60(765), #62(960)]
OpcUa Binary Protocol
    Message Type: MSG
    Chunk Type: F
    Message Size: 1996
    SecureChannelId: 3444683871
    Security Token Id: 1
    Security Sequence Number: 513
    Security RequestId: 2
    OpcUa Service : Encodeable Object
        TypeId : ExpandedNodeId
        GetEndpointsResponse

No.     DeltaTime Time                    Source                Destination           Info                                                            SrcPort DstPort
     63 0.000     2025-07-07 11:49:50.566 192.168.15.139        100.64.1.122          CloseSecureChannel message: CloseSecureChannelRequest           58610   49320

Frame 63: 111 bytes on wire (888 bits), 111 bytes captured (888 bits) on interface \Device\NPF_{AF38AF37-B5CF-4E8F-867B-264BC8F540A8}, id 0
Ethernet II, Src: VMware_c0:b1:ab (00:0c:29:c0:b1:ab), Dst: VMware_f9:fd:da (00:50:56:f9:fd:da)
Internet Protocol Version 4, Src: 192.168.15.139, Dst: 100.64.1.122
Transmission Control Protocol, Src Port: 58610, Dst Port: 49320, Seq: 313, Ack: 2160, Len: 57
OpcUa Binary Protocol
    Message Type: CLO
    Chunk Type: F
    Message Size: 57
    SecureChannelId: 3444683871
    Security Token Id: 1
    Security Sequence Number: 3
    Security RequestId: 3
    Message : Encodeable Object
        TypeId : ExpandedNodeId
        CloseSecureChannelRequest

No.     DeltaTime Time                    Source                Destination           Info                                                            SrcPort DstPort
     71 0.045     2025-07-07 11:49:50.612 192.168.15.139        100.64.1.122          Hello message                                                   58611   49320

Frame 71: 125 bytes on wire (1000 bits), 125 bytes captured (1000 bits) on interface \Device\NPF_{AF38AF37-B5CF-4E8F-867B-264BC8F540A8}, id 0
Ethernet II, Src: VMware_c0:b1:ab (00:0c:29:c0:b1:ab), Dst: VMware_f9:fd:da (00:50:56:f9:fd:da)
Internet Protocol Version 4, Src: 192.168.15.139, Dst: 100.64.1.122
Transmission Control Protocol, Src Port: 58611, Dst Port: 49320, Seq: 1, Ack: 1, Len: 71
OpcUa Binary Protocol
    Message Type: HEL
    Chunk Type: F
    Message Size: 71
    Version: 0
    ReceiveBufferSize: 65536
    SendBufferSize: 65536
    MaxMessageSize: 16777216
    MaxChunkCount: 5000
    EndpointUrl: opc.tcp://GYANDE2L.ptcnet.ptc.com:49320

No.     DeltaTime Time                    Source                Destination           Info                                                            SrcPort DstPort
     73 0.034     2025-07-07 11:49:50.647 100.64.1.122          192.168.15.139        Acknowledge message                                             49320   58611

Frame 73: 82 bytes on wire (656 bits), 82 bytes captured (656 bits) on interface \Device\NPF_{AF38AF37-B5CF-4E8F-867B-264BC8F540A8}, id 0
Ethernet II, Src: VMware_f9:fd:da (00:50:56:f9:fd:da), Dst: VMware_c0:b1:ab (00:0c:29:c0:b1:ab)
Internet Protocol Version 4, Src: 100.64.1.122, Dst: 192.168.15.139
Transmission Control Protocol, Src Port: 49320, Dst Port: 58611, Seq: 1, Ack: 72, Len: 28
OpcUa Binary Protocol
    Message Type: ACK
    Chunk Type: F
    Message Size: 28
    Version: 0
    ReceiveBufferSize: 65536
    SendBufferSize: 65536
    MaxMessageSize: 16777216
    MaxChunkCount: 5000

No.     DeltaTime Time                    Source                Destination           Info                                                            SrcPort DstPort
     74 0.000     2025-07-07 11:49:50.647 192.168.15.139        100.64.1.122          OpenSecureChannel message: OpenSecureChannelRequest             58611   49320

Frame 74: 187 bytes on wire (1496 bits), 187 bytes captured (1496 bits) on interface \Device\NPF_{AF38AF37-B5CF-4E8F-867B-264BC8F540A8}, id 0
Ethernet II, Src: VMware_c0:b1:ab (00:0c:29:c0:b1:ab), Dst: VMware_f9:fd:da (00:50:56:f9:fd:da)
Internet Protocol Version 4, Src: 192.168.15.139, Dst: 100.64.1.122
Transmission Control Protocol, Src Port: 58611, Dst Port: 49320, Seq: 72, Ack: 29, Len: 133
OpcUa Binary Protocol
    Message Type: OPN
    Chunk Type: F
    Message Size: 133
    SecureChannelId: 0
    SecurityPolicyUri: http://opcfoundation.org/UA/SecurityPolicy#None
    SenderCertificate: <MISSING>[OpcUa Null ByteString]
    ReceiverCertificateThumbprint: <MISSING>[OpcUa Null ByteString]
    SequenceNumber: 1
    RequestId: 1
    Message : Encodeable Object
        TypeId : ExpandedNodeId
        OpenSecureChannelRequest

No.     DeltaTime Time                    Source                Destination           Info                                                            SrcPort DstPort
     76 0.018     2025-07-07 11:49:50.665 100.64.1.122          192.168.15.139        OpenSecureChannel message: OpenSecureChannelResponse            49320   58611

Frame 76: 189 bytes on wire (1512 bits), 189 bytes captured (1512 bits) on interface \Device\NPF_{AF38AF37-B5CF-4E8F-867B-264BC8F540A8}, id 0
Ethernet II, Src: VMware_f9:fd:da (00:50:56:f9:fd:da), Dst: VMware_c0:b1:ab (00:0c:29:c0:b1:ab)
Internet Protocol Version 4, Src: 100.64.1.122, Dst: 192.168.15.139
Transmission Control Protocol, Src Port: 49320, Dst Port: 58611, Seq: 29, Ack: 205, Len: 135
OpcUa Binary Protocol
    Message Type: OPN
    Chunk Type: F
    Message Size: 135
    SecureChannelId: 1947551388
    SecurityPolicyUri: http://opcfoundation.org/UA/SecurityPolicy#None
    SenderCertificate: <MISSING>[OpcUa Null ByteString]
    ReceiverCertificateThumbprint: <MISSING>[OpcUa Null ByteString]
    SequenceNumber: 512
    RequestId: 1
    Message : Encodeable Object
        TypeId : ExpandedNodeId
        OpenSecureChannelResponse

No.     DeltaTime Time                    Source                Destination           Info                                                            SrcPort DstPort
     77 0.000     2025-07-07 11:49:50.665 192.168.15.139        100.64.1.122          UA Secure Conversation Message: CreateSessionRequest            58611   49320

Frame 77: 348 bytes on wire (2784 bits), 348 bytes captured (2784 bits) on interface \Device\NPF_{AF38AF37-B5CF-4E8F-867B-264BC8F540A8}, id 0
Ethernet II, Src: VMware_c0:b1:ab (00:0c:29:c0:b1:ab), Dst: VMware_f9:fd:da (00:50:56:f9:fd:da)
Internet Protocol Version 4, Src: 192.168.15.139, Dst: 100.64.1.122
Transmission Control Protocol, Src Port: 58611, Dst Port: 49320, Seq: 205, Ack: 164, Len: 294
OpcUa Binary Protocol
    Message Type: MSG
    Chunk Type: F
    Message Size: 294
    SecureChannelId: 1947551388
    Security Token Id: 1
    Security Sequence Number: 2
    Security RequestId: 2
    OpcUa Service : Encodeable Object
        TypeId : ExpandedNodeId
        CreateSessionRequest

No.     DeltaTime Time                    Source                Destination           Info                                                            SrcPort DstPort
     88 0.022     2025-07-07 11:49:50.688 100.64.1.122          192.168.15.139        UA Secure Conversation Message: CreateSessionResponse           49320   58611

Frame 88: 406 bytes on wire (3248 bits), 406 bytes captured (3248 bits) on interface \Device\NPF_{AF38AF37-B5CF-4E8F-867B-264BC8F540A8}, id 0
Ethernet II, Src: VMware_f9:fd:da (00:50:56:f9:fd:da), Dst: VMware_c0:b1:ab (00:0c:29:c0:b1:ab)
Internet Protocol Version 4, Src: 100.64.1.122, Dst: 192.168.15.139
Transmission Control Protocol, Src Port: 49320, Dst Port: 58611, Seq: 3240, Ack: 499, Len: 352
[7 Reassembled TCP Segments (3428 bytes): #79(12), #80(514), #82(510), #83(1020), #85(510), #86(510), #88(352)]
OpcUa Binary Protocol
    Message Type: MSG
    Chunk Type: F
    Message Size: 3428
    SecureChannelId: 1947551388
    Security Token Id: 1
    Security Sequence Number: 513
    Security RequestId: 2
    OpcUa Service : Encodeable Object
        TypeId : ExpandedNodeId
        CreateSessionResponse

No.     DeltaTime Time                    Source                Destination           Info                                                            SrcPort DstPort
     89 0.000     2025-07-07 11:49:50.688 192.168.15.139        100.64.1.122          UA Secure Conversation Message: ActivateSessionRequest          58611   49320

Frame 89: 171 bytes on wire (1368 bits), 171 bytes captured (1368 bits) on interface \Device\NPF_{AF38AF37-B5CF-4E8F-867B-264BC8F540A8}, id 0
Ethernet II, Src: VMware_c0:b1:ab (00:0c:29:c0:b1:ab), Dst: VMware_f9:fd:da (00:50:56:f9:fd:da)
Internet Protocol Version 4, Src: 192.168.15.139, Dst: 100.64.1.122
Transmission Control Protocol, Src Port: 58611, Dst Port: 49320, Seq: 499, Ack: 3592, Len: 117
OpcUa Binary Protocol
    Message Type: MSG
    Chunk Type: F
    Message Size: 117
    SecureChannelId: 1947551388
    Security Token Id: 1
    Security Sequence Number: 3
    Security RequestId: 3
    OpcUa Service : Encodeable Object
        TypeId : ExpandedNodeId
        ActivateSessionRequest

No.     DeltaTime Time                    Source                Destination           Info                                                            SrcPort DstPort
     91 0.019     2025-07-07 11:49:50.708 100.64.1.122          192.168.15.139        UA Secure Conversation Message: ActivateSessionResponse         49320   58611

Frame 91: 150 bytes on wire (1200 bits), 150 bytes captured (1200 bits) on interface \Device\NPF_{AF38AF37-B5CF-4E8F-867B-264BC8F540A8}, id 0
Ethernet II, Src: VMware_f9:fd:da (00:50:56:f9:fd:da), Dst: VMware_c0:b1:ab (00:0c:29:c0:b1:ab)
Internet Protocol Version 4, Src: 100.64.1.122, Dst: 192.168.15.139
Transmission Control Protocol, Src Port: 49320, Dst Port: 58611, Seq: 3592, Ack: 616, Len: 96
OpcUa Binary Protocol
    Message Type: MSG
    Chunk Type: F
    Message Size: 96
    SecureChannelId: 1947551388
    Security Token Id: 1
    Security Sequence Number: 514
    Security RequestId: 3
    OpcUa Service : Encodeable Object
        TypeId : ExpandedNodeId
        ActivateSessionResponse

No.     DeltaTime Time                    Source                Destination           Info                                                            SrcPort DstPort
     92 0.000     2025-07-07 11:49:50.708 192.168.15.139        100.64.1.122          UA Secure Conversation Message: ReadRequest                     58611   49320

Frame 92: 168 bytes on wire (1344 bits), 168 bytes captured (1344 bits) on interface \Device\NPF_{AF38AF37-B5CF-4E8F-867B-264BC8F540A8}, id 0
Ethernet II, Src: VMware_c0:b1:ab (00:0c:29:c0:b1:ab), Dst: VMware_f9:fd:da (00:50:56:f9:fd:da)
Internet Protocol Version 4, Src: 192.168.15.139, Dst: 100.64.1.122
Transmission Control Protocol, Src Port: 58611, Dst Port: 49320, Seq: 616, Ack: 3688, Len: 114
OpcUa Binary Protocol
    Message Type: MSG
    Chunk Type: F
    Message Size: 114
    SecureChannelId: 1947551388
    Security Token Id: 1
    Security Sequence Number: 4
    Security RequestId: 4
    OpcUa Service : Encodeable Object
        TypeId : ExpandedNodeId
        ReadRequest

No.     DeltaTime Time                    Source                Destination           Info                                                            SrcPort DstPort
     95 0.084     2025-07-07 11:49:50.792 100.64.1.122          192.168.15.139        UA Secure Conversation Message: ReadResponse                    49320   58611

Frame 95: 108 bytes on wire (864 bits), 108 bytes captured (864 bits) on interface \Device\NPF_{AF38AF37-B5CF-4E8F-867B-264BC8F540A8}, id 0
Ethernet II, Src: VMware_f9:fd:da (00:50:56:f9:fd:da), Dst: VMware_c0:b1:ab (00:0c:29:c0:b1:ab)
Internet Protocol Version 4, Src: 100.64.1.122, Dst: 192.168.15.139
Transmission Control Protocol, Src Port: 49320, Dst Port: 58611, Seq: 3704, Ack: 730, Len: 54
[2 Reassembled TCP Segments (70 bytes): #94(16), #95(54)]
OpcUa Binary Protocol
    Message Type: MSG
    Chunk Type: F
    Message Size: 70
    SecureChannelId: 1947551388
    Security Token Id: 1
    Security Sequence Number: 515
    Security RequestId: 4
    OpcUa Service : Encodeable Object
        TypeId : ExpandedNodeId
        ReadResponse

No.     DeltaTime Time                    Source                Destination           Info                                                            SrcPort DstPort
     97 0.000     2025-07-07 11:49:50.793 192.168.15.139        100.64.1.122          UA Secure Conversation Message: ReadRequest                     58611   49320

Frame 97: 474 bytes on wire (3792 bits), 474 bytes captured (3792 bits) on interface \Device\NPF_{AF38AF37-B5CF-4E8F-867B-264BC8F540A8}, id 0
Ethernet II, Src: VMware_c0:b1:ab (00:0c:29:c0:b1:ab), Dst: VMware_f9:fd:da (00:50:56:f9:fd:da)
Internet Protocol Version 4, Src: 192.168.15.139, Dst: 100.64.1.122
Transmission Control Protocol, Src Port: 58611, Dst Port: 49320, Seq: 730, Ack: 3758, Len: 420
OpcUa Binary Protocol
    Message Type: MSG
    Chunk Type: F
    Message Size: 420
    SecureChannelId: 1947551388
    Security Token Id: 1
    Security Sequence Number: 5
    Security RequestId: 5
    OpcUa Service : Encodeable Object
        TypeId : ExpandedNodeId
        ReadRequest

No.     DeltaTime Time                    Source                Destination           Info                                                            SrcPort DstPort
     99 0.019     2025-07-07 11:49:50.812 100.64.1.122          192.168.15.139        UA Secure Conversation Message: ReadResponse                    49320   58611

Frame 99: 343 bytes on wire (2744 bits), 343 bytes captured (2744 bits) on interface \Device\NPF_{AF38AF37-B5CF-4E8F-867B-264BC8F540A8}, id 0
Ethernet II, Src: VMware_f9:fd:da (00:50:56:f9:fd:da), Dst: VMware_c0:b1:ab (00:0c:29:c0:b1:ab)
Internet Protocol Version 4, Src: 100.64.1.122, Dst: 192.168.15.139
Transmission Control Protocol, Src Port: 49320, Dst Port: 58611, Seq: 3758, Ack: 1150, Len: 289
OpcUa Binary Protocol
    Message Type: MSG
    Chunk Type: F
    Message Size: 289
    SecureChannelId: 1947551388
    Security Token Id: 1
    Security Sequence Number: 516
    Security RequestId: 5
    OpcUa Service : Encodeable Object
        TypeId : ExpandedNodeId
        ReadResponse

No.     DeltaTime Time                    Source                Destination           Info                                                            SrcPort DstPort
    100 0.002     2025-07-07 11:49:50.814 192.168.15.139        100.64.1.122          UA Secure Conversation Message: BrowseRequest                   58611   49320

Frame 100: 155 bytes on wire (1240 bits), 155 bytes captured (1240 bits) on interface \Device\NPF_{AF38AF37-B5CF-4E8F-867B-264BC8F540A8}, id 0
Ethernet II, Src: VMware_c0:b1:ab (00:0c:29:c0:b1:ab), Dst: VMware_f9:fd:da (00:50:56:f9:fd:da)
Internet Protocol Version 4, Src: 192.168.15.139, Dst: 100.64.1.122
Transmission Control Protocol, Src Port: 58611, Dst Port: 49320, Seq: 1150, Ack: 4047, Len: 101
OpcUa Binary Protocol
    Message Type: MSG
    Chunk Type: F
    Message Size: 101
    SecureChannelId: 1947551388
    Security Token Id: 1
    Security Sequence Number: 6
    Security RequestId: 6
    OpcUa Service : Encodeable Object
        TypeId : ExpandedNodeId
        BrowseRequest
            RequestHeader: RequestHeader
            View: ViewDescription
            RequestedMaxReferencesPerNode: 0
            NodesToBrowse: Array of BrowseDescription
                ArraySize: 1
                [0]: BrowseDescription

No.     DeltaTime Time                    Source                Destination           Info                                                            SrcPort DstPort
    103 0.019     2025-07-07 11:49:50.833 100.64.1.122          192.168.15.139        UA Secure Conversation Message: BrowseResponse                  49320   58611

Frame 103: 518 bytes on wire (4144 bits), 518 bytes captured (4144 bits) on interface \Device\NPF_{AF38AF37-B5CF-4E8F-867B-264BC8F540A8}, id 0
Ethernet II, Src: VMware_f9:fd:da (00:50:56:f9:fd:da), Dst: VMware_c0:b1:ab (00:0c:29:c0:b1:ab)
Internet Protocol Version 4, Src: 100.64.1.122, Dst: 192.168.15.139
Transmission Control Protocol, Src Port: 49320, Dst Port: 58611, Seq: 4063, Ack: 1251, Len: 464
[2 Reassembled TCP Segments (480 bytes): #102(16), #103(464)]
OpcUa Binary Protocol
    Message Type: MSG
    Chunk Type: F
    Message Size: 480
    SecureChannelId: 1947551388
    Security Token Id: 1
    Security Sequence Number: 517
    Security RequestId: 6
    OpcUa Service : Encodeable Object
        TypeId : ExpandedNodeId
        BrowseResponse

No.     DeltaTime Time                    Source                Destination           Info                                                            SrcPort DstPort
    105 0.000     2025-07-07 11:49:50.833 192.168.15.139        100.64.1.122          UA Secure Conversation Message: BrowseRequest                   58611   49320

Frame 105: 269 bytes on wire (2152 bits), 269 bytes captured (2152 bits) on interface \Device\NPF_{AF38AF37-B5CF-4E8F-867B-264BC8F540A8}, id 0
Ethernet II, Src: VMware_c0:b1:ab (00:0c:29:c0:b1:ab), Dst: VMware_f9:fd:da (00:50:56:f9:fd:da)
Internet Protocol Version 4, Src: 192.168.15.139, Dst: 100.64.1.122
Transmission Control Protocol, Src Port: 58611, Dst Port: 49320, Seq: 1251, Ack: 4527, Len: 215
OpcUa Binary Protocol
    Message Type: MSG
    Chunk Type: F
    Message Size: 215
    SecureChannelId: 1947551388
    Security Token Id: 1
    Security Sequence Number: 7
    Security RequestId: 7
    OpcUa Service : Encodeable Object
        TypeId : ExpandedNodeId
        BrowseRequest
            RequestHeader: RequestHeader
            View: ViewDescription
            RequestedMaxReferencesPerNode: 0
            NodesToBrowse: Array of BrowseDescription
                ArraySize: 7
                [0]: BrowseDescription
                [1]: BrowseDescription
                [2]: BrowseDescription
                [3]: BrowseDescription
                [4]: BrowseDescription
                [5]: BrowseDescription
                [6]: BrowseDescription

No.     DeltaTime Time                    Source                Destination           Info                                                            SrcPort DstPort
    108 0.019     2025-07-07 11:49:50.853 100.64.1.122          192.168.15.139        UA Secure Conversation Message: BrowseResponse                  49320   58611

Frame 108: 182 bytes on wire (1456 bits), 182 bytes captured (1456 bits) on interface \Device\NPF_{AF38AF37-B5CF-4E8F-867B-264BC8F540A8}, id 0
Ethernet II, Src: VMware_f9:fd:da (00:50:56:f9:fd:da), Dst: VMware_c0:b1:ab (00:0c:29:c0:b1:ab)
Internet Protocol Version 4, Src: 100.64.1.122, Dst: 192.168.15.139
Transmission Control Protocol, Src Port: 49320, Dst Port: 58611, Seq: 4543, Ack: 1466, Len: 128
[2 Reassembled TCP Segments (144 bytes): #107(16), #108(128)]
OpcUa Binary Protocol
    Message Type: MSG
    Chunk Type: F
    Message Size: 144
    SecureChannelId: 1947551388
    Security Token Id: 1
    Security Sequence Number: 518
    Security RequestId: 7
    OpcUa Service : Encodeable Object
        TypeId : ExpandedNodeId
        BrowseResponse

No.     DeltaTime Time                    Source                Destination           Info                                                            SrcPort DstPort
    110 0.000     2025-07-07 11:49:50.853 192.168.15.139        100.64.1.122          UA Secure Conversation Message: BrowseRequest                   58611   49320

Frame 110: 225 bytes on wire (1800 bits), 225 bytes captured (1800 bits) on interface \Device\NPF_{AF38AF37-B5CF-4E8F-867B-264BC8F540A8}, id 0
Ethernet II, Src: VMware_c0:b1:ab (00:0c:29:c0:b1:ab), Dst: VMware_f9:fd:da (00:50:56:f9:fd:da)
Internet Protocol Version 4, Src: 192.168.15.139, Dst: 100.64.1.122
Transmission Control Protocol, Src Port: 58611, Dst Port: 49320, Seq: 1466, Ack: 4671, Len: 171
OpcUa Binary Protocol
    Message Type: MSG
    Chunk Type: F
    Message Size: 171
    SecureChannelId: 1947551388
    Security Token Id: 1
    Security Sequence Number: 8
    Security RequestId: 8
    OpcUa Service : Encodeable Object
        TypeId : ExpandedNodeId
        BrowseRequest
            RequestHeader: RequestHeader
            View: ViewDescription
            RequestedMaxReferencesPerNode: 0
            NodesToBrowse: Array of BrowseDescription
                ArraySize: 5
                [0]: BrowseDescription
                [1]: BrowseDescription
                [2]: BrowseDescription
                [3]: BrowseDescription
                [4]: BrowseDescription

No.     DeltaTime Time                    Source                Destination           Info                                                            SrcPort DstPort
    113 0.018     2025-07-07 11:49:50.871 100.64.1.122          192.168.15.139        UA Secure Conversation Message: BrowseResponse                  49320   58611

Frame 113: 162 bytes on wire (1296 bits), 162 bytes captured (1296 bits) on interface \Device\NPF_{AF38AF37-B5CF-4E8F-867B-264BC8F540A8}, id 0
Ethernet II, Src: VMware_f9:fd:da (00:50:56:f9:fd:da), Dst: VMware_c0:b1:ab (00:0c:29:c0:b1:ab)
Internet Protocol Version 4, Src: 100.64.1.122, Dst: 192.168.15.139
Transmission Control Protocol, Src Port: 49320, Dst Port: 58611, Seq: 4683, Ack: 1637, Len: 108
[2 Reassembled TCP Segments (120 bytes): #112(12), #113(108)]
OpcUa Binary Protocol
    Message Type: MSG
    Chunk Type: F
    Message Size: 120
    SecureChannelId: 1947551388
    Security Token Id: 1
    Security Sequence Number: 519
    Security RequestId: 8
    OpcUa Service : Encodeable Object
        TypeId : ExpandedNodeId
        BrowseResponse

No.     DeltaTime Time                    Source                Destination           Info                                                            SrcPort DstPort
    115 0.000     2025-07-07 11:49:50.872 192.168.15.139        100.64.1.122          UA Secure Conversation Message: BrowseRequest                   58611   49320

Frame 115: 155 bytes on wire (1240 bits), 155 bytes captured (1240 bits) on interface \Device\NPF_{AF38AF37-B5CF-4E8F-867B-264BC8F540A8}, id 0
Ethernet II, Src: VMware_c0:b1:ab (00:0c:29:c0:b1:ab), Dst: VMware_f9:fd:da (00:50:56:f9:fd:da)
Internet Protocol Version 4, Src: 192.168.15.139, Dst: 100.64.1.122
Transmission Control Protocol, Src Port: 58611, Dst Port: 49320, Seq: 1637, Ack: 4791, Len: 101
OpcUa Binary Protocol
    Message Type: MSG
    Chunk Type: F
    Message Size: 101
    SecureChannelId: 1947551388
    Security Token Id: 1
    Security Sequence Number: 9
    Security RequestId: 9
    OpcUa Service : Encodeable Object
        TypeId : ExpandedNodeId
        BrowseRequest
            RequestHeader: RequestHeader
            View: ViewDescription
            RequestedMaxReferencesPerNode: 65536
            NodesToBrowse: Array of BrowseDescription
                ArraySize: 1
                [0]: BrowseDescription

No.     DeltaTime Time                    Source                Destination           Info                                                            SrcPort DstPort
    117 0.018     2025-07-07 11:49:50.890 100.64.1.122          192.168.15.139        UA Secure Conversation Message: BrowseResponse                  49320   58611

Frame 117: 126 bytes on wire (1008 bits), 126 bytes captured (1008 bits) on interface \Device\NPF_{AF38AF37-B5CF-4E8F-867B-264BC8F540A8}, id 0
Ethernet II, Src: VMware_f9:fd:da (00:50:56:f9:fd:da), Dst: VMware_c0:b1:ab (00:0c:29:c0:b1:ab)
Internet Protocol Version 4, Src: 100.64.1.122, Dst: 192.168.15.139
Transmission Control Protocol, Src Port: 49320, Dst Port: 58611, Seq: 4791, Ack: 1738, Len: 72
OpcUa Binary Protocol
    Message Type: MSG
    Chunk Type: F
    Message Size: 72
    SecureChannelId: 1947551388
    Security Token Id: 1
    Security Sequence Number: 520
    Security RequestId: 9
    OpcUa Service : Encodeable Object
        TypeId : ExpandedNodeId
        BrowseResponse

No.     DeltaTime Time                    Source                Destination           Info                                                            SrcPort DstPort
    118 0.000     2025-07-07 11:49:50.891 192.168.15.139        100.64.1.122          UA Secure Conversation Message: ReadRequest                     58611   49320

Frame 118: 150 bytes on wire (1200 bits), 150 bytes captured (1200 bits) on interface \Device\NPF_{AF38AF37-B5CF-4E8F-867B-264BC8F540A8}, id 0
Ethernet II, Src: VMware_c0:b1:ab (00:0c:29:c0:b1:ab), Dst: VMware_f9:fd:da (00:50:56:f9:fd:da)
Internet Protocol Version 4, Src: 192.168.15.139, Dst: 100.64.1.122
Transmission Control Protocol, Src Port: 58611, Dst Port: 49320, Seq: 1738, Ack: 4863, Len: 96
OpcUa Binary Protocol
    Message Type: MSG
    Chunk Type: F
    Message Size: 96
    SecureChannelId: 1947551388
    Security Token Id: 1
    Security Sequence Number: 10
    Security RequestId: 10
    OpcUa Service : Encodeable Object
        TypeId : ExpandedNodeId
        ReadRequest

No.     DeltaTime Time                    Source                Destination           Info                                                            SrcPort DstPort
    120 0.018     2025-07-07 11:49:50.909 100.64.1.122          192.168.15.139        UA Secure Conversation Message: ReadResponse                    49320   58611

Frame 120: 117 bytes on wire (936 bits), 117 bytes captured (936 bits) on interface \Device\NPF_{AF38AF37-B5CF-4E8F-867B-264BC8F540A8}, id 0
Ethernet II, Src: VMware_f9:fd:da (00:50:56:f9:fd:da), Dst: VMware_c0:b1:ab (00:0c:29:c0:b1:ab)
Internet Protocol Version 4, Src: 100.64.1.122, Dst: 192.168.15.139
Transmission Control Protocol, Src Port: 49320, Dst Port: 58611, Seq: 4863, Ack: 1834, Len: 63
OpcUa Binary Protocol
    Message Type: MSG
    Chunk Type: F
    Message Size: 63
    SecureChannelId: 1947551388
    Security Token Id: 1
    Security Sequence Number: 521
    Security RequestId: 10
    OpcUa Service : Encodeable Object
        TypeId : ExpandedNodeId
        ReadResponse

No.     DeltaTime Time                    Source                Destination           Info                                                            SrcPort DstPort
    121 0.000     2025-07-07 11:49:50.909 192.168.15.139        100.64.1.122          UA Secure Conversation Message: CreateSubscriptionRequest       58611   49320

Frame 121: 138 bytes on wire (1104 bits), 138 bytes captured (1104 bits) on interface \Device\NPF_{AF38AF37-B5CF-4E8F-867B-264BC8F540A8}, id 0
Ethernet II, Src: VMware_c0:b1:ab (00:0c:29:c0:b1:ab), Dst: VMware_f9:fd:da (00:50:56:f9:fd:da)
Internet Protocol Version 4, Src: 192.168.15.139, Dst: 100.64.1.122
Transmission Control Protocol, Src Port: 58611, Dst Port: 49320, Seq: 1834, Ack: 4926, Len: 84
OpcUa Binary Protocol
    Message Type: MSG
    Chunk Type: F
    Message Size: 84
    SecureChannelId: 1947551388
    Security Token Id: 1
    Security Sequence Number: 11
    Security RequestId: 11
    OpcUa Service : Encodeable Object
        TypeId : ExpandedNodeId
        CreateSubscriptionRequest

No.     DeltaTime Time                    Source                Destination           Info                                                            SrcPort DstPort
    123 0.019     2025-07-07 11:49:50.929 100.64.1.122          192.168.15.139        UA Secure Conversation Message: CreateSubscriptionResponse      49320   58611

Frame 123: 126 bytes on wire (1008 bits), 126 bytes captured (1008 bits) on interface \Device\NPF_{AF38AF37-B5CF-4E8F-867B-264BC8F540A8}, id 0
Ethernet II, Src: VMware_f9:fd:da (00:50:56:f9:fd:da), Dst: VMware_c0:b1:ab (00:0c:29:c0:b1:ab)
Internet Protocol Version 4, Src: 100.64.1.122, Dst: 192.168.15.139
Transmission Control Protocol, Src Port: 49320, Dst Port: 58611, Seq: 4926, Ack: 1918, Len: 72
OpcUa Binary Protocol
    Message Type: MSG
    Chunk Type: F
    Message Size: 72
    SecureChannelId: 1947551388
    Security Token Id: 1
    Security Sequence Number: 522
    Security RequestId: 11
    OpcUa Service : Encodeable Object
        TypeId : ExpandedNodeId
        CreateSubscriptionResponse

No.     DeltaTime Time                    Source                Destination           Info                                                            SrcPort DstPort
    124 0.000     2025-07-07 11:49:50.929 192.168.15.139        100.64.1.122          UA Secure Conversation Message: CreateMonitoredItemsRequest     58611   49320

Frame 124: 298 bytes on wire (2384 bits), 298 bytes captured (2384 bits) on interface \Device\NPF_{AF38AF37-B5CF-4E8F-867B-264BC8F540A8}, id 0
Ethernet II, Src: VMware_c0:b1:ab (00:0c:29:c0:b1:ab), Dst: VMware_f9:fd:da (00:50:56:f9:fd:da)
Internet Protocol Version 4, Src: 192.168.15.139, Dst: 100.64.1.122
Transmission Control Protocol, Src Port: 58611, Dst Port: 49320, Seq: 1918, Ack: 4998, Len: 244
OpcUa Binary Protocol
    Message Type: MSG
    Chunk Type: F
    Message Size: 244
    SecureChannelId: 1947551388
    Security Token Id: 1
    Security Sequence Number: 12
    Security RequestId: 12
    OpcUa Service : Encodeable Object
        TypeId : ExpandedNodeId
        CreateMonitoredItemsRequest

No.     DeltaTime Time                    Source                Destination           Info                                                            SrcPort DstPort
    127 0.019     2025-07-07 11:49:50.949 100.64.1.122          192.168.15.139        UA Secure Conversation Message: CreateMonitoredItemsResponse    49320   58611

Frame 127: 125 bytes on wire (1000 bits), 125 bytes captured (1000 bits) on interface \Device\NPF_{AF38AF37-B5CF-4E8F-867B-264BC8F540A8}, id 0
Ethernet II, Src: VMware_f9:fd:da (00:50:56:f9:fd:da), Dst: VMware_c0:b1:ab (00:0c:29:c0:b1:ab)
Internet Protocol Version 4, Src: 100.64.1.122, Dst: 192.168.15.139
Transmission Control Protocol, Src Port: 49320, Dst Port: 58611, Seq: 5010, Ack: 2162, Len: 71
[2 Reassembled TCP Segments (83 bytes): #126(12), #127(71)]
OpcUa Binary Protocol
    Message Type: MSG
    Chunk Type: F
    Message Size: 83
    SecureChannelId: 1947551388
    Security Token Id: 1
    Security Sequence Number: 523
    Security RequestId: 12
    OpcUa Service : Encodeable Object
        TypeId : ExpandedNodeId
        CreateMonitoredItemsResponse

No.     DeltaTime Time                    Source                Destination           Info                                                            SrcPort DstPort
    129 0.000     2025-07-07 11:49:50.949 192.168.15.139        100.64.1.122          UA Secure Conversation Message: DeleteSubscriptionsRequest      58611   49320

Frame 129: 124 bytes on wire (992 bits), 124 bytes captured (992 bits) on interface \Device\NPF_{AF38AF37-B5CF-4E8F-867B-264BC8F540A8}, id 0
Ethernet II, Src: VMware_c0:b1:ab (00:0c:29:c0:b1:ab), Dst: VMware_f9:fd:da (00:50:56:f9:fd:da)
Internet Protocol Version 4, Src: 192.168.15.139, Dst: 100.64.1.122
Transmission Control Protocol, Src Port: 58611, Dst Port: 49320, Seq: 2162, Ack: 5081, Len: 70
OpcUa Binary Protocol
    Message Type: MSG
    Chunk Type: F
    Message Size: 70
    SecureChannelId: 1947551388
    Security Token Id: 1
    Security Sequence Number: 13
    Security RequestId: 13
    OpcUa Service : Encodeable Object
        TypeId : ExpandedNodeId
        DeleteSubscriptionsRequest

No.     DeltaTime Time                    Source                Destination           Info                                                            SrcPort DstPort
    135 0.019     2025-07-07 11:49:50.968 100.64.1.122          192.168.15.139        UA Secure Conversation Message: DeleteSubscriptionsResponse     49320   58611

Frame 135: 118 bytes on wire (944 bits), 118 bytes captured (944 bits) on interface \Device\NPF_{AF38AF37-B5CF-4E8F-867B-264BC8F540A8}, id 0
Ethernet II, Src: VMware_f9:fd:da (00:50:56:f9:fd:da), Dst: VMware_c0:b1:ab (00:0c:29:c0:b1:ab)
Internet Protocol Version 4, Src: 100.64.1.122, Dst: 192.168.15.139
Transmission Control Protocol, Src Port: 49320, Dst Port: 58611, Seq: 5081, Ack: 2232, Len: 64
OpcUa Binary Protocol
    Message Type: MSG
    Chunk Type: F
    Message Size: 64
    SecureChannelId: 1947551388
    Security Token Id: 1
    Security Sequence Number: 524
    Security RequestId: 13
    OpcUa Service : Encodeable Object
        TypeId : ExpandedNodeId
        DeleteSubscriptionsResponse

No.     DeltaTime Time                    Source                Destination           Info                                                            SrcPort DstPort
    136 0.001     2025-07-07 11:49:50.969 192.168.15.139        100.64.1.122          UA Secure Conversation Message: BrowseRequest                   58611   49320

Frame 136: 155 bytes on wire (1240 bits), 155 bytes captured (1240 bits) on interface \Device\NPF_{AF38AF37-B5CF-4E8F-867B-264BC8F540A8}, id 0
Ethernet II, Src: VMware_c0:b1:ab (00:0c:29:c0:b1:ab), Dst: VMware_f9:fd:da (00:50:56:f9:fd:da)
Internet Protocol Version 4, Src: 192.168.15.139, Dst: 100.64.1.122
Transmission Control Protocol, Src Port: 58611, Dst Port: 49320, Seq: 2232, Ack: 5145, Len: 101
OpcUa Binary Protocol
    Message Type: MSG
    Chunk Type: F
    Message Size: 101
    SecureChannelId: 1947551388
    Security Token Id: 1
    Security Sequence Number: 14
    Security RequestId: 14
    OpcUa Service : Encodeable Object
        TypeId : ExpandedNodeId
        BrowseRequest
